video_id,title,publishedAt,channelId,channelTitle,categoryId,trending_date,tags,view_count,likes,dislikes,comment_count,thumbnail_link,comments_disabled,ratings_disabled,description
"ShYm046cmc4","I Tested CLICKBAIT Decks of Clash Royale YouTubers- Part 2","2025-08-04T15:15:50Z","UCraJG1NiZLjNDBQLhUZqWAg","Ian77 - Clash Royale","20","25.05.08","clash royale|ian77 cr|ian77 clash royale|best deck|clash royale gameplay|pass royale|chest opening|clash|royale|bluestacks clash royale|royale clash|legendary|clash royale türkiye|türkçe clash royale|clash royale nihai şampiyon|clash royale türkçe|clash royale ita|taktik|ladder|top 1|şampiyon|eğlence|new update|cycle|clashroyale|me activo torre|كلاش رويال|deste|efsanevi|yeni deste|en iyi deste|arena|clash royale en español|kupa videosu|espor|lan77 cr","71362","0","0","188","https://i.ytimg.com/vi/ShYm046cmc4/default.jpg","False","True","Hello, I am Ian77. I am a top player in Clash Royale (a supercell game) aiming to bring you the best clash royale gameplay and the best decks in clash royale. I am also a pro player in clash royale league aka CRL. I play mainly Hog EQ cycle deck on top ladder but here on this channel you will find a wide variety of best decks in Clash Royale like best Hog deck, Miner deck, Logbait deck, Xbow deck, Royal Hogs deck, Pekka deck, Mega Knight deck etc and pro gameplay including Clash Royale Pro tips and tricks which will help you improve in Clash Royale.  I also upload funny clash royale montage from time to time. Subscribe to my channel for daily Clash Royale content featuring the best decks in Clash Royale, top ladder gameplay, Clash Royale tips and tricks, best F2P Clash royale deck and a lot more fun content. Let's Clash in the Arena !!Business Enquiry - collab@thirdrailavenue.com#ClashRoyale #BestClashRoyaleDeck #TopLadder #clashroyalegameplay #hogcycle #hogrider #clashroyal #clash #royale #bestdecks #ian77"
"B5BTQii5DQ8","Going To War With The Casino!","2025-08-05T04:55:55Z","UC-wG2yAtSE9a8j2EQmXAfjg","omfg_slots","22","25.05.08","[none]","96535","0","0","2","https://i.ytimg.com/vi/B5BTQii5DQ8/default.jpg","False","True",""
"AQJ5XuV1iTw","BEAT LEVY'S CARO KANN WITH SLOWKARU!! EDUCATIONAL SPEEDRUN 19","2025-08-04T20:51:44Z","UCweCc7bSMX5J4jEH7HFImng","GMHikaru","20","25.05.08","Hikaru Nakamura|chess instruction|magnus carlsen|chess commentary for beginners|hikaru chess commentary|chess tournament|chess game play|master chess moves|chess speedruns|levy rozman|eric rosen|chess tactics and strategy|chess openings for white|chess openings for black|chess openings gothamchess|speedrun|bongcloud|bongcloud speedrun|hikaru bongcloud|gothamchess|levy|gotham|hans|niemann|hans niemann|kramnik|cheating in chess|cheating chess|cheating","65070","0","0","222","https://i.ytimg.com/vi/AQJ5XuV1iTw/default.jpg","False","True","BEAT LEVY'S CARO KANN WITH SLOWKARU!! EDUCATIONAL RAPID SPEEDRUN 19♖ MEMBERSHIP ►  https://www.youtube.com/channel/UCweCc7bSMX5J4jEH7HFImng/join♟️ LEARN CHESS  & PLAY WITH ME ► https://go.chess.com/hikaru 👍LIVE MOST WEEKDAYS ON KICK ►https://www.kick.com/gmhikaru🎁 GIVE 💎 CHESS ► https://www.chess.com/membership/gift?ref_id=15448422🎞️ VODS AND MORE GMHIKARU ► https://www.youtube.com/c/moregmhikaru💜 TWITCH ► https://www.twitch.tv/gmhikaru📸 INSTAGRAM ► https://www.instagram.com/gmhikaru/🐦 TWITTER ► https://twitter.com/gmhikaru✨ TIKTOK ► https://www.tiktok.com/@gmhikaru💛 DISCORD ► https://discord.com/invite/aeaqK6g💙 FACEBOOK  ►  https://facebook.com/GMHikaru💚 SUPPORT  ► https://streamlabs.com/gmhikaru🤣 REDDIT ► https://www.reddit.com/r/HikaruNakamura/━━━━━━━━━━━━━🎥 Edit and 🎨 Thumbnail ► Airton!! https://www.instagram.com/tomeditor95/👌Channel Management  ► Team Hikaru📧 Global Business contact: TeamGMHikaru@gmail.com #gmhikaru #chess #slowkaru"
"JZTow66UGZE","1 Tip for Every Gun in Valorant","2025-08-04T16:00:35Z","UCv1zbx03PIvqG8cHNpWWWUw","Konpeki","20","25.05.08","konpeki|konpeki coach|konpeki guide|konpeki coaching|konpeki valorant|valorant coaching|how to improve in valorant|valorant guide konpeki|valorant guide|valorant coaching konpeki|how to climb in valorant|valorant tips|how to rank up in valorant|how to get better at valorant|valorant tips and tricks for beginners|valorant tips and tricks|how to climb in valorant ranked|radiant guide valorant|konpeki valorant tips|1 tip for every gun in valorant","80546","0","0","114","https://i.ytimg.com/vi/JZTow66UGZE/default.jpg","False","True","✍️Apply for the Immortal Roadmap Program — 5 DIVISIONS IN 10 WEEKS GUARANTEED:  https://rm.irp.gg/guntipsIn this video, I'll break down 1 tip for every gun in the game. You'll learn how to master each weapon, from the classic all the way to the Odin. You'll also learn why you should probably avoid buying the Spectre.. And how to maximize your chances of getting kills with each gun. If you're looking to climb in ranked, this video is essential to watch; you'll be able to maximize the use of every weapon instead of just relying on 2-3."
"xcjJRTulpdY","its gone.. 💔","2025-08-04T23:19:53Z","UC7c8wbA9yQjzxkj2uyrHrkg","steak","20","25.05.08","[none]","172267","0","0","831","https://i.ytimg.com/vi/xcjJRTulpdY/default.jpg","False","True","🥩⭐STAR CODE STEAK⭐🥩🥩 TALK TO ME: https://discord.gg/dinner 🥩SONG USED: https://www.youtube.com/watch?v=3_-a9nVZYjk&pp=ygUKeGVub2dlbnNpcw%3D%3DFOLLOW ME:🥩 TikTok: https://www.tiktok.com/@steak834🥩 ROBLOX GROUP:  https://www.roblox.com/groups/11659059🥩 Twitter: https://twitter.com/steak834🥩 Instagram: https://www.instagram.com/steak834/SEND ME STUFF:P.O BOX 171002Salt Lake City, UT, 84117"
"Ps03kKQI13Q","Subscriber sent me his game. I'm done. Goodbye. ","2025-08-03T16:05:00Z","UCQHX6ViZmPsWiYSFAyS0a3Q","GothamChess","24","25.05.08","gothamchess|gothamchess london|gothamchess caro kann|gothamchess openings|gothamchess vienna","419209","0","0","1692","https://i.ytimg.com/vi/Ps03kKQI13Q/default.jpg","False","True","Want to SKYROCKET your chess elo? Try Chessly: https://www.chessly.com ➡️ Get my best-selling chess book: https://geni.us/gothamchess➡️ My book in the UK and Europe: https://bit.ly/3qFqSf7➡️ Mein Buch auf Deutsch: https://bit.ly/45fKt3R➡️ Mi libro en Español: https://bit.ly/3Y5xaRx➡️ Mon livre en français: https://bit.ly/3W9rQvQ➡️ Il mio libro in italiano: https://amzn.to/3yY1Qfc➡️ Το βιβλίο μου στα ελληνικά: https://bit.ly/3SitmdS➡️ My book in ALL OTHER LANGUAGES: https://bit.ly/3YiagZd➡️ Start Playing Chess FOR FREE: http://bit.ly/3Xa3EsB➡️ Enjoy my videos? Donate Here : https://www.paypal.me/gothamchessEmail me your games: gothamletters@gmail.comBusiness and Speaking Inquiries: Info@apollomasters.de⭐️ Follow Me If You Are Amazing:➡️ FACEBOOK:  https://www.facebook.com/gothamchessofficial➡️ SNAP: https://www.snapchat.com/add/levy.rozman➡️ INSTAGRAM: https://www.instagram.com/gothamchess/➡️ TWITCH:  https://www.twitch.tv/gothamchess➡️ TIKTOK: https://www.tiktok.com/@levyrozman➡️ TWITTER: https://twitter.com/gothamchess➡️ GOTHAM DISCORD:   https://discord.gg/f2ETqcWKdt➡️ THUMBNAILS by : https://www.instagram.com/agmek.thumbnails"
"-qF5mRRoRd8","The Greatest Spellcaster To Ever Speak!","2025-08-04T19:37:11Z","UCRYZxlAfSqJmY1DLTyQrp8w","ElasticDroid","20","25.05.08","Grizzy|ElasticDroid|twitch highlights|twitch partner|funny moments|gaming|streaming|twitch|twitch moments|twitch funny|elasticdroid funny moments|best twitch clips|top twitch clips|furry|clooless podcast|clooless|mage arena|mage arena funny moments|mage arena first playthrough|mage arena gameplay|mage arena gameplay funny moments|elasticdroid mage arena|wizard game|new wizard game|shadow wizard money gang|spells|spellcasting|spellcasting game","81158","0","0","118","https://i.ytimg.com/vi/-qF5mRRoRd8/default.jpg","False","True","I love casting spells and stuffTurn on notification bell so you wont miss a video! : ]-----------------------------------------------------------BUY BBL! | https://gamersupps.gg/cloolessCheck out the podcast! : ]@CloolessPodcast Use this link for 10% off on your next Gsupps order : ]https://gamersupps.gg/droid -----------------------------------------------------------Twitter - https://twitter.com/ElasticDroidTwitch - https://www.twitch.tv/elasticdroidInstagram - https://www.instagram.com/elasticdroid/Discord - https://discord.gg/elasticdroid-----------------------------------------------------------Previous Video - https://youtu.be/vl4lNDFg24I-----------------------------------------------------------Friends:@Rectrixx @Grizzy @Bigpuffer @Pezzy -----------------------------------------------------------Please Ignore or flag spam, negative, or hateful comments. We're here to have a good time. Thanks :]-----------------------------------------------------------Edited by @ItsRequiemTV -----------------------------------------------------------Thumbnail by https://twitter.com/roboeye5-----------------------------------------------------------Outro song | https://www.youtube.com/watch?v=J1xPtbXdBnU-----------------------------------------------------------#elasticdroid #clooless #magearena"
"oxmD8xFbdoU","SEASON END WATCH PARTY ! - Clash Royale","2025-08-04T09:21:03Z","UCeVQlk4BS29AW2UouY1U6Nw","Ryley LIVE","20","25.05.08","clash royale|clash|royale|clash royal|best deck|ryley|ryley cr|ryley clash royale|best clash royale deck|best deck in clash royale|logbait","204550","0","0","52","https://i.ytimg.com/vi/oxmD8xFbdoU/default.jpg","False","True","In this clash royale video, I push clash royale top ladder with the best clash royale deck. On this clash royale channel, you will find me showcasing the best decks in clash royale including clash royale evolutions."
"2S4r3YqkyTY","I Built a Ridiculous Food Pyramid in 99 Nights in the Forest!","2025-08-04T21:54:35Z","UCPk7uJ4HPmrWTGmcPhBvpAg","AJBLOX","20","25.05.08","99 nights in the forest|roblox|food pyramid|survival food roblox|99 nights update|99 nights base build|best food 99 nights|roblox survival|funny roblox|99 nights in the forest roblox|food ranking roblox|tier list roblox|crafting update|99 nights food guide","138231","0","0","144","https://i.ytimg.com/vi/2S4r3YqkyTY/default.jpg","False","True","I built a Ridiculous food pyramid in 99 Nights in the Forest and trapped a few animals (and some carrots) in it!   Like, Subscribe, and Comment with some future ideas!"
"KrzVRynqfh8","Peterbot Does it Again | MrSavage Qualifies to Globals","2025-08-04T13:17:37Z","UC5aATYG-mEny8VBUzf2TIjQ","AussieAntics","24","25.05.08","fortnite|fortnite battle royale|epic games|comp fortnite|competitive fortnite|sypherpk|sypher|itsjerian|fortnite news|fortnite update|tournament|fortnite tournament|aussie antics|antics with aussie|fortnite drama|Chapter 6|Chapter 6 Season 3|FNCS|FNCS grands|Peterbot FNCS|Peterbot Won FNCS|Clix FNCS|FNCS Recap","124897","0","0","497","https://i.ytimg.com/vi/KrzVRynqfh8/default.jpg","False","True","Play Tournament Late Game - 9833-3189-6755In todays video I will be recapping FNCS Grand Finals. Which teams won? Who has qualified to Globals? Was this the Craziest FNCS Ever?📝 Aussie Antics Socials:🎥 2nd Channel - https://www.youtube.com/channel/UCDf0vu3DCZ-iriwrPRpy5wg🎥 Reacts Channel - https://www.youtube.com/@reactantics🐦 Twitter - https://twitter.com/aussieantics       🎮 Discord - https://discord.gg/aussie➡️ Twitch - https://www.twitch.tv/aussieantics Tiktok - https://tiktok.com/@aussieantics 🎬 Channel Manager & Editor:https://twitter.com/agilefish73Background Footage:https://www.twitch.tv/fortniteBackground Music:https://www.youtube.com/watch?v=Q7HjxOAU5Kc#fortnite #competitivefortnite #chapter6"
"7daB9VFzyec","chicken jockey","2025-08-04T19:00:07Z","UCV6UqWpQfo9bsQ7nRynpmKw","Party Crashers","20","25.05.08","[none]","78416","0","0","491","https://i.ytimg.com/vi/7daB9VFzyec/default.jpg","False","True","Make sure to join our discord server! Here's the invite: https://discord.gg/partycrashersCheck out the fellas here:TCNick3: https://www.youtube.com/@TCNick3Vernias: https://www.youtube.com/@VerniasBrent: https://www.youtube.com/@KingOfSkillSophist: https://www.youtube.com/@SophistEdited by Colin Kelly (iAnimate38): @iAnimate38 #partycrashers #smashultimate #smashbros"
"rx7HfUW-KiY","We Need to Talk About Tales of the Shire... (Full Review)","2025-08-04T21:33:12Z","UC9c3_F0N5V_vcLjN2PJr4yA","Eeowna","20","25.05.08","is tales of the shire good|tales of the shire|new cozy games|cozy gaming|hobbit game gameplay|tales of the shire game|tales of the shire review","33705","0","0","305","https://i.ytimg.com/vi/rx7HfUW-KiY/default.jpg","False","True","A full review of Tales of the Shire on Nintendo Switch 1 and 2, and PC.Follow EeownaInstagram: TikTok: https://bit.ly/3d6rsbd Twitch: https://bit.ly/3G5Zg4KTwitter: https://bit.ly/3Dc2QIT Watch more videos!Cozy Nintendo: https://bit.ly/3qx3yfPNintendo Lists: https://bit.ly/3quRbAXAbout Eeowna:Welcome to the official Eeowna YouTube channel! On this channel you will find a variety of content including Animal Crossing, Nintendo News, Latest Nintendo Releases and more! Make sure to subscribe and enable ALL notifications!#cozygaming #nintendoswitch"
"uug6neWFMuE","Streetwise Exploit Not Important Enough to Killswitch - Dead by Daylight","2025-08-04T20:51:51Z","UCk9gPdY4fbH0BRhyTio9XIg","Scott Jund","20","25.05.08","games|comedy|scott|jund|dead by daylight|dbd|gameplay|funny moments|elden ring|duels|meta|damnnohtml|narrated|thought|elden|ring|Scott Jund|Breaderhood|killer|survivor|highlight|clips|funny|fails|moments|compilation|rage|quit|ragequit|bugs|pro|high mmr|rubberband|lag|shadow|ofthe|erdtree","65890","0","0","1420","https://i.ytimg.com/vi/uug6neWFMuE/default.jpg","False","True","im gonna lose itBuy my game: https://store.steampowered.com/app/3640750/This_is_Interesting/http://www.twitch.tv/scottjund"
"DBARIuoT-ws","AJS News- WB Making ANOTHER Live-Service Game!, Monster Hunter Sales DOWN, Itch.io Censorship & More","2025-08-04T22:00:17Z","UCsgv2QHkT2ljEixyulzOnUQ","AngryJoeShow","20","25.05.08","[none]","37141","0","0","403","https://i.ytimg.com/vi/DBARIuoT-ws/default.jpg","False","True","🦈Secure your privacy with Surfshark! Enter coupon code ANGRYJOESHOW for 4 extramonths at https://surfshark.com/angryjoeshowThe News Crew Discusses WB Making Another Live-Service Game after Disasters, Monster Hunter Sales DOWN, Itch.io Censorship, Switch UP in PRICE, Medium Film upcoming & More!💥Patreon ► https://www.patreon.com/AngryJoeShow🔥YT Join ► https://youtube.com/angryjoeshow/join🔴AngryJoeShowLIVE ► https://bit.ly/38VZ4aY👕 New AJSA Shirts! ► http://bit.ly/2m2YJNq📺Twitch ► http://twitch.tv/angryjoeshow🐦Twitter ► http://twitter.com/AngryJoeShow🐦Twitter ► http://twitter.com/OtherJoe_AJS🌎AJSA Community ► http://ajsagaming.com"
"FXt7ljOEZZE","This DNA Almost Ruined Me...","2025-08-05T01:00:13Z","UCLnar-aS8iHa2ldj1w_pgJQ","Roffle Lite","20","25.05.08","frostprime|rougelike|rougelite|Baalorlord|balatro gameplay|balatro|northernlion|balatro joker tier list|balatro best jokers|balatro best build|balatro stakes|balatro high score|poker roguelike|how to play balatro|balatro best cards|best roguelike games|skootie|balatro university","29668","0","0","92","https://i.ytimg.com/vi/FXt7ljOEZZE/default.jpg","False","True","Hey folks! In today’s video we’re back with more Gold Stake Balatro. Here, the run started out like a typical Gold Stake Pair spam build with Green Joker and Sly Joker until a DNA came into the mix (and nearly killed the run) but did allow me to load my deck full of Queen of Diamonds. Enjoy the video!Balatro is a poker roguelike deck building game centered around creating powerful synergies and winning with big hands. In it, you can combine valid poker hands with unique Jokers in order to create varied synergies and builds. No real money is involved, but you can earn enough chips to beat blinds, including challenging boss blinds, to make it to the next ante and progress your run!Broadcasted live on Twitch -- Watch live at https://www.twitch.tv/roffleLike and Subscribe for more videos!Enjoy the gameplay!#balatro #Gaming #Roffle"
"e0vlVDjLZPc","I Became a HACKER BRAINROT in Minecraft…","2025-08-04T13:01:17Z","UCpHCfDBZ3AJyuofz6DHy-ew","Dash","20","25.05.08","dash|dash minecraft|minecraft|minecraft challenge|aphmau|cash|johnny minecraft|johnny|nico|cash and nico|omz|minecraft mods|minecraft funny|maizen|I Became a HACKER BRAINROT in Minecraft…|roblox","185705","0","0","270","https://i.ytimg.com/vi/e0vlVDjLZPc/default.jpg","False","True","I Became a HACKER BRAINROT in Minecraft…This video Dash, Cam and Koko play Minecraft, and Dash becomes a hacker brainrot! What kind of chaos will he cause? Watch till the end to find out!#Roblox #Dash"
"7ZA0RYA6-VI","Labubu Dubai Chocolate Pee Dream","2025-08-04T20:00:05Z","UCL7DDQWP6x7wy0O6L5ZIgxg","2ndJerma","20","25.05.08","jerma|jerma985|stream|highlight|dreamcore|urge|labubu|dubai chocolate|pee|pee game","79093","0","0","381","https://i.ytimg.com/vi/7ZA0RYA6-VI/default.jpg","False","True","type 1 if you got smorgasboardedEditor: Jack Clishem@JackClishem https://x.com/JackClishemOriginally Streamed August 1st 2025Main Channelhttp://www.youtube.com/jerma985Twitch Stream:http://www.twitch.tv/jerma985"
"fiZLbkTM5oo","🔴 Opening a TON of Pokémon Cards! (Live Stream Replay 08.04.25)","2025-08-05T02:10:24Z","UCnnrLDosqnpRPQ_TH3uXnnQ","Deep Pocket Monster","24","25.05.08","pokemon|pokemon cards|pokemon tcg|pat flynn|pokemon pat flynn|deep pocket monster|pokemon card opening|pokemon card giveaway|pokemon card giveaway 2022|pokemon cards free|giving away pokemon cards|pokemon pack openings|deep pocket monster live|pat flynn pokemon|pokemon cards live stream|pokemon cards unboxing|pokemon cards pokemon cards opening|pokemon card pack opening|vintage pokemon card opening|pokemon live stream|pokemon tcg giveaway","42842","0","0","19","https://i.ytimg.com/vi/fiZLbkTM5oo/default.jpg","False","True","I opened and gave away a TON of booster packs and even some graded cards too! Winners: pokemonrumbledadvsson, SpinallTpp, Kenneth Zubiri, timfrost1386, Pokechu, matthewfoster8848, Ammresh, Snazzy (Alexander)For a chance to enter a future giveaway, make sure you are subscribed to get notified when I stream next.We also have member-only streams that happen each month. If you're NOT a member but would like to join and support the channel, here's a link below:🙌 https://www.youtube.com/channel/UCnnrLDosqnpRPQ_TH3uXnnQ/join🎉 Get your tickets to Card Party in Seattle, October 3-5! Grab your tickets now http://www.card.partyWatch Next:🤣 I Buy WEIRD Pokemon Cards on Etsy: https://youtu.be/oDBMN_XeQWw🔴 SUBSCRIBE for more like this: https://www.youtube.com/channel/UCnnrLDosqnpRPQ_TH3uXnnQ?sub_confirmation=1👉 Join this channel to show support and get access to perks:https://www.youtube.com/channel/UCnnrLDosqnpRPQ_TH3uXnnQ/joinOther videos I recommend you check out:⚠️ Walmart Pokemon Card Scam EXPOSED: https://youtu.be/5KC7Dkpke-A📦 Opening a $945 Pokemon Mystery Box from eBay: https://youtu.be/rKxS1ASUJ1k💰📦 I Paid a Fan $1,000 to Make a Pokemon Mystery Box: https://youtu.be/9mnSF4Cfe60🏆 Unbelievable Trophy Card Pokemon Mystery Box: https://youtu.be/5Qj284gIGQYConnect with me:👋 On Instagram: http://www.instagram.com/patflynn💬 On Twitter: http://www.twitter.com/patflynn💼 Check out my business and entrepreneur-related YouTube channel: http://www.patflynn.com/youtube✉️ Want to send me something in the mail? Thanks! Send it here:Pat Flynn10531 4S Commons Dr STE 524San Diego, CA 92127"
"_vYWNW4HMo0","I Hit the Impossible 10 Crystal Gambit… You Need 4 Emblems!","2025-08-04T21:00:38Z","UCBjwAHVBy23GERptO4S-aHQ","Dishsoap","20","25.05.08","tft dishsoap|tft|teamfight tactics|tft set 15|tft rank 1|tft best augment|tft best comps new set|tft set 15 comps|tft new set 15|tft new set leak|tft new set release|tft new set gameplay|tft K.O. Coliseum|tft new units|tft new update|tft new set reveal|tft world champion|tft new patch|rank 1|tft academy|tft world champ|tft set 15 pbe|tft set 15 new|tftacademy|tft 10 crystal gambit|tft crystal gambit|tft prismatic crytal gambit|tft 3 star 5 cost","52224","0","0","58","https://i.ytimg.com/vi/_vYWNW4HMo0/default.jpg","False","True","TFT New Set 15 Gameplay | K.O. Coliseum GameplayDishsoap on TFT Set 15 picks plays Crystal Gambit and gets 4 EMBLEMS to unlock the Pristmatic 10 Crystal Gambit Trait, making him Farm INFINITE GOLD AND HITTING 3-STAR 5 COSTS EASILY!!You can find all the comps I play on my website TFT Academy:https://tftacademy.com/Live on Twitch: https://www.twitch.tv/dishsoapFollow me on Twitter: https://twitter.com/Dishsoaptft------------------------------------For business inquiries please contact: dishsoap@evolved.gg#dishsoap  #tft  #Comps #set15 #k.o.colisuem"
"t9Bp36CDGmo","This New Dragon Drop in RuneScape Is INSANE!","2025-08-04T19:15:39Z","UCtu2BCnJoFGRBOuIh570QWw","Sodapoppin","20","25.05.08","sodapoppin|chance morris|osrs|old school runescape","44951","0","0","141","https://i.ytimg.com/vi/t9Bp36CDGmo/default.jpg","False","True","▶ Watch me LIVE on: https://twitch.tv/Sodapoppin▶ https://twitter.com/Sodapoppintv▶ Merch store: https://sodapoppin.shop/ Discount code: POOR▶ https://www.instagram.com/sodapoppintv/▶ Full VOD:https://www.twitch.tv/sodapoppin/videos/(stays for 60 days)▶ Starforge:https://starforgepc.com/Soda▶ Community Discordhttps://discordapp.com/invite/sodapoppin▶ Outro Song:Take a break - KUWAGOhttps://kuwago.bandcamp.com/track/take-a-breakUsed under CC BY-ND 3.0 / Trimmed from Original▶Channel manager: vulpeshd@gmail.com▶ BUSINESS EMAIL: sodapoppinbiz@gmail.com and sodapoppin@mythictalent.com"
"0sdjcb5ambU","JE DÉCOUVRE BATTLEFIELD 6 !","2025-08-04T14:48:48Z","UCwDeagCMN0rTg5-r3s9AINA","GotagaTV","20","25.05.08","gota|gotaga|mygota|the|french|monster|pc|ps4|gameplay|xbox|joueur pro|professional player|france|fr","83246","0","0","121","https://i.ytimg.com/vi/0sdjcb5ambU/default.jpg","False","True","Battlefield 6 a été officiellement annoncé ! Wishlist dès maintenant le jeu pour ne pas rater sa sortie : https://x.ea.com/85166Collaboration Commerciale⌨️ Razer t'offre 5% avec le code GOTAGA : https://razer.a9yw.net/GOTAGA🎮 Scuf t'offre 5% avec le code GOTAGA : http://scuf.co/Gotaga👕 Nouvelle collection disponible : https://shop.gotaga.tv/--------------------------------------------► Site Web : http://www.gotaga.tv► Boutique : https://shop.gotaga.tv/► Chaine principale : https://www.youtube.com/user/GoTaG4► Stream : http://www.twitch.tv/Gotaga► Discord : https://discord.gg/gotaga► Twitter : http://www.twitter.com/Gotaga► Instagram : http://www.instagram.com/Gotaga► Tiktok : https://www.tiktok.com/@gotaga► Facebook : http://www.facebook.com/Gotag4--------------------------------------------► Règles de l'espace commentaire (sous peine d'être banni par l'équipe de modération) :- Soyez respectueux envers les membres de la communauté.- Les insultes, propos racistes ou autres sont interdits.- Pas de pub et de spam.--------------------------------------------💥 Télécharge l'extension (Chrome & Firefox), tu seras informé de la sortie de chaque vidéo sur la chaîne principale et secondaire ainsi que de mes lives :  https://gotaga.tv/extensions--------------------------------------------► Contact : contact@gotaga.tv--------------------------------------------© GOTAGA PROD"
"ng9TmFkszUA","3 Cheaters vs 1 Admin","2025-08-05T00:19:25Z","UCJby9NAb3ek5gzqZ8SOl_3w","Camomo_10","20","25.05.08","launtel|camomo_10|camomo|rust admin|rust trolling|rust admin trolling|rust cheat|rust cheats|rust cheater|exposing cheaters","35614","0","0","174","https://i.ytimg.com/vi/ng9TmFkszUA/default.jpg","False","True","I came on to ban 1 cheater and ended up banning 3 cheaters!CHECK OUT LAUNTEL https://residential.launtel.net.au/signup/residential/referral/CAMOMOGET WARBANDITS VIP https://store.warbandits.gg/ USE CREATOR CODE CAMOMOAll My Links belowhttps://linktr.ee/camomo_10https://www.epidemicsound.com used for musicMessing with cheaters made possible from 1928tommygun and his plugin https://payback.fragmod.com/"
"cYbRbtypp20","【Half Sword】Half Fish","2025-08-05T00:14:46Z","UCxsZ6NCzjU_t4YSxQLBcM5A","saba","20","25.05.08","[none]","179327","0","0","504","https://i.ytimg.com/vi/cYbRbtypp20/default.jpg","False","True","that fish is a halfwit, my liege. guffawing at every pathetic gag🐟 https://x.com/samekosaba#samekosaba chat rules: please help me make this a welcoming space for everyone!- treat every participant with respect, including the fish!- avoid politics- avoid all hate speech, discrimination, harassment and/or any behavior that could be considered harmful.- do your best to keep things fun & positive, i'm all for jokes, but let's try and have a good time!if you're unsure, please take a peek at YouTube's TOS!thank you so much!------"
