video_id,title,publishedAt,channelId,channelTitle,categoryId,trending_date,tags,view_count,likes,dislikes,comment_count,thumbnail_link,comments_disabled,ratings_disabled,description
"txR4-20P8Ow","BOUTIQUE FORTNITE D’AUJOURD’HUI (5 Août 2025) 💙🥳 (Boutique du jour)","2025-08-05T00:04:44Z","UC_zw2cIvoqAm81b1cbEg-lA","Matsuei","20","25.05.08","Matsuei|boutique fortnite d'aujourd'hui|boutique fortnite daujourdhui|boutique fortnite aujourd’hui|boutique d’aujourd’hui|boutique fortnite|fortnite boutique d’aujourd’hui|fortnite boutique aujourd’hui|boutique d’aujourd’hui fortnite|boutique de fortnite|nouvelle boutique fortnite|fortnite|boutique|nouvelle boutique|fortnite boutique|d’aujourd’hui|la boutique de fortnite|la boutique d’aujourd’hui|la boutique fortnite|5 Août|boutique du jour","4997","0","0","46","https://i.ytimg.com/vi/txR4-20P8Ow/default.jpg","False","True","Salut tout le monde 🥳 , dans cette vidéo je vais vous présenter la boutique fortnite d’aujourd’hui (mardi 5 Août 2025) 💙, Code créateur : 🧡 MA8 🧡 dans la boutique fortnite 🥳 si vous voulez me soutenir ! 💙 Merci 💙 … N’hésitez pas à lâcher un commentaire si vous apprécier un nouveau 🥳 …→ skin / émote / dance / cosmétique dans cette boutique du jour … 💙🥳🎉 👇  Si tu veux avoir accès à beaucoup de shorts réservé aux membres  👇 👇 Deviens membre de la chaîne pour bénéficier d'avantages exclusifs / 👇 Clique sur le lien  👇: https://www.youtube.com/channel/UC_zw2cIvoqAm81b1cbEg-lA/join👉 Mon Twitter : https://twitter.com/MatsueiTv👉 Mon Insta : https://www.instagram.com/matsueitv/👉 Facebook : https://www.facebook.com/matsuei.gameur👉 Contact Mail Pro Uniquement : contactpromatsuei@gmail.com#fortnite #AdPartner #boutiquefortnite"
"C1_M4r6Z9qI","TARGAMAS FAIT UN MOVE DE FOU, CANNA EST TROP FORT - Best Of LoL #1095  Réactions","2025-08-04T10:00:31Z","UCo5DUue77cRJFSrnpzPA-Xg","Idizy - Best of LoL FR Réactions","20","25.05.08","best of lol|idizy|league of legends|best of league of legends|league of legends best of|best of fr league of legends|league of legends best of fr|idizy best of lol fr|sixen|best of stream league of legends fr|best of twitch league of legends|best of lol fr réactions|rhobalas|solary|kcorp|karmine corp|kameto|wao|saken|alderiate|idizy best of|best of lol fr idizy|trayton|tiky|tikyjr|wakz|caliste","30194","0","0","40","https://i.ytimg.com/vi/C1_M4r6Z9qI/default.jpg","False","True","📍 Trouve tes coéquipiers sur The Mates Finder : https://bit.ly/thematesfinder🎁 Apprendre le montage avec Idizy en -30mn : https://www.methodeidizy.fr/recuperetavideo📖 E-book OFFERT sur le montage : https://www.methodeidizy.fr/recuperetonebook📍 Le lien pour m’envoyer des clips : https://forms.gle/DDKzaBaAasQZMwuV8📍 Contact pro : idizy@rachimedia.com👉 DISCORD : http://bit.ly/jointmfds⚡Twitter : https://twitter.com/IdizyFX⚡Twitch : https://www.twitch.tv/idizyfx⚡Instagram : https://www.instagram.com/idizyy/Sur ma chaîne YouTube vous pourrez retrouver les meilleurs clips League of Legends quotidien condensés dans une vidéo de 10 minutes avec ma réaction audio et visuel, un montage original et unique qui vous donnera toute l'actualité de LoL. Il y aura des commentaires audios pour vous expliquer et comprendre les clips de la compétition.Les commentaires originaux me permettent d'ajouter de la valeur avec une ligne narrative et mon avis critique sur le sujet.Toutes nos vidéos sont commentées par Idizy ajoute de la valeur aux vidéos en ajoutant des observations, des critiques ou bien même des conseils pour vous améliorer sur le jeu !Je poste ce contenu en ligne dans un but de critique, de commentaire, et de compte rendu d'actualité.Nous postons ici les meilleurs moments des joueurs pros et streamers avec mes réactions (des tournois que nous organisons) Je sélectionne moi-même les clips et je récupère ce que vous m'envoyez pour avoir la meilleure sélection ! Ensuite au montage :-Je trie les clips pour avoir une ligne narrative cohérente -J'applique des zooms pour accentuer les réactions des personnes présentes sur la vidéo-Je rajoute de l'humour avec des bruitages ou encore des déformations pour embellir la vidéo-Des textes et des images pour commenter les différents clips que nous voyons-Des transitions-De la musique pour dynamiser la vidéo-Les niveaux sonores des clips sont ajustés pour uniformiser la vidéoLe montage permet à la vidéo d'être agréable et drôle à regarder, le but est de rendre l'expérience de l'utilisateur unique et parfaite.Les commentaires originaux permettent une valeur ajoutée à la vidéo grâce à mes conseils et mes réactionsLe montage me prend environ 3h par jour pour chaque vidéo.Un grand merci à Tupile pour son aide sur les clips : https://www.youtube.com/@darkspace6660/videoshttps://www.tiktok.com/@chuisunetulipeCrédits: twitch.tv/shunrimtwitch.tv/idizyfxtwitch.tv/yep1223_twtwitch.tv/slipixtwitch.tv/gudule_1ertwitch.tv/hiro_lloltwitch.tv/rvs_yugotwitch.tv/zedkiiingtwitch.tv/jejouezactwitch.tv/alderiatetwitch.tv/ekkosunatwitch.tv/maindudutwitch.tv/sudrahcirtwitch.tv/rams_18twitch.tv/traytonloltwitch.tv/kamet0twitch.tv/otplol2twitch.tv/otplol00:00 shunrim00:13 idizy00:23 yep1223_tw00:39 slipix00:50 gudule_1er01:09 hiro_llol01:23 rvs_yugo01:35 zedkiiing02:06 jejouezac02:15 alderiate02:30 ekkosuna02:56 hiro_llol03:14 maindudu03:36 gudule_1er03:47 sudrahcir04:00 zedkiiing04:16 hiro_llol04:25 ekkosuna04:46 hiro_llol04:57 rams_1805:20 traytonlol05:40 kamet006:08 otplol206:21 otplol_06:43 kamet007:10 traytonlol07:27 otplol_07:39 kamet007:57 kamet008:08 otplol_08:33 otplol_08:58 idizy09:04 traytonlolMerci de rester poli et courtois dans l'espace commentaire ! Cette vidéo est adaptée aux annonceurs, c'est une vidéo tout public, de type humour et divertissement !#BestofLoL #LeagueOfLegends #LeagueOfLegendsFR"
"IiuQmRwuuOs","/CHAT ALL #33 (Ft. Zeph) : La préparation des Worlds, Le MSI et l'EWC, le niveau en LEC","2025-08-04T10:00:33Z","UCFyVu1Z4Lrk-_1AvF7kH28A","TraYtoN","20","25.05.08","[none]","8657","0","0","20","https://i.ytimg.com/vi/IiuQmRwuuOs/default.jpg","False","True","Si vous voulez me suivre sur :Twitter : http://www.twitter.com/TraYt0n Twitch : https://www.twitch.tv/traytonlolTiktok : https://www.tiktok.com/@traytoonDiscord : https://discord.gg/SPvrdY69Vx----------------------------------------------------------------------------Channel Manager / Monteur : @ZoxistyleMonteur : @returnamedeeMiniaturiste : @Rahezz_00:00 : Intro05:17 : Le coaching chez MKOI06:52 : Le MSI et l'EWC de MKOI17:07 : Gestion de la performance18:01 : Format du LEC22:09 : La reprise du LEC26:28 : KC vs GX30:30 : Le format des teams LEC33:09 Le niveau en LEC48:06 : Prepa des Worlds59:49 : L'impact de la draft1:03:10 : Skincare1:05:16 : Les builds c'est pour les branleurs1:20:23 : Débat support1:28:17 : Gérer la préparation des joueurs1:39:30 : Prépa jour de match1:49:00 : Quelle équipe peut surprendre en LEC ?1:57:04 : Zeph headcoach chez Vitality2:03:57 : Outro"
"N6CQzgWAAh0","Comment j'ai été victime d'un braquage !","2025-08-03T16:18:33Z","UCooHNTRMLkrCfySPBPNL0xA","Anas170QI","20","25.05.08","Anas|FiveM|No Face|anas gaming|anas gta|anas highlights|funny moments|gta 5 roleplay|gta 5 rp funny moments|gta roleplay|gta rp","41715","0","0","53","https://i.ytimg.com/vi/N6CQzgWAAh0/default.jpg","False","True","Suite des aventures GTA RP de Mathieu Khanez sur le serveur No FaceBusiness : anas@rachimedia.comTiktok : https://www.tiktok.com/@anas__off?lang=frInstagram : https://www.instagram.com/anas__officiel__/Twitch : https://www.twitch.tv/anas_offTwitter : https://twitter.com/anas_offf"
"WKibqTv_F2M","[VOD 5] Il refuse de mourir alors que c'est pour son bien ! Campagne avec Archaon","2025-08-04T15:00:56Z","UC7kz_nFdemzMzFvjTxRUcsQ","M4f replay","20","25.05.08","[none]","7365","0","0","8","https://i.ytimg.com/vi/WKibqTv_F2M/default.jpg","False","True","Envie de délicieuses boissons sans sucre testées et approuvées par toute la Chaos corp family ? Essayer HOLY ! Code promo M4f (10% de réduc') ou M4f5 (5€ de réduc') https://fr.weareholy.com/Besoin de POUISSANCE ? Pour votre matos gaming, vous trouverez forcément votre bonheur chez Corsair ! https://t.co/OnizMFPUwnLA CHAÎNE LABORATOIRE (des contenus exclusivement travaillés pour Youtube sur moult sujets)https://www.youtube.com/channel/UCAdi82cWNtMyWTP3UlhPETw-----------------------------------------------------------------INSTAGRAM (pour les jeunes uniquement)https://www.instagram.com/m4fofficiel/-----------------------------------------------------------------TWITCH :https://www.twitch.tv/m4fgaming-----------------------------------------------------------------DISCORD :https://discord.gg/RV47dxdVZQ----------------------------------------------------------------TWITTER :https://twitter.com/M4fgaming----------------------------------------------------------------"
"Y2upKqsC1EM","J'ai testé des glitch TikTok Putaclic et ça a marché (un peu)","2025-08-03T15:41:04Z","UCgeqlTzbryCBHcVJKu9nDJg","Wig","20","25.05.08","fortnite|wig fortnite|wig shorts|shorts fortnite|wig tiktok|tiktok|tiktok fortnite|wig|drole|meme|meme fortnite|edit|edit fortnite|Fortnite battle royale|Fortnitefr|Chapitre 5|Unchained|Jinskow|Glitch tiktok|Glitch fortnite|short fortnite|glitch","70364","0","0","106","https://i.ytimg.com/vi/Y2upKqsC1EM/default.jpg","False","True","Code créateur Wig merci beaucoup 🙏🙌 Publicité #epicpartner Discord : https://discord.gg/officielSnap : https://snapchat.com/t/bWdL8tWTwitter : https://twitter.com/WigYTInstagram : https://www.instagram.com/wigyt_/Formulaire de débannisement du Discord : https://forms.gle/xzrBtGxP32tQpFUH7"
"IEdEU_YfhtM","J'affronte MAGNUS CARLSEN aux ÉCHECS !!","2025-08-02T08:00:17Z","UC3FXGTXQqx9cc2T7EDhslIQ","Julien Song","24","25.05.08","juliensong|chess|échecs|jeu d'échecs|jeu d'échec|julien song|julien song échecs","345056","0","0","907","https://i.ytimg.com/vi/IEdEU_YfhtM/default.jpg","False","True","👉 Rejoins la communauté et obtiens des conseils pour progresser aux échecs sur https://liens.juliensong.com !📩 Contact pro : contact@juliensong.com"
"c96POX4ZNHg","ON PEUT ÊTRE DANS LE NOUVEAU JEU DE SUPER MARIO PARTY JAMBOREE !!!","2025-08-04T13:33:32Z","UCD94IYXQINu04R0KxOrhEzA","Polo","20","25.05.08","Super Mario Party Jamboree|Super Mario Party Jamboree gameplay fr|Super Mario Party Jamboree let's play fr|Super Mario Party Jamboree FR|Super Mario Party Jamboree gameplay VF|Super Mario Party Jamboree délires|Super Mario Party Jamboree review francais|Super Mario Party Jamboree VF|Super Mario Party Jamboree Compilation|Super Mario Party Jamboree Funny Moments|Super Mario Party Jamboree Mini Games|Super Mario Party Jamboree Nintendo Switch 2","33618","0","0","180","https://i.ytimg.com/vi/c96POX4ZNHg/default.jpg","False","True","Je joue à Super Mario Party Jamboree sur la Nintendo Switch 2 et maintenant, on peut se retrouver dans le jeu !🥈 Ma chaîne Fortnite : https://www.youtube.com/channel/UCnjsMBAKSfW4hPe37njBygQ🔥 Ma chaîne Pokémon : https://www.youtube.com/channel/UChHRNkPIJmDrP00YpyKxMew📷 Instagram : https://www.instagram.com/polobleu_officiel🐥 Twitter (X) : https://twitter.com/CBGamesPolo🧑 Facebook : https://www.facebook.com/pages/CBGames/1428840520677847🤪 Le jeu est disponible sur Nintendo Switch 2."
"HU_DGBQwDqA","Ils m'ont laissé SEUL DANS LES FLAMMES 😭 | Perfect Life ✨ Sims 4","2025-08-04T14:00:22Z","UC8bHGbia-oME8PSRJ7YFApA","Lu K","20","25.05.08","Lu_K|Lu_k youtube|Lu_k twitch|Bébé chaos SIMS 4|Perfect Life SIMS 4|Challenge Perfect Life|Vie chaotique SIMS 4|Nourrisson SIMS 4|Un seul Sim|Contrôler un seul Sim|Challenge nourrisson SIMS 4|Chaos familial SIMS 4|Sims 4 vie de calvaire|Sims 4 famille recomposée|Dire oui à tout SIMS 4|Sims 4 challenge chaos|Début chaotique SIMS 4|Sims 4 maison recomposée|Sims 4 challenge extrême|Sims 4 gameplay nourrisson|Vivre dans le chaos SIMS 4|Sims 4 bébé challenge","9356","0","0","41","https://i.ytimg.com/vi/HU_DGBQwDqA/default.jpg","False","True","🎬 1er épisode du nouveau Challenge : Perfect Life un challenge créé par @Moonh ❓ Le principe du challenge : je ne peux jouer et contrôler qu'un seul Sim nourrisson jusqu'à sa mort !Il grandit donc dans une famille et on va devoir dire OUI à tout !Un début absolument CHAOTIQUE: alors que le but d'un Perfect Life c'est pas d'avoir une vie parfaite ??? Le début d'une vie de calvaire visiblement, j'espère que l'épisode va vous plaire !! 🫶Voici l'histoire de la famille, vous allez voir c'est simpleYanis & Camille ont un enfant : Nous (Ezio) mais on a malheureusement divorcés, et c'est Yanis qui nous garde.Yanis a trouvé une nouvelle femme Sylvie, une femme bien plus âgée, de la cinquantaine, qui a 3 enfants : Pierre (un ado), Paul (un enfant), Jacques (un nourrisson comme nous)Sylvie a eu ses enfants avec son ex-mari William, un millionnaire full focus sur son travail et pas sa vie de famille, elle en a eu marre, et est allée voir un p'tit jeune : YANISOn est donc dans une maison avec Yanis, son fils Ezio (notre personnage)Sylvie et ses 3 enfants Pierre, Paul, Jacques 👶🎬 Playlist de la série : https://www.youtube.com/playlist?list=PLfsynrkdEu0x-P7uc56ht5KiEw_d_a6uL🎬 L'épisode était trop court ? Voici la version COMPLÈTE : https://youtu.be/Vrhnrvy_Qs4Si vous voulez me soutenir, vous pouvez le précommander avec mon code créateur LUK qui est à mettre dans code promo de votre achat !Ça me donne 5% de commission sur votre achat, donc au lieu de donner 100% à EA vous donnez 95% à EA et 5% à moi, ça me soutient de fou, merci beaucoup !! 🙏👨‍👩‍👧‍👧  ME SUIVRE SUR LES RÉSEAUX SOCIAUXTwitch ►https://www.twitch.tv/lu_kChaine de redif twitch ► https://youtube.com/@Lu_KReplayInstagram ► https://www.instagram.com/luk_twitch/Discord ► https://discord.com/invite/dtknDm9bCYTwitter ► https://twitter.com/lu_ktvTikTok ► https://www.tiktok.com/@lu__k🎬 Montage par mon frère ALEX ( @alexletambouriste )"
"mjIMZ5T7tOY","MALAISES EN SÉRIE à 1600 ELO !!","2025-08-05T08:00:52Z","UCho9uPByw7z1mOhTqEnfWUA","Blitzstream Facile","20","25.05.08","échecs|apprendre|débutant","4408","0","0","27","https://i.ytimg.com/vi/mjIMZ5T7tOY/default.jpg","False","True","CHAPITRAGE:0:00 Comment CREER le surnombre en attaque15:19 OH LE MALAISE, je donne une pièce29:59 C'est BEAU les finales !45:39 MALAISES en CASCADE1:00:38 La géométrie 1:05:41 LA GAFFE qui GAGNE !!🎥 Ma Chaîne Principale- Blitzstream avec principalement des analyses de parties récentes du haut-niveau et historiques: https://www.youtube.com/@VideosEchecs- Blitz rediff le meilleur (et le pire) de Twitch https://www.youtube.com/channel/UCjylyKydCPV2pK6j5aB92wg📢 Restez en contact avec moiMe suivre sur Twitter► https://twitter.com/Blitz_StreamRejoignez nous sur Discord► https://discord.gg/NkdJnHyRejoignez nous pour Jouer ►  https://bit.ly/3IbbFag"
"cLJ6O86kVCM","ZELDA SWITCH 2 OFFICIEL : NINTENDO DÉVOILE PAR ERREUR LA DATE DE SORTIE ! 🚨🚨🚨","2025-08-05T05:00:41Z","UCwa-qCAFghXwkcQvLadzRxQ","Siphano","20","25.05.08","Siphano|Switch 2|Nintendo|Nintendo Switch|Nintendo Switch 2|Zelda|Mario|Pokemon|Mario Kart|Smash Bros|Splatoon|Metroid|Mario 3D","5116","0","0","44","https://i.ytimg.com/vi/cLJ6O86kVCM/default.jpg","False","True","Nouvelle vidéo d'actualité dans laquelle on parle de la date de sortie du prochain Zelda qui a été dévoilée ! (par erreur ?) #zelda #nintendoswitch2 #nintendo Source : https://www.youtube.com/watch?v=7Xwi8wk6BCU📧 Contact Pro : contact@siphano.fr🎥 Chaîne Secondaire : https://www.youtube.com/channel/UCjL_yMXB-Ekkbl9jhfQ4cyw🔴 Twitch : https://www.twitch.tv/siphano🎵 TikTok: https://www.tiktok.com/@siphanoyt📷 Instagram: https://instagram.com/siphano🐦 Twitter : https://twitter.com/Siphano💬 Discord: https://discord.gg/siphano"
"CPHkQfNAoJE","43 KILLS AVEC LA SAUG EN 1VS4 🤩","2025-08-04T15:30:05Z","UCpGqRMBgTdyXruBOkOh37aA","BEK1NG","20","25.05.08","[none]","13155","0","0","31","https://i.ytimg.com/vi/CPHkQfNAoJE/default.jpg","False","True","Les classes à la fin de la vidéo ⚡N'oubliez pas le petit like qui fait toujours plaisir 👍-5% chez BurnControllers avec le code BEK1NG 🎮 - https://burn-controllers.com/BEKINGTous mes réseaux ↓Twitch - https://www.twitch.tv/bek1nngTikTok - https://www.tiktok.com/@bek1ng_ Instagram - https://www.instagram.com/bek1nng/Discord - https://discord.gg/bek1ng X - https://x.com/Bek1nng#warzone #callofduty #cod"
"p0hhb7bXlPs","Mon avis après 20 heures sur BATTLEFIELD 6","2025-08-03T08:02:00Z","UCOFpy3UkxQR-5L2WohPENMQ","Celeborn","20","25.05.08","celeborn celebornlegend battlefield","96760","0","0","692","https://i.ytimg.com/vi/p0hhb7bXlPs/default.jpg","False","True","Ça fait environ 9 mois que j'ai mis les mains pour la première fois sur le jeu, je vous partage mes impressions.0:00 Intro01:14 Les points positifs12:23 Ce qui doit changerOutro : BLACK ME OUT - HollowMe suivre :Sur Twitter : https://twitter.com/CelebornLegend/Sur Insta : https://www.instagram.com/celebornlegend/Ma config :AMD Ryzen 7 5800X (3.8GHz)EVGA GeForce RTX 3070 XC3 ULTRA GAMINGMSI MAG B550 Tomahawk2To + SSD Aorus Gen 4 1 To32Go DDR4 Corsair Souris : Logitech G ProClavier : Roccat Ryos MK ProCasque : Roccat Kave"
"rkx6FylKOdg","Battlefield 6 | Nouvelles Infos Officielles : Serveurs, SBMM, Classes Crossplay & Anticheat!","2025-08-04T16:51:14Z","UCdEXpWYTsRsiLjdIcXMICSg","Hiken","20","25.05.08","Jeux-video","14283","0","0","133","https://i.ytimg.com/vi/rkx6FylKOdg/default.jpg","False","True","Les développeurs partagent de plus en plus d'infos sur les aspects fondamentaux de Battlefield 6, et on en sait beaucoup plus sur le gestionnaire de serveurs, le matchmaking, l'équilibrage des classes ou même la gestion du crossplay !______________________________________________________________________Activer sa Clé Bêta BF6 : https://www.ea.com/fr/games/battlefield/battlefield-6/redeemChaîne Secondaire : https://www.youtube.com/@hikenfr2▼ PLAYLISTS ▼Modern Warfare 3 : https://youtube.com/playlist?list=PLo8rb0pIyUrzKm9tmQmr_dMDirAfljTNK&si=sFBi1XX5Nv2eCRZhModern Warfare 2 : https://www.youtube.com/playlist?list=PLo8rb0pIyUrw_rtQOwVHwHr5x9-gpE8SeCall Of Duty : Warzone : https://www.youtube.com/playlist?list=PLo8rb0pIyUrzCsAjuv_FAE6fiWG0wQJEPGuides Warzone : https://www.youtube.com/playlist?list=PLo8rb0pIyUrxZbYEBmgQjZCfHwNivdpc8▼ DERNIERES VIDEOS ▼Tout ce que Vous Devez Savoir sur la Bêta de Battlefield 6! (Clés BF6, Armes, Maps, Récompenses) : https://youtu.be/hU0M2q0WCzYL'Armurerie de Battlefield 6 Expliquée en Détails... (Armes & Accessoires) : https://youtu.be/g5EtAToZmfM▼ RESEAUX SOCIAUX ▼Facebook : https://www.facebook.com/hikenfr/Twitter : https://www.twitter.com/HikentvTwitch : https://www.twitch.tv/hikenfr/Instagram : https://www.instagram.com/hikentvTiktok : https://www.tiktok.com/@hikentvDiscord : https://discord.com/invite/rXSq2rA00:00 Introduction00:21 Gestionnaire de Serveurs & Battlefield Portal01:53 Matchmaking de Battlefield 6 : Team Balancing & SBMM04:07 Gestion du Crossplay & Cross Platform 05:22 Équilibrage des Classes & Playlists07:04 Contenu de Lancement (Armes & Maps)08:14 Chat Vocal & Textuel en jeu09:05 Anticheat Javelin09:49 Conclusion___________________________________Crédits Audio : Musiques et Effets Sonores d'Epidemic Sound : https://www.epidemicsound.com/Logo réalisé par Yuneko :https://www.instagram.com/_yuneko_/Battlefield 6 | Nouvelles Infos Officielles : Serveurs, SBMM, Classes Crossplay & Anticheat! : Lien : https://youtu.be/rkx6FylKOdg#bf #battlefield #battlefield6"
"rGb9b6cCGhA","J'ai passé 100 jours sur un VRAI bateau (Mod Valkyrien skies)","2025-08-03T17:16:52Z","UC_iDWny07EIBQEfBD4tbpDA","Millpa","20","25.05.08","minecraft|bateau|vacances|milpa","39268","0","0","113","https://i.ytimg.com/vi/rGb9b6cCGhA/default.jpg","False","True","Et OUI, on peut maintenant avoir un vrai bateau dans minecraft, je sais, ça paraît fou. Dans cette vidéo, j'ai survécu pendant 100 jours dans un océan immense, avec  pour but d'améliorer mon vaisseau, et de trouver des trésors cachés.Si vous aussi vous voulez essayer le modpack, le voilà :https://www.curseforge.com/minecraft/modpacks/raft-lost-at-seaPour vous faire un serveur multi avec Minestrator :https://minestrator.com/a/MILLPARéseaux:Twitter: https://x.com/Millpa1 (Je tweet + sur l'esport)Discord: https://discord.gg/aQvbNNbXQtTwitch: https://www.twitch.tv/millpatv"
"xSOGQXSb7pk","Sur écoute ","2025-08-03T15:01:33Z","UCT3o-cyCo7avTbSkZguvJWw","JL Tomy - Live","20","25.05.08","jl|tomy|toma|jobless|twitch|JLTomy|Tomy|JL|Jobless Team|GTA|Toma|TOMA|Live|VOD|LIVE|Flashback|Best Of Flashback|FLASHBACK|RP|GTA RP|Miguel|Best Of|Joblife|JOBLIFE|Fivem|best of|série|épisode|Selim|GTA 6|GTA V|Roleplay|jeu de rôle|rp|acting|reese|GTA VI|Gta 6|exclu gta 6|GTA 6 RP","22606","0","0","53","https://i.ytimg.com/vi/xSOGQXSb7pk/default.jpg","False","True","...  ► Rejoins l'aventure Whitelist précommande ton pack dés mainternant: whitelist.fr ► Nouvelle collection Joblife 2025 Maillot Away (25% sur les anciens maillots en achetant le nouveau) maintenant disponible https://t.co/wmy6g5f1Nh ► Mon nouveau compte Tiktok spécial GTA RP https://www.tiktok.com/@jltomylive► Retrouve moi tous les soirs en live sur Twitch à 21H https://www.twitch.tv/jltomy       ►  Seveur FLASHABCK https://discord.gg/flashback  ►  Serveur FLASHBACK FA https://discord.gg/flashfa► Retrouve moi sur Tiktok: https://www.tiktok.com/@jltomy► Chaine principale : https://www.youtube.com/JLTomy► Boutique JL: https://jobless.tv/► Boutique joblife: https://joblife.fr/► Twitter : https://twitter.com/JLTomy► Instagram: https://www.instagram.com/jltomy/► Snapchat: YTOMY► La Playlist de Victor Morrigan: https://open.spotify.com/playlist/35l5zPprVelz1k0dtuAL3Y?si=4e687256dcaa4b38 #GTARP #gtarp #gta #gta5 #gaming #gt #clips #rp #shorts #short #humour #jltomy #flashback #fivem"
"pX1w_7i0-zk","J'ai testé le MEILLEUR PC à 1000€ sur FORTNITE... (j'étais pas prêt)","2025-08-04T16:19:52Z","UCfzXKxo0egNwE76Eb8pldTA","WaZz","20","25.05.08","fortnite|wazz|manette|gameplay|tuto|tutoriel|joueur pro|pro|s'entrainer|scrim","35061","0","0","370","https://i.ytimg.com/vi/pX1w_7i0-zk/default.jpg","False","True","Le lien du PC Gamer FORGE ONE Powered by MSI en promo spéciale pour vous avec lecode “FORGE” : https://ddei5-0-ctp.trendmicro.com/wis/clicktime/v1/query?url=https%3a%2f%2fbit.ly%2fPC-RTX-FORGE-ONE-by-MSI&umid=34CB68E1-3AC1-9906-910E-C418FEBC21E4&auth=16b2c1eae615e662aa232d8bf19321a46f4b3211-0a9226638fcc831d1d3a05855f014a0db304f77b Découvrez la nouvelle gamme de PC Esport en GeForce RTX Série 50 de @cybertek_fr,dont les PC FORGE ONE Powered by @MSIFrance en promo spéciale pour vous avec lecode “FORGE” : https://bit.ly/44woJ7dEt le lien du concours pour gagner ce PC : https://x.com/wazzth/status/1952404092862574931#Cybertek #RTX50 #NVIDIAReflex #PoweredByMSICommande ton tapis de souris Team Zz sur https://upscale.fr 😍Et si tu veux un maillot HavoK, c'est sur https://teamhavok.fr 😇✅ Code wazz dans la boutique 🥰 Publicité🔥 MES MAPS FORTNITE 🔥🏅 1v1 Build Fight HavoK : 8255-0356-0673🎯 2v3 Clutch Realistics : 8179-7540-8163🎢 PARK TYCOON : 9413-6525-8427🌟 Ma chaîne secondaire (1 vidéo par semaine) : https://www.youtube.com/WaZzTV🔻  RÉSEAUX SOCIAUX  🔻👉 Twitch : https://twitch.tv/WaZz👉 Discord : https://discord.gg/WaZz👉 Twitter : https://twitter.com/wazzth👉 TikTok : https://tiktok.com/@wazzth👉 Instagram : https://instagram.com/wazzth📧 Mail Pro : wazz@jumpee.fr#Fortnite #WaZz"
"y5-U3Q5vfy0","ON VA DEVOIR SURVIVRE - (The Dark Pictures Anthology: Little Hope) Avec Gom4rt","2025-08-04T14:01:27Z","UCHNtgoz6gxdGQ-wfeLnWqiw","Kilira Cooper","20","25.05.08","Kilira Cooper|Gaming|horreur|jeux d'horeur|horror game|baby in yellow|The Dark Pictures Anthology: Little Hope","9262","0","0","91","https://i.ytimg.com/vi/y5-U3Q5vfy0/default.jpg","False","True","Little Hope : Piégés et isolés dans la ville abandonnée de Little Hope, quatre étudiants et leur professeur doivent échapper à des visions de cauchemar qui les traquent sans relâche à travers une brume impénétrable. #littlehope #thedarkpictureslittlehope 𝖳𝗎 𝗉𝖾𝗎𝗑 𝗆𝖾 𝗋𝖾𝗍𝗋𝗈𝗎𝗏𝖾𝗋 𝖾𝗇 𝗅𝗂𝗏𝖾 𝗌𝗎𝗋 𝗆𝖺 𝖼𝗁𝖺𝗂𝗇𝖾 𝗍𝗐𝗂𝗍𝖼𝗁 𝗅𝖾 𝗆𝖾𝗋𝖼𝗋𝖾𝖽𝗂, 𝗏𝖾𝗇𝖽𝗋𝖾𝖽𝗂 (𝟤𝟣𝗁) 𝖾𝗍 𝗌𝖺𝗆𝖾𝖽𝗂 (𝟤𝟤𝗁) : https://www.twitch.tv/kiliratv• Télécharge OperaGX : https://operagx.gg/GXKiliraTV • Mon thème exclusif OperaGX : https://store.gx.me/mods/qp81aw/kilira-cooper/🎈 𝕽𝖊́𝖘𝖊𝖆𝖚𝖝 𝖘𝖔𝖈𝖎𝖆𝖚𝖝 :▸ 𝖳𝗂𝗄𝖳𝗈𝗄 : https://www.tiktok.com/@kilirayt▸ 𝖳𝗐𝗂𝗍𝖼𝗁 : https://www.twitch.tv/kiliratv▸ 𝖨𝗇𝗌𝗍𝖺𝗀𝗋𝖺𝗆 : https://www.instagram.com/kilira/▸ 𝖣𝗂𝗌𝖼𝗈𝗋𝖽 : https://discord.gg/wRuynrJ78E▸ 𝖷 : https://twitter.com/Kilira_CooperYT _______________________🕯️𝕻𝖆𝖗𝖙𝖊𝖓𝖆𝖎𝖗𝖊 :• Holy : https://fr.weareholy.com/kilira/twitch• 𝖨𝗇𝗌𝗍𝖺𝗇𝗍 𝖦𝖺𝗆𝗂𝗇𝗀 : https://www.instant-gaming.com/?igr=Kilira• Logitech : https://logi.gg/kilira________________________✉️ 𝙲𝙾𝙽𝚃𝙰𝙲𝚃 𝙿𝚁𝙾 𝚄𝙽𝙸𝚀𝚄𝙴𝙼𝙴𝙽𝚃kilira.gaming@gmail.com____________🎮The Dark Pictures Anthology: Little Hope"
