video_id,title,publishedAt,channelId,channelTitle,categoryId,trending_date,tags,view_count,likes,dislikes,comment_count,thumbnail_link,comments_disabled,ratings_disabled,description
"CQIYbytAyVQ","Tyla x Wizkid - DYNAMITE (Official Music Video)","2025-08-04T19:30:06Z","UCr2xjaS7CIx1OY7hYwrXb8A","TylaVEVO","10","25.05.08","tyla|new artist|getting late|tyla to last|to last tyla|to last|last|kooldrink|epic|epic records|new music|fax records|electronic|electronic music|dance music|dj lag|overdue|tyla been thinking|been thinking tyla|been thinking|ayra starr|ayra starr tyla|tyla ayra starr girl next door|girl next door|tyla girl next door|ayra starr girl next door|girl next door tyla ayra starr|water|tyla water|water tyla|tyla bliss|DYNAMITE|Tyla Wizkid","590160","0","0","5046","https://i.ytimg.com/vi/CQIYbytAyVQ/default.jpg","False","True","Tyla x Wizkid - DYNAMITE (Official Music Video)DYNAMITE available at: https://tyla.lnk.to/WWPFollow Tyla:https://instagram.com/tylahttps://www.tiktok.com/@tyla_https://twitter.com/Tyllaaaaaaa(C) 2025 FAX Records, under exclusive license to Epic Records, a division of Sony Music Entertainment#Tyla #Wizkid #DYNAMITE"
"uIptaJR3v08","SHELBY OAKS - Official Redband Trailer - In Theaters October 3","2025-08-04T16:15:51Z","UCpy5dRhZd-JbZP4NsrnLt1w","NEON","1","25.05.08","[none]","116876","0","0","668","https://i.ytimg.com/vi/uIptaJR3v08/default.jpg","False","True","A new horror from writer/director Chris Stuckmann and executive producer Mike Flanagan."
"ceeBbXQcUKU","Spending $9,382,356 For The DRAGON CANNELLONI In Steal A Brainrot..","2025-08-04T18:31:02Z","UCRkuUgtDAL4XSU5jB40J_wA","Foltyn","20","25.05.08","foltyn|foltyn roblox|family friendly|roblox|roblox foltyn|foltyn family|funny|no swearing|foltyn family roblox|roblox foltyn family|blade ball|roblox blade ball|foltyn blade ball|kid friendly|Steal a brainrot dragon cannelloni in steal a brainrot..|dragon cannelloni steal a brainrot|dragon cannelloni steal a brainrotoltyn steal a brainrot|foltyn steal a brainrot","1158189","0","0","8313","https://i.ytimg.com/vi/ceeBbXQcUKU/default.jpg","False","True","Today, i spent alot of robux so that I can try and get the NEW DRAGON CANNELLONI. Make sure you watch the whole video to find out what happens.FOLTYN PLUSHYS: https://shop.junipercreates.com/channel/UCRkuUgtDAL4XSU5jB40J_wA/p/7351840964799Join this channel to get access to perks:https://www.youtube.com/channel/UCRkuUgtDAL4XSU5jB40J_wA/join--Socials--Discord: https://discord.gg/hqwZhrkqRrRoblox Group: https://www.roblox.com/groups/11775558/Foltyns-Family#!/aboutRoblox Name: TheRealFoltynInsta: https://www.instagram.com/realfoltyn/Twitter: https://twitter.com/FoltynnnWhat is Roblox? ROBLOX is an online virtual playground and workshop, where kids of all ages can safely interact, create, have fun, and learn. It’s unique in that practically everything on ROBLOX is designed and constructed by members of the community. ROBLOX is designed for 13 to 18 year olds, but it is open to people of all ages. Each player starts by choosing an avatar and giving it an identity. They can then explore ROBLOX — interacting with others by chatting, playing games, or collaborating on creative projects. Each player is also given their own piece of undeveloped real estate along with a virtual toolbox with which to design and build anything — be it a navigable skyscraper, a working helicopter, a giant pinball machine, a multiplayer “Capture the Flag” game or some other, yet-to-be-dreamed-up creation. There is no cost for this first plot of virtual land. By participating and by building cool stuff, ROBLOX members can earn specialty badges as well as ROBLOX dollars (“Robux”). In turn, they can shop the online catalog to purchase avatar clothing and accessories as well as premium building materials, interactive components, and working mechanisms.#Roblox #foltyn"
"N02-zn_35z4","Maa Jaye - Official Teaser | Jimmy Sheirgill | Manav Vij | Ranjit Bawa | Romy | Desi Melodies","2025-08-04T05:30:13Z","UC783dnzJqf2ghHp_pFLYbGA","DM - Desi Melodies","10","25.05.08","maa jaye|ma jaye|jimmy|jimmy sheirgill|jimy sheirgill|jimmy shergil|new punjabi movie|punjabi film|latest punjabi hits|netflix top punjabi|best punjabi films|Jimmy Sheirgill|Manav Vij|Yograj Singh|teaser maa jaye|maa jaye trailer|trailer jimmy sheirgill|pollywood movies|new pollywood|punjabi songs 2025|latest sad songs|sad songs 2025|punjabi sad songs|punjabi love songs|punjabi hits","560411","0","0","1099","https://i.ytimg.com/vi/N02-zn_35z4/default.jpg","False","True","Maa Jaye in cinemas on 29th August 2025.Starring - Jimmy Sheirgill, Manav Vij, Yograj SinghIntroducing - Rehmat RattanSong - Maa Jaye Title TrackSinger - Ranjit Bawa & RomiLyrics - Bill SinghMusic/Composer - Jaidev KumarMusic Arrangements - Jaidev Kumar & Durgesh R RajbhattMusic Assistant - Love ShankarKeyboard Programming - Durgesh R RajbhattRhythm Programming - Love ShankarMix & Master - Gurjinder GuriProducer - Dr Amarjit SinghDirector - Navaniat SinghAssociate Director - Gurpreet Singh Guri, Vk Singh Mom.Original Idea - Jacqueline ChristianoScreenplay Adaptation - Inderpal SinghDialogues and Additional Screenplay - Gurpreet SehjiMusic - Jaidev KumarCinematographer - Jitan Harmeet SinghEditor - Rohit DhimanProduction Designer - ShreeCostumes - Tejinder KaurVisual Promotions - Visual Key StudiosMusic Distribution - Desi Melodies#teaser #punjabimovie #MaaJaye"
"Fi_eBtj9UQw","Battlefield 6 - Official Open Beta Trailer","2025-08-04T15:20:04Z","UCKy1dAqELo0zrOtPkf0eTMw","IGN","20","25.05.08","Action|Battlefield|Battlefield 6|DICE (Digital Illusions CE)|Electronic Arts|First-Person|Shooter|TBA|battlefield 6 beta|battlefield 6 gameplay|battlefield 6|battlefield 6 trailer|new battlefield game|battlefield 6 multiplayer|battlefield 6 open beta|battlefield 6 open beta trailer|bf6 gameplay|battlefield 6 multiplayer beta|bf6 beta|bf6 open beta|bf trailer|battlefield 6 official trailer","155125","0","0","545","https://i.ytimg.com/vi/Fi_eBtj9UQw/default.jpg","False","True","Check out the latest Battlefield 6 trailer for the FPS game to see what you can expect from the upcoming Open Beta. In the Battlefield 6 Open Beta, squad up, play new maps, new modes, and more. Battlefield 6's Open Beta begins this weekend, with early access starting August 7, 2025. Weekend 1 runs from August 9 to August 10, with Weekend 2 happening from August 14 to August 17.Battlefield 6 will be available on PS5 (PlayStation 5), Xbox Series X/S, and PC (Steam, EA App, Epic Games Store) on October 10, 2025.#Battlefield6 #Beta #Gaming"
"8if12NttRyU","Jynxzi & Ryley Play *NEW* Clash Season!","2025-08-04T23:57:01Z","UCjiXtODGCCulmhwypZAWSag","Jynxzi","20","25.05.08","Jynxzi|JynxziR6|JynxziLive|Jynxzi Stream|Jynxzi & Ryley Play *NEW* Clash Season!|jynxzi ryley|jynxzi evo furnace|jynxzi furnace|jynxzi ryley furnace|jynxzi ryley elo furnace|clash royale furnace|clash royale evo furnace|clash royale evo furnace new season|jynxzi ryley clash royale","410363","0","0","495","https://i.ytimg.com/vi/8if12NttRyU/default.jpg","False","True","Get the Jynxzi charm HERE: https://subs.twitch.tv/jynxziGet the Jynxzi charm HERE: https://subs.twitch.tv/jynxziGet the Jynxzi charm HERE: https://subs.twitch.tv/jynxzi---------------------------------------------------------------------------------------------------------------------------Jynxzi & Ryley Play *NEW* Clash Season!---------------------------------------------------------------------------------------------------------------------------G FUEL x JYNXZI 20% OFF: http://gfuel.ly/jynxzi Code: JYNXZIKONTROLFREEK x JYNXZI 12% off: https://glnk.io/Jynxzi Code: JYNXZI"
"m0oGNwccEsI","Khan Bhaini - Non Stop (Official Video) | Guri Nimana | New Punjabi Songs 2025","2025-08-04T05:30:45Z","UCCjWypVmwx9L7Q8jAT8v2Zg","Khan Bhaini","10","25.05.08","khan bhaini new song|khan bhaini|khan bhaini all songs|khanbhaini ne|khan bhaini new song all|New Punjabi Song|latest punjabi song|latest punjabi songs|punjabi songs|punjabi hits songs|latest punjabi music|punjabi trending songs|new punjabi songs latest|new punjabi songs|punjabi song new|kade raja song|non stop|non stop songs|khan bhaini non stop|non stop khan bhaini|new|songs|2025|punjabi|non stop hit songs|non stop punjabi song|non stop song","1631290","0","0","735","https://i.ytimg.com/vi/m0oGNwccEsI/default.jpg","False","True","Khan Bhaini - Non Stop (Official Video) | Guri Nimana | New Punjabi Songs 2025Khan Bhaini - Non Stop (Official Video) | Guri Nimana | New Punjabi Songs 2025#KhanBhaini #NonStop #PunjabiSongs #NewPunjabiSongs #LatestPunjabiSongs2025 #HitSongs #NewSongs2025 #PunjabiSongs2025 Streaming Link - https://VirginMusicGroup.lnk.to/NonStopSong - Non StopSinger/Lyrics/Composer - Khan Bhaini,https://www.instagram.com/khanbhainiMusic - Guri NimanaVideo by: Rupan Bal X Dilpreet VFXMix&master- BsanjLabel- Khan Bhaini  SUBSCRIBE FOR LATEST UPDATES."
"d9erkpdh5o0","WAR OF THE WORLDS | Amazon Prime Official Trailer (2025) - Ice Cube","2025-07-24T18:40:00Z","UCQq_QiRtv9EaSmWQ4a0JghQ","WAR OF THE WORLDS (2025)","22","25.05.08","WarOfTheWorlds|IceCube|PrimeVideo","594409","0","0","0","https://i.ytimg.com/vi/d9erkpdh5o0/default.jpg","True","True","Ice Cube fights aliens to save his family and the world.Premieres exclusively on Amazon Prime Video on July 30, 2025.#waroftheworlds  #icecube #primevideo"
"hrPtK5D5yn4","Race Highlights | 2025 Hungarian Grand Prix","2025-08-03T15:16:09Z","UCB_qr75-ydFVKSF9Dmo6izg","FORMULA 1","17","25.05.08","F1|Formula One|Formula 1|Sports|Sport|Action|GP|Grand Prix|Auto Racing|Motor Racing|f1 highlights|hungaroring|hungarian grand prix|lando norris|charles leclerc","5087927","0","0","4577","https://i.ytimg.com/vi/hrPtK5D5yn4/default.jpg","False","True","Catch up on the most intense and dramatic moments from the final race before summer break, as the drivers' championship fight is shaken up once more.For more F1® videos, visit: https://www.Formula1.comVisit our store: https://f1store.formula1.com/Follow F1®:https://www.instagram.com/F1https://www.facebook.com/Formula1/https://www.twitter.com/F1https://www.twitch.tv/formula1https://www.tiktok.com/@f1#F1 #HungarianGP"
"5NaEPtw0Ydg","Ni Tu Baar Baar - Akhil Sachdeva | Abhishek Kumar & Isha Malviya| Ishaan Arora| Anshul Garg","2025-08-05T05:30:04Z","UCSM54qcBP60U61HOMm_SUqA","Play DMF","10","25.05.08","Desi Music Factory|Latest Hindi Songs'|New Songs|Viral Song|official video|New Hindi Song|International collab|Latest hindi african song|latest international song|new bollywood song|new hindi song|new romantic song|trending hindi song|Ni Tu Baar Baar|Akhi Sachdeva|Nashaboy|Isha Malviya|Abhishek Kumar|IshaXAbhishek|Trending trailer|isha malviya new song|akhil sachdeva new song|Isha Malviya Shaky|abhishek kumar new song|isha malviya trending song","755084","0","0","8257","https://i.ytimg.com/vi/5NaEPtw0Ydg/default.jpg","False","True","Anshul Garg presents Ni Tu Baar Baar featuring Abhishek kumar & Isha malviya.Audio Credits :-Singer, ,Lyrics and Composer : Akhil SachdevaMusic production : Ishaan Arora Guitars and mandolin : Ishan DasRhythm : Prashant Trivedi, Rakesh Bhardwaj And Harvinder BabbiHarmonium : ManishMix and mastered by Shadab Rayeen @ New Edge Assistant engineer : Jazbaat, Sohamm, PrasadVideo Credits :-Director : Arif khanChoreographer : Aarif khanAssociate Director : Aanchal  1st Associate Director : Varun Bhatiya (groovy)Production house : R.S films & ProductionEP : Rahul Sehal DOP : Anubhav BansalDOP Assistant : david,shubhSteady cam : Sandeep kumar Jimmy jib : gaurav   Art director : pardeep artProduction manager : Saksham Mehta,rohit gaur ,honey,gulshan,gurpreet singhProduction controller : ravi and badalEditor : Oswin ReveredoDI : Onkar Singh Junior and casting : aamir qureshiHelicam operator : chirag Male Artist make up hair : honey kalsiBTS : blue sky films - AKKICostume Stylist : Victor RobinsonPlayDMF Team :-Founder & CEO : Anshul Garg  Vice President : Raghav Sharma ( Pratick Sharma)Label Manager : Sankalp GargProject Head : Gaurav AroraLegal & Digital Manager : Ashima ChauhanPlayDMF Team : Aansi & Anshu PrasadArtwork : Vicky SandhuSpecial Thanks : Virgin Music IndiaVirgin Music India Team :-Head : Amit Sharma Team : Nagesh Jadhav, Kajal Israni, Amol Suryavanshi, Lavanya Das & Nishtha SikroriaAssociated Brands :-UPES Online (https://upesonline.ac.in/)Havells India Ltd. (https://havells.com/)Optima Insurance Brokers Private Limited (https://optima.co.in/)Luxor Group (https://luxor.in/)Kanoria Energy & infrastructure (https://www.ainfrastructure.com/)Lyrics :-Ni tu baar baar baar mainu yaad aandi haiNi Tu baar baar baar mainu yaad aandi haiSohne yaar tu gharbaar teri yaad aandi haiNi tu baar baar baar mainu yaad aandi haiTu je nedeh rabb vi nedehDum tere naal hi dum mereNaal na ravein taanh meri jaan jaandi haiNi tu baar baar baar mainu yaad aandi haiMitthiyan gallan de sardar teri yaad aandi haiVe sajna mere dildaar teri yaad aandi haiNi tu baar baar baar mainu yaad aandi hai Yaar mere damdaar yaar Har baar tu hi mera pyaar pyaar Husna di sarkaar tu mainu maar jaandi haiNi tu baar baar baar mainu yaad aandi haiAntara:Ishq da mulazim main taanh darr tere aayi jaavanTenu jede changey lagein bol main sunayi jaavan Ishq da mulazim main taanh darr tere aayi jaavanTenu jede changey lagein bol main sunayi jaavan Suraan te taanh rabb vassey tere sur gaayi jaavanIk teri khair mangaan tera ban jaavanTenu labhde nain ye mere Sang tere hi chain ye mereBin tere behaal main meri jaan jaandi haiNi tu baar baar baar mainu yaad aandi haiAaja gallan kariye chaar teri yaad aandi haiHaan Tu je nedeh rabb vi nedehDum tere naal hi dum mereNaal na ravein taanh meri jaan jaandi Ni tu baar baar baar mainu yaad aandi haiNi tu baar baar baar mainu yaad aandi hai Ni tu baar baar baar mainu yaad aandi hai#akhilsachdeva #ishamalviya #abhishekkumar  #ishaxabhishek #trending #newsong"
"X_q9JoVcImI","Overwatch 2 x NERF | Gameplay Trailer","2025-08-04T16:00:06Z","UClOf1XXinvZsy4wKPAkro2A","PlayOverwatch","20","25.05.08","Overwatch 2|Overwatch","268125","0","0","1299","https://i.ytimg.com/vi/X_q9JoVcImI/default.jpg","False","True","Gear up for the BLAST of a lifetime in Overwatch 2 x NERF!Add some foam-fueled upgrades to your arsenal with a collection of cosmetics themed after iconic NERF gear.Pick your plastic with Genji’s Slingerang + Power Blast Bat, Baptiste’s Loadout Galactic Commander, Hanzo’s Big Bad Bow, Mei’s Super Soaker XP100, Soldier: 76’s N Series Pinpoint, and Cassidy’s Maverick + Vortex Football + his new NERF Legendary Skin.But wait, there’s more! Put your NERF skills to the test in our new limited-time game mode, NERF or Nothin’, where every elimination gives you a fresh NERF blaster to master. You’ll also be able to earn NERF-themed rewards like voice lines, sprays, a weapon charm, and Tracer’s GelFire Pro as you blast through event challenges.Get NERF’d like never before when Overwatch 2 x NERF starts Aug 5!_Follow #Overwatch2 for the latest news:Instagram: https://www.instagram.com/playoverwatchTikTok: https://www.tiktok.com/@overwatchTwitter: http://www.twitter.com/playoverwatch Facebook: http://www.facebook.com/playoverwatch"
"KYnznkcVoWs","Battlefield 6 NEW Gameplay Details and BIG Changes...","2025-08-04T22:07:48Z","UCw7FkXsC00lH2v2yB5LQoYA","jackfrags","20","25.05.08","[none]","644745","0","0","2967","https://i.ytimg.com/vi/KYnznkcVoWs/default.jpg","False","True","Battlefield 6 Gameplay is out and the beta is soon but DICE just dropped a HUGE update with sweeping changes to classes and new gameplay and beta details. Let's discuss the news! Leave a LIKE and a comment, thanks for watching."
"xkx7hbKh6Ec","VJ feat Seydou Che - Fatou Sangaré (Clip Officiel)","2025-08-04T18:00:53Z","UCNiTCM_vGvvr8iJ8EsmtRaw","VJ","10","25.05.08","VJ|mouhamedvj|love|amour|alum|ep|hoside|rnb|rap|hiphop|senegal|daka|dip|dundu|gis|jahman|amira|akhlou|brcik|amadeus|jeeba|nitdof|mbalax|ngaka|sonko|sadio|mane|serie|tv|marodi|event|prod|bete|mia|guisse|waaly|seck|youssou|ndour|iss|814|fatou|sangare|dm|mali|bamako|sidiki|siabate|seydou|che|oumou|Young-Bg Bagama Bandjougou|fassema|baabel|afrobeat|moi|clip","166340","0","0","661","https://i.ytimg.com/vi/xkx7hbKh6Ec/default.jpg","False","True","Production : Hoside & BlZ Co-Directed :Selemane dieye & Tidjane Traoré Exécutive production :Fefsy Prod Assistant & Decoration sadik def Assistant Production : Soubana DOP : Leye Gueye Focus puller : Weuz Ndiaye Lights Fadel Machiniste- Brasmagik Make up: Maimouna keitaStylisme: Bright look (Elzo Booba)Nous remercions nos partenaires : Air Sénégal et Dolima."
"Sh8yqcozfn8","Highest 2 Lowest | Official Trailer HD | A24","2025-08-04T13:59:00Z","UCuPivVjnfNo4mb3Oog_frZg","A24","1","25.05.08","a24|a24 films|a24 trailers|independent films|trailer|HD|official|movie|film|a24 movies|oscar winner|academy award winner","432376","0","0","784","https://i.ytimg.com/vi/Sh8yqcozfn8/default.jpg","False","True","SUBSCRIBE: http://bit.ly/A24subscribeFrom Academy Award winning writer/director Spike Lee and starring Denzel Washington, Jeffrey Wright, Ilfenesh Hadera, and A$AP Rocky. HIGHEST 2 LOWEST – In Theaters August 15, Streaming on Apple TV+ September 5RELEASE DATE: In Theaters August 15, Streaming on Apple TV+ September 5DIRECTOR: Spike LeeCAST: Denzel Washington, Jeffrey Wright, Ilfenesh Hadera, and A$AP Rocky------ABOUT A24:The studio behind EVERYTHING EVERYWHERE ALL AT ONCE, UNCUT GEMS, MIDSOMMAR, MOONLIGHT, BEEF on Netflix, EUPHORIA on Max & more.Coming Soon: EDDINGTON, THE SMASHING MACHINE, MARTY SUPREME & moreSubscribe to A24's NEWSLETTER:  http://bit.ly/A24signupSign up for A24 MEMBERSHIP: aaa24.comVisit A24 WEBSITE: http://bit.ly/A24filmsdotcomLike A24 on FACEBOOK: http://bit.ly/FBA24Follow A24 on TWITTER: http://bit.ly/TweetA24Follow A24 on INSTAGRAM: http://bit.ly/InstaA24"
"LO4wUfsRM7U","This is just the beginning..","2025-08-04T13:00:43Z","UCQeRaTukNYft1_6AZPACnog","Asmongold TV  ","20","25.05.08","asmongold|asmongold reacts|asmongold wow|asmongold highlights|asmongold youtube|world of warcraft|asmongold funny|asmongold tv|asmongold channel|zackrawrr","1044476","0","0","3818","https://i.ytimg.com/vi/LO4wUfsRM7U/default.jpg","False","True","Asmongold reacts to https://www.youtube.com/watch?v=URMjhzt0skU► Asmongold's Twitch: https://www.twitch.tv/zackrawrr► Asmongold's X: https://x.com/asmongold► Asmongold's Kick: https://kick.com/asmongold► Asmongold's Sub-Reddit: https://www.reddit.com/r/Asmongold► Asmongold's VOD Rerun Channel: https://www.twitch.tv/asmongold247Channel Editors: CatDany & Daily Dose of AsmongoldIf you own the copyright of content showed in this video and would like it to be removed:https://x.com/CatDanyRUhttps://x.com/DAsmongold"
"IpqiLXy4im8","AGLA JANAM (Official Video) | Ranjit Bawa  | Mitti Da Bawa 3 | Latest Punjabi Song 2025","2025-08-05T04:21:08Z","UCr7A63cwz2vy7cwIXs_4VFA","Ranjit Bawa Music","10","25.05.08","ranjit bawa|ranjit bawa songs|ranjit bawa all songs|new song ranjit bawa|ranjit bawa new songs|ranjit bawa live show|latest song ranjit bawa|ranjit bawa video song|ranjit|bawa|ranjit bawa hits","75367","0","0","707","https://i.ytimg.com/vi/IpqiLXy4im8/default.jpg","False","True","Ranjit Bawa Music presents the first Song AGLA JANAM from the Album MITTI DA BAWA-3. Instagram - https://www.instagram.com/reels/audio/1271605564495748/Song - Agla Janam Singer/ Composer- Ranjit BawaLyrics -  Mangal HathurMusic- Nick DhammuVideo- TruMakersDop - Gavy Khaira Gaffer - GursewakLabel - Ranjit Bawa MusicSubscribe & Follow Ranjit Bawa on All Social Media Platforms ► Like on Facebook:https://www.facebook.com/folkmanranjitbawa/► Follow on Twitter: https://twitter.com/BawaRanjit?► Follow on Instagram: https://www.instagram.com/ranjitbawa/►Follow on Snapchathttps://www.snapchat.com/add/imrbawa Digitally Powered  By - Team Ranjit Bawa"
"qeVfT2iLiu0","Coolie - Official Trailer | Superstar Rajinikanth | Sun Pictures | Lokesh | Anirudh","2025-08-02T13:30:25Z","UCBnxEdpoZwstJqC1yZpOjRA","Sun TV","24","25.05.08","Coolie Official Trailer|Coolie Trailer|Coolie Trailer Tamil|Rajinikanth Coolie Trailer|Coolie|Rajinikanth Coolie|Rajinikanth song|Anirudh Coolie|Sun Pictures|Thalaivar song|Coolie music|coolie movie songs|Coolie movie|rajinikanth songs|superstar rajinikanth|lokesh kanagaraj|Anirudh songs|coolie rajinikanth|Coolie Tamil Trailer|coolie movie song|Powerhouse|anirudh ravichander|anirudh songs|Coolie tamil movie trailer|Rajinikanth Coolie movie trailer","18505750","0","0","31783","https://i.ytimg.com/vi/qeVfT2iLiu0/default.jpg","False","True","Watch the Power-packed Official Trailer of Thalaivar's CoolieStarring Superstar Rajinikanth, Directed by Lokesh & Music by Anirudh.---------------------------------------------------------#CoolieTrailer #SuperstarRajinikanth #SunPictures #Anirudh #LokeshKanagaraj #Coolie  #AamirKhan #Nagarjuna #Upendra #ShrutiHaasan #Sathyaraj #SoubinShahir #PoojaHegde ---------------------------------------------------------Trailer Song Credits:Song Title : MobstaComposed by Anirudh RavichanderLyrics - Arivu & HeisenbergVocals - Anirudh RavichanderComposed, Arranged & Programmed by Anirudh RavichanderElectric & Bass Guitar by Keba JeremiahTrumpets & Trombone by Rakesh MSRecorded at Vibe_N Studios Engineered by Lokesh VijayakumarOrchestral Programmed by Dan KristenAdditional Music Programmed by Jishnu Vijayan, ArishAdditional Rhythm Produced by Shashank Music Advisor - AnanthakrrishnanCreative Consultant - Sajith Satya Music Editor - Harish Ram LHSession Assistant - Shivakiran SRecorded at Albuquerque Records, Chennai. Engineered by Vinay Sridhar, Srinivasan M, Shivakiran S, Rajesh KannanStem Mastered by Luca Pretolesi at Studio DMI, Las Vegas, Assisted by AlistairMusic Coordinator - Velavan B---------------------------------------------------------"
"P50rYJDGW9g","Playing as K-POP DEMON HUNTERS!","2025-08-04T22:54:57Z","UCzYfz8uibvnB7Yc1LjePi4g","Aphmau","20","25.05.08","Aphmau|Minecraft|Minecraft funny|Minecraft mods|Minecraft Aphmau|Aphmau pranks|Aphmau Minecraft Pranks|Aphmau Gaming|Aphmau Games|Aphmau Pranks Friends|Aphmau Playing As|Aphmau Aaron","784759","0","0","4720","https://i.ytimg.com/vi/P50rYJDGW9g/default.jpg","False","True","So on a scale of 1 - 10, like, exactly how bad is being a demon?★Inspired by the Netflix movie KPop Demon Hunters💜 Come take a look at my merch! 💜 https://aphmeow.com/► Instagram: https://www.instagram.com/aphmau_ ====. * ･ ｡ﾟ☆ [Friends!] ☆｡ﾟ･* .====★ Aaron: Jason Bravura★ Zane: Kestin Howard★ KC: MegaMoeka★ Kim: Corinne Sudberg★ Pierce: Shado_Temple★ Garroth: Andy Cowley★ Travis: P.M. Seymour★ Peebs: Corey WilderNOT an official Minecraft Product. Not approved by or associated with Mojang or Microsoft.#Minecraft #Aphmau"
"_LTyJ49uGOM","Luke Combs & Alex Warren - Ordinary (Live at Lollapalooza)","2025-08-04T00:00:39Z","UCOSIXyYdT93OzpRnAuWaKjQ","Luke Combs","10","25.05.08","[none]","144142","0","0","269","https://i.ytimg.com/vi/_LTyJ49uGOM/default.jpg","False","True","Luke Combs and Alex Warren perform Ordinary live at Lollapalooza."
"mzsdx22HR3k","ELLA MCCAY Trailer (2025) Jamie Lee Curtis, Emma Mackey","2025-08-04T16:15:08Z","UCwYzZs_hwA6NdaQp6Hjhe5w","ONE Media Coverage","1","25.05.08","movie trailer|new trailer|Ella McCay|Ella McCay Trailer|Jamie Lee Curtis|Emma Mackey|Woody Harrelson|Ayo Edebiri","89026","0","0","75","https://i.ytimg.com/vi/mzsdx22HR3k/default.jpg","False","True","ELLA MCCAY Trailer (2025) Jamie Lee Curtis, Emma Mackey, Woody Harrelson, Ayo Edebiri© 2025 - 20th Century Studios"
"JRyjXBuIEgU","I Need To Get Out Of The Backrooms…","2025-08-04T22:00:16Z","UC63anZxfVGHUEmfBAf5w7pw","CaseOh","20","25.05.08","gaming|caseoh|caseohgames|case|funny|streamer|horror|horror gaming|scary|jumpscare","278873","0","0","998","https://i.ytimg.com/vi/JRyjXBuIEgU/default.jpg","False","True","CaseOh X Starforge  https://starforgepc.com/CaseOh GamerSupps -10% off Code CaseOh -  https://gamersupps.gg/Merch - https://caseohgames.com/_________________________________________________________________Join this channel to get access to uploads with no blurs or mutes:https://www.youtube.com/channel/UC63anZxfVGHUEmfBAf5w7pw/join________________________________________________________________Follow 👇Twitch 🎥 https://www.twitch.tv/caseoh_MoreCaseOh YT 📺  https://www.youtube.com/@MoreCaseOhTikTok - https://www.tiktok.com/@caseohgames X - https://x.com/CaseOh__Instagram - https://www.instagram.com/caseoh_gamesDiscord - https://discord.gg/caseoh_________________________________________________________________"
