video_id,title,publishedAt,channelId,channelTitle,categoryId,trending_date,tags,view_count,likes,dislikes,comment_count,thumbnail_link,comments_disabled,ratings_disabled,description
"2yCRxRJgRgw","J'ai DÉFIÉ un PRO de 99 Nuits pour tenter de le BATTRE !","2025-08-04T15:00:04Z","UCbUXiv7ro8Pm8NZkQQjXCMA","StundZow Off","20","25.05.08","stundzow|stund|roblox 99 nuits|survivre 99 nuits|pro|défi|engager un pro|payer un pro|stundzow vs pro|duel 99 nuits|speedrun|litsu|litsu le pro|stund roblox|stundzow roblox|stundzow 99 nuits|stund 99 nuits|meilleur base 99 nuits|speedrun 99 nuits|stund et litsu|stundzow et litsu|duel speedrun 99 nuits","128906","0","0","165","https://i.ytimg.com/vi/2yCRxRJgRgw/default.jpg","False","True","Aujourd'hui j'ai engagé un PRO pour tenter de le BATTRE sur Roblox 99 Nuits. Le but est simple, lui montrer que je suis meilleur ! Es ce que je vais reussir ? C'est ce que vous allez voir !Si tu kiff la vidéo oublie pas de mettre un petit pouce bleu et un abonnement !Rejoins moi sur Twitch le soir à 20h00 !📡 Twitch : https://www.twitch.tv/stundzowLe discord pour être au courant de tout !🎮 Discord : https://discord.com/invite/zHdWJEJq36Mes autres réseaux :🏔️ TikTok Principal : https://www.tiktok.com/@stundzow_twitch🌊 TikTok Secondaire : https://www.tiktok.com/@stundzow.off⚡ Chaine Principale : https://www.youtube.com/@StundZowShorts📸 Instagram : https://www.instagram.com/stundzow/🎥 Derush/Montage : StundZow🖌️Minature : StundZow (mais dit donc cette homme sait vraiment tout faire, mais mariez le) (je me permet de mettre des vannes ici, parce que ya carrement personne qui est allé aussi loin dans la description)"
"8_cjR8sgvwE","🔴LIVE | ESCAPE FROM TARKOV | SHOOTER BORN IN BUNGUS | !NewStreamTime #ShartEconomics #BUNGULATE","2025-08-05T07:39:02Z","UCMNEVbszv8ZyvSXoTn3yhpQ","TheBurntPeanut","20","25.05.08","[none]","106381","0","0","16","https://i.ytimg.com/vi/8_cjR8sgvwE/default.jpg","False","True",""
"mN6Z7aCVH8c","20 Games Where Being Evil Is Ridiculously Fun","2025-08-04T16:44:10Z","UCNvzD7Z-g64bPXxGzaQaa4g","gameranx","20","25.05.08","games where you play the villain|evil protagonist games|games that let you be bad|power fantasy games|dark morality games|oppressive gameplay|tyrant simulator games|villain role games|games with evil choices|games where you're the bad guy|rule with fear games|morally grey games|games|dictator games|be the oppressor in games|control the|world games|evil empire games|games with evil endings|domination games|gameranx|falcon","185712","0","0","673","https://i.ytimg.com/vi/mN6Z7aCVH8c/default.jpg","False","True","Here are some interesting video games let you play as the bad guy, evildoer, or some form of oppressor.Subscribe for more: https://www.youtube.com/gameranxTV?sub_confirmation=1     0:00 Intro  0:25 Star Wars: Empire At War  1:56 Assassin’s Creed: Rogue  3:46 Tropico 6  5:28 Palworld  6:43 X-Morph Defense  8:05 Untitled Goose Game  9:16 Battlefield 5  10:45 Red Alert 2  12:46 Tyranny  14:12 Helldivers 2  16:14 Papers, Please  18:07 Warhammer 40k: Rogue Trader  20:42 Crackdown 3  22:18 FTL: Faster Than Light  23:21 Lord of the Rings: Conquest  24:20 Beholder  25:16 Syndicate  26:20 Frostpunk  27:11 Pathfinder: Wrath of the Righteous  28:12 Overlord 2"
"RI2f_GcsWOc","I AM THE BEST IRELIA IN THE WORLD","2025-08-04T19:00:32Z","UChwh1KpZf0Y5KsmaCCMSt6A","AloisNL","20","25.05.08","League of legends|League of legends riven challenger|challenger coaching league of legends|Alois_NL Riven|league of legends music|fundamentals|funny moments|educational climb|educational league|best build|top lane|challenger|alois funny moments|top lane tutorial|top lane carry|season 15 guide|korea|korea challenger|alois riven|high elo|korea alois|carry alois|dr. mundo|alois mundo|Irelia|Alois Irelia|Irelia build|Irelia guide|Irelia Alois","71267","0","0","115","https://i.ytimg.com/vi/RI2f_GcsWOc/default.jpg","False","True","Make sure to hit the like button and subscribe to my channel!↓ More Info Below ↓ COURSES & GUIDES:➡️https://aloisnl.com/➡️VOD Channel: https://www.youtube.com/@AloisNLVODs➡️Twitch: https://www.twitch.tv/Alois_NL➡️Twitter: https://twitter.com/AloisNL➡️Discord: https://discord.gg/AloisNL➡️Tiktok: https://www.tiktok.com/@AloisNL➡️Instagram: https://www.instagram.com/aloisnlclips📩For business inquiries email: alois@proxy.ggEditor: https://x.com/TarCutsShorts: https://x.com/MWSymphonyThumbnails: https://x.com/EnderpsdTIMESTAMPS:0:00 - Intro0:43 - Game 111:41 - Game 226:28 - Game 3#educational #challenger #toplane #fundamentals #guide #leagueoflegends #riven #educationalgames #fundamental #education #educationalvideo #educationalvideos #ranked #gaming #gamingvideos #gamingcommunity #gamingshorts #gamingchannel #gamingvideo #moba #leagueoflegendsclips #league #multiplayer #onlinegaming #mundo #funny #funnyvideo #funnyshorts #funnyvideos #twitch #twitchstreamer #twitchclips #twitchtv #twitchgaming #twitchstream #twitchhighlights #aloisnl #alois_nl #riotgames #coaching #esports #esport #professional #entertainment #reaction #trending #tiktok #trend #trendingvideo #instagram #youtubeshorts #ytshorts #youtube #youtuber #youtubeshort #yt #ytshort #youtubevideo #youtubechannel #youtubevideos #online #popular #streamer #shorts #subscribe #shortvideo #short #shortsfeed #shortsvideo #shortsviral #foryou #fyp #games #gameplay #game #gamer #highlights #knowledge #like #live #alois #livestream #comedy #comment #viralvideo #video #viralshorts #viralshort #viralvideos #viralreels #new #newvideo #macro #motivation #memes #macro #outplayed #mundo #drmundo #push #pushpushpush #cosplay #cosplayer #cosplay #league #wow #watch #work #edit #editing #english #easy #emotional #reels #inspiration #art #anime #fun #humor #coach"
"SgkjK-j5ALs","They Dared Me to Make a Game...","2025-08-04T21:45:03Z","UCojEXrCBzO-cP2N5YlRcrWw","Daniel Krafft","27","25.05.08","minecraft|blender|gamedev|godot|unity|unreal|ue5|dani|battle cats","235166","0","0","934","https://i.ytimg.com/vi/SgkjK-j5ALs/default.jpg","False","True","Download The Battle Cats for free: https://pixly.go2cloud.org/SH4vG  Thanks to The Battle Cats for sponsoring this videoCheck out the Sonic the Hedgehog x The Battle Cats collaboration trailer here: https://www.youtube.com/watch?v=C-7V-dB5ly0The Battle Cats meets Sonic the Hedgehog for a thrilling collab event, available through August 18, 2025 at 11:00AM! Boot up The Battle Cats to take on limited maps based on classic Sonic stages, spin the Rare Capsules to try for collab-exclusive heroes, and collect Catified versions of Sonic and his allies! More Gamedev: https://www.youtube.com/playlist?list=PLSh10HLKI-DjeEDk3nIBPz7DZgaQ-1YemCredits:Daniel KrafftKayden Editor (Editing)Matthew Giles (Editing)Sylly Sylvie (Modeling/Animation help)Louie DePhillips (Modeling/Animation help)Alright so in this video I made a big update to my 3D Battle Cats game. I made a bunch of the Nekoluga Uber cats, an evolution system, a loadout system, animations for everything, a new map, a hub world, and a bunch of other things. Sorry if the video is too technical, a lot of time is spent on complicated things !//aboutMy name's daniel and I design things. Usually I do 3d modeling in blender but I'm now a metal worker thanks to mr beast apparently??? Who knows what I'll design in the future. If you have any ideas please let me know"
"UEDdI4_1kkQ","Among Us, but I'm Outnumbered","2025-08-04T21:30:04Z","UC5RpbFDGW-pgOaRMDUYpBFw","Alpharad LIVE","20","25.05.08","alpharad|alpharad nuzlocke|alpharad challenge|shiny alpharad|among us|imposter|among us imposter|alpharad among us|jaiden animations|alpharad jaidenanimations|alpharad jaiden animations|jaidenanimations among us|giwi|giwi alpharad|new Among us map|the fungle|the fungle among us|alpharad VOD|Alpharad Among us VOD|new among us dlc|among us new map|new map|among us DLC|among us mod|among us mods|among us skins|alpharad live|drunk among us","67953","0","0","127","https://i.ytimg.com/vi/UEDdI4_1kkQ/default.jpg","False","True","watch live: http://twitch.tv/alpharadedited by: https://twitter.com/smeethenationWatch the latest Among Us Stream here: https://www.youtube.com/playlist?list=PL7Jh-gHAb1fWjX7PbaNRMBmJFtJ6Zkee6"
"juzeJRqq4dw","NEVER MIX THESE BRAINROTS TOGETHER..","2025-08-03T21:52:00Z","UCzzF1kdBgwv5RB6rbB6kVSA","Tyler & Snowi","20","25.05.08","roblox|funny|moments|roblox funny moments|funny moments|tyler|snowi|tyler and snowi|tyler & snowi|roblox italian brainrot memes|roblox brainrot games|roblox italian brainrot|italian brainrot|italian|brainrot|italian brainrot lore|italian brainrot roblox|new italian brainrot|new italian brainrot animals|brainrot lore|tititi sahur brainrot|roblox tititi sahur|roblox espressona signora|roblox pot hotspot|espressona signora|pot hotspot roblox|tititi sahur","944074","0","0","644","https://i.ytimg.com/vi/juzeJRqq4dw/default.jpg","False","True","Adopt Your Own TYLER and SNOWI ✨ https://tylerandsnowi.store/ 👈 Back for a Limited Time ⏰Today Tyler & Snowi Play ITALIAN BRAINROT MIXER!! 😲 Can we mix TiTiTi Sahur, Espressona Signora, Pot Hotspot, Cocofanto Elefanto and MORE to create NEW ITALIAN BRAINROT?! This Roblox ITALIAN BRAINROT GAME has SO MANY FUNNY MOMENTS ! 👉Don't forget to SUBSCRIBE & leave a like 👍 if you enjoyed!Join our Roblox Group here! https://www.roblox.com/groups/15659093/Tyler-and-Snowi#funnymoments #cartoon #roblox [0731]"
"XkTOUpzZKfE","New SEASON 4 PREVIEW! (Fortnite Chapter 6)","2025-08-05T00:53:12Z","UCqVCSWnuOSPm26orvNDTuWQ","TG Plays","20","25.05.08","[none]","360856","0","0","636","https://i.ytimg.com/vi/XkTOUpzZKfE/default.jpg","False","True","Fortnite Leaks Chapter 6, Season 4 gameplay with Typical Gamer!❤️ SUBSCRIBE & CLICK THE BELL! 🔔Play MY GAMES in FORTNITE! Search TypicalGamer in Fortnite!🔴 SUPER RED vs BLUE ► 2786-2114-8349💥 TG 1V1 BUILD FIGHTS ► 9025-4117-9384⚡ SUPER ROGUELIKE ► 5772-2894-6429🚀 TOY BED WARS ► 5471-4550-8290❤️ Make sure to FAVORITE and RECOMMEND the maps if you enjoy them!Use my Support a Creator code TypicalGamer in the Fortnite item shop if you'd like to support me! (Epic Partner)Join the Discord: https://discord.gg/TypicalGamerFollow me on Twitter: https://twitter.com/TypicalGamerFollow me on Instagram: https://instagram.com/typicalgamer  Buy the Merch: https://typical.storeMusic by Epidemic Sound: https://www.epidemicsound.com"
"poD4z4aIkDU","ÇA Y EST, JE SUIS BON AU JEU (Counter-Strike 2)","2025-08-04T16:01:30Z","UCY-_QmcW09PHAImgVnKxU2g","SQUEEZIE GAMING","20","25.05.08","squeezie best of|squeezie moments marrants|squeezie compilation","178519","0","0","149","https://i.ytimg.com/vi/poD4z4aIkDU/default.jpg","False","True","💚 Mon équipe Esport, les Gentle Mates : https://gentlemates.com💜 Follow mon Twitch pour ne pas rater mon prochain live : https://twitch.tv/squeezie🔔 ABONNE-TOI : https://bit.ly/2NLgbSC (au moins 2 best of chaque semaine)🎮 Retrouve toutes les rediffusions sur ma chaîne Replay : https://bit.ly/3vASgeb🔥 Télécharge l'extension Squeezie pour ne rater aucun live : https://extensionsqueezie.fr―――⁍ Twitch : https://twitch.tv/squeezie⁍ Twitter : https://twitter.com/xSqueeZie⁍ Twitter² : https://twitter.com/SqueezieTV⁍ Discord : https://discord.gg/Squeezie⁍ Reddit : https://reddit.com/r/Squeezie―――⭐ Chaînes des Participants :@L0ckl34r @CodJordan23 @wankilfr ―――Montage vidéo : @SK0RR0R"
"JjcNmbm6BVo","BATTLEFIELD 6 LAUNCH EVENT BEST/FUNNIEST MOMENTS","2025-08-04T14:00:27Z","UCXBE_QQSZueB8082ml5fslg","TimTheTatman","20","25.05.08","timthetatman|tatmanarmy|tim|the|tat|man|timthetatman ninja|nickmercs|funny moments|gameplay|compilation|funny|fat|streamer|solos|tim solos|tim the tatman|timthetatman spectates|timthetatman highlights|timthetatman moments|best of timthetatman|best of tim|timthetatman funny|battlefield 6|battlefield 6 gameplay|trailer battlefield 6|battlefield 6 reveal|battlefield 6 trailer reaction|battlefield 6 release date|battlefield 6 multiplayer","125954","0","0","341","https://i.ytimg.com/vi/JjcNmbm6BVo/default.jpg","False","True","LIKE and SUBSCRIBE with NOTIFICATIONS ON if you enjoyed the video! 👍👉Don't forget to choose me as your support-a-creator! Use Code - timthetatman in the Fortnite Store! #EpicPartner 💪BECOME A MEMBER OF THE STREAM - https://youtube.com/timthetatman/join💰 DONATE: https://streamelements.com/timthetatman/tip👉JOIN THE DISCORD: https://discord.gg/timthetatman🔴 You can catch me live on Twitch! https://twitch.tv/timthetatman🎥 MoreTimTheTatman: https://www.youtube.com/moretimthetatman🎥 TimTheTatman Two: https://youtube.com/TimTheTatmanTwo🎥 TimTheTatman VODs: https://www.youtube.com/timthetatmanvods🎥 TimTheTatman Shorts: https://youtube.com/TimTheTatmanShorts▶️ GET CONNECTED:🖥️ Website | https://timthetatman.com/🐦Twitter | https://twitter.com/timthetatman📷 Instagram | https://www.instagram.com/timthetatman/📱TikTok  | https://tiktok.com/@timthetatman🔥SPONSORS:Razer | https://bit.ly/TimRazer - USE CODE TIM5Mountain Dew | https://mtndewgaming.com/FanDuel | https://www.fanduel.com/tatmansbkTHANKS FOR WATCHING!! 💖#timthetatman #battlefield #battlefield6"
"_F1n2ZB-TvA","This Skull Trick Made Us MILLIONS [BMM Showdown EP12]","2025-08-04T18:28:42Z","UC7FxK9k2ql_ilzyLEHQBVBg","Odablock","20","25.05.08","oldschool runescape|old school runescape|osrs pking|runescape pking|osrs pk|runescape pk|oldschool runescape pk|pking|odablock|osrs|pker|runescapes best|oldschool runescape streamer|runescape|Bronzeman Creator Showdown|odablock bronzeman mode|group bronze man|bronzeman|bronze man tourney|odablock ditter bitter|c engineer|greg|wiggled|rhys|odablock bronze man|odablock bronze group|bronze man group|group bronzeman|Bmm|bronze man event|Blood moon|p11","76942","0","0","168","https://i.ytimg.com/vi/_F1n2ZB-TvA/default.jpg","False","True","Make sure you like, comment, sub FASTTTTT***YOU CAN BUY MY MERCH HERE***https://www.odablock.net***FOLLOW MY SOCIALS***https://kick.com/odablockhttps://twitch.tv/odablockhttps://twitter.com/odablockhttps://www.tiktok.com/@odablockhttps://instagram.com/odablock/https://www.facebook.com/Odablock/If you made it this far you better be mother rucking subbed"
"xoDkyafoWLY","What if You Played AS Sans in the Fight?","2025-08-04T17:21:25Z","UCtV-Oh0FNWldfeqZCpdYO0g","MysticSlime","20","25.05.08","mysticslime|mystic slime|mysticslime undertale|mysticslime deltarune|sans|gaster|frisk|mysticslime shorts|mysticslime short|deltarune chapter 3|deltarune chapters 3 and 4|deltarune chapter 4|deltarune gerson|gerson fight|deltarune susie|undertale|deltarune|megalovania|undertale but|undertale mod|undertale but im sans|playable sans|gaster blaster|gaster blaster weapon|gaster blaster mod|frisk undertale|kris deltarune|susie deltarune","119993","0","0","407","https://i.ytimg.com/vi/xoDkyafoWLY/default.jpg","False","True","There have been a couple before, but today I play a fangame which explores how it would feel to play as Sans during the fight in the Last Corridor instead of Frisk!Check out the fangame (Dead Man's Final Gambit) here!: https://gamejolt.com/games/UTDMFG/1004750Edited by Markn:  @markn6296 Thumbnail Art by Octigone: https://x.com/octigone Deltarune and its OST by Toby Fox and published by Materia CollectiveDiscord: https://discord.gg/eJw3Cq3Twitter: https://x.com/Mystic_Slime"
"o7NI5Se6vZA","Grove Street Frat Bros are Back in GTA RP | OCRP","2025-08-04T15:01:18Z","UCO4rvxZ-bJ6uGDeSkMCmzEg","Bay Area Buggs","20","25.05.08","Grand|Theft|Auto|GTA|GTA V|GTA 5|Grand Theft Auto|GTA Online|GTA 5 Online|Multiplayer|SAPDFR|GTA V SAPDFR|GTA 5 SAPDFR|Criminal|Police|Police Chase|Police Pursuit|Bay|Area|Buggs|Bayareabuggs|Bay Area Buggs|PC|Gameplay|HD|4K|60fps|Friends|Funny|Group|Video Game|Gaming|Mods|Modifications|FiveM|Multiplayer Mods|Multiplayer With Mods|OCRP|Orange County Role Play|Role Play|Role Playing|Community|GTA 5 Roleplay|Pursuit|Frat|Bro|Bros|Grove|Street","175873","0","0","561","https://i.ytimg.com/vi/o7NI5Se6vZA/default.jpg","False","True","Join ​⁠@CivRyan, @jfavignano & myself in OCRP as the Frat Bros return to Grove street! [OCRP Recording Server]►Merch► https://buggsmerch.com►Twitter► https://twitter.com/BayAreaBuggs►Instagram► https://www.instagram.com/buggs.official►Other Links To Contact Me► http://bayareabuggs.com#OCRP #OrangeCountyRoleplay #GTA5RP"
"BlijzWiovkM","POBY & FNC TAKE ON SK - LEC SUMMER 2025","2025-08-04T17:07:31Z","UCOFiUtKui6-x4T-J7_DgCag","Caedrel","20","25.05.08","caedrel|league of legends|lec|streamer|mid|jungle|rumours|offseason|roster|lol|lolesports|lol moments|lol clips|lol streamers|lol shorts|league shorts|twitch clips|vod review|pro play|caedrel stream|caedrel highlights|caedrel clips|caedrel twitch|caedrel reacts|lcs|lck|lpl|gaming|british|pedro|funny moments|accent|caster|lol caster|analyst|pro player|worlds|msi|eulcs|videogames|variety streamer|riot games|twitch|cancelled it|fnatic|fnc|g2|t1|damwon|geng|ig","140470","0","0","255","https://i.ytimg.com/vi/BlijzWiovkM/default.jpg","False","True","Follow Marc:►https://www.twitch.tv/Caedrel►https://twitter.com/Caedrel►https://www.instagram.com/caedrel/►https://www.tiktok.com/@caedrel►►https://www.youtube.com/@caedrelplaysInquiries: Business@Caedrel.comEdited By:►https://twitter.com/HeyGuysItsMoo►►https://www.youtube.com/@AdamMuraThumbnail made by:►https://twitter.com/IndustriesTg#Caedrel #FNC #POBY"
"FNkwxlLdkSo","Stop Killing Games: Wrap up","2025-08-04T15:46:13Z","UCJ6KZTTnkE-s2XFJJmoTAkw","Accursed Farms","20","25.05.08","Videogames","324761","0","0","3364","https://i.ytimg.com/vi/FNkwxlLdkSo/default.jpg","False","True","A wrap up of the Stop Killing Games campaign!  This is kind of an alternate ending from where we were about a month ago.  This goes over the campaign, how I think we've changed the timeline, and some misc. announcements.Link to give feedback on the Digital Fairness Act:https://ec.europa.eu/info/law/better-regulation/have-your-say/initiatives/14622-Digital-Fairness-Act_enLink to contact European Members of Parliament on the Internal Market and Consumer Protection committee:https://www.europarl.europa.eu/committees/en/imco/home/membersLink about contacting UK MP's:https://www.parliament.uk/get-involved/contact-an-mp-or-lord/contact-your-mp/0:00 Intro0:40 The important parts1:35 Reflections3:08 Review of strategy6:37 Community stuff7:32 Steam / Itch censorship10:35 The timeline has changed13:40 Burned out17:35 News winding down19:31 What is this channel?22:01 Saving game worlds#StopKillingGameshttps://stopkillinggames.comhttps://accursedfarms.com"
"kDmXKPFxVrM","NBA 2K it's Now or NEVER","2025-08-04T20:40:53Z","UC8JELLR_mmbO7HonIlX-Btg","SoLLUMINATI","20","25.05.08","[none]","198336","0","0","2231","https://i.ytimg.com/vi/kDmXKPFxVrM/default.jpg","False","True","#solluminati #nba2k26 #nba2k25"
"tqEYZFvqQl8","Surviving on One Block But I'm a LABUBU Mob with Crazy Fan Girl in Minecraft!","2025-08-04T23:24:56Z","UClCvmntMJCrerMDSc1WQGNg","Omz","20","25.05.08","Cash|Nico|Nico and Cash|Cash and Nico|Minecraft|Minecraft mod|Omz|Crystal|Roxy|Luke|Lily|Johnny|Aphmau|Omziscool|Kory|Maizen|maze build|noob vs pro|noobs vs pro vs hacker|noob vs pro vs hacker vs god|cash and nico|Omz and Roxy|Roxy and Omz|Surviving on One Block But I'm a LABUBU Mob with Crazy Fan Girl in Minecraft!","183983","0","0","304","https://i.ytimg.com/vi/tqEYZFvqQl8/default.jpg","False","True","Today Omz is Surviving on One Block But he's a LABUBU Mob with Crazy Fan Girl with Roxy, Crystal, Lily, Kevin and Megan (Crazy Fan Girl) in Minecraft! #minecraft #minecraftmod #omz"
"ayySBOndH5M","🔴LIVE - DR DISRESPECT - WARZONE - RANDOMLY GENERATED LOADOUTS EVENT #drdisrespect #callofduty","2025-08-05T01:22:21Z","UCcJL2ld6kxy_nuV1u7PVQ0g","DrDisRespect","20","25.05.08","GamingLive|LiveStreaming|YouTubeGaming|TrendingNow|WarzoneChallenges|EsportsLive|StreamerVibes|WarzoneGameplay|Gaming2025|IRLChaos|CharityStream|WarzoneLive|GamingCommunity|StreamHighlights|CODWarzone|ViralGaming|EpicMoments|GamingHype|SpeedrunChallenge|WarzoneSpecialChallenges|LiveEntertainment|FunnyMoments|GamingClips|Esports2025|StreamerLife|WarzoneMeta|CommunityStream|CODClips|GamingForAll|LiveReactions|ViralStream|UnrealEngine5|AAAgaming|NewBattleRoyale|FuturisticBR|Battelfield 6|BF6","245224","0","0","69","https://i.ytimg.com/vi/ayySBOndH5M/default.jpg","False","True","Generating random weapons for each game with The Shotty Boys®.  Can we get 5 wins with 5 different randomly generated loadouts?... easily.Drink Kenetik. Use code DOC for 15% off your first order: https://kenetik.ly/doc►JOIN THE CHAMPIONS CLUB: https://youtube.com/DrDisrespect/join►DONATE: https://streamlabs.com/drdisrespect/tip►Also Streaming on Rumble! https://Rumble.com/DrDisrespect------------------------------------------------------------------------------------------------♦ Discord: https://discord.com/invite/drdisrespect♦ X: https://twitter.com/drdisrespect♦ Instagram: https://www.instagram.com/drdisrespect/♦ TikTok: https://www.tiktok.com/@drdisrespectlive ♦ Merchandise: https://www.championsclub.gg► Featuring Music from Dance With the Dead"
"oNgSLzPRF8k","STILL BIKING WITH DA BROS","2025-08-04T19:00:53Z","UCO1ITICo8MLHGAXR1uzFwjA","OneyPlays","20","25.05.08","Descenders|Descenders Gameplay|Descenders Walkthrough|Descenders Part 1|Descenders Gameplay Part 1|Descenders Game|Descenders Funny|Descenders Oneyplays|Descenders Video Game|Descenders Steam|Descenders Steam Gameplay|Descenders Steam Walkthrough|Descenders Steam Part 1|Descenders Steam Gameplay Part 1","63409","0","0","590","https://i.ytimg.com/vi/oNgSLzPRF8k/default.jpg","False","True","Subscribe for more Oney Plays ► http://bit.ly/oneysholeOney Plays Descenders for PC. This video of Descenders Gameplay / Walkthrough was recorded in 1080p as a Let's Play or LP by OneyPlays. Follow Oney Plays on Twitter: http://twitter.com/oneyplaysOur Merch Store ► http://oneyplays.storeFollow Oney Plays on Facebook: https://www.facebook.com/oneyplaysFollow Oney on Instagram: https://www.instagram.com/oneyscSubscribe to Oney Cartoons! ► http://bit.ly/1i9kZFOCheck out my Music Channel! ♫ http://bit.ly/1i8zi3zFollow me on Facebook: http://facebook.com/oneysvideohole"
"POlofjoVGl4","Dan loves Raptor Magic House Simulator | Creepy Redneck Dinosaur Mansion 3","2025-08-04T17:00:36Z","UC9CuvdOVfMPvKCiwdGKL3cQ","GameGrumps","20","25.05.08","lets play|walkthrough|gameplay|egoraptor|danny|game grumps|gamegrumps|funny|arin|letsplay|gaming|let's play|game play|dan avidan|arin hanson|Game Grumps","73214","0","0","223","https://i.ytimg.com/vi/POlofjoVGl4/default.jpg","False","True","Click to SUBSCRIBE ► http://bit.ly/GrumpSubscribeSupport us on Patreon! ► https://www.patreon.com/gamegrumps*********************************************MERCH!! ► http://gamegrumps.com/merch*********************************************FACEBOOK ► https://www.facebook.com/GameGrumpsINSTAGRAM ► https://www.instagram.com/gamegrumps/TIKTOK  ► https://www.tiktok.com/@gamegrumpsTWITTER ► https://www.twitter.com/gamegrumpsWEBSITE ► http://gamegrumps.comOur email list! ► http://eepurl.com/cN7syX *********************************************Game Grumps are:Arin ► http://www.youtube.com/EgoraptorDanny ► http://www.youtube.com/NinjaSexParty#gaming #GameGrumps #gamename"
"ZO-LsGhr-3Y","$0 to $1 Trillion but COLORS Decide my Powers!","2025-08-04T18:46:55Z","UC9b7M28htb6T5CjY7nq_OyQ","Woozer","20","25.05.08","[none]","209558","0","0","503","https://i.ytimg.com/vi/ZO-LsGhr-3Y/default.jpg","False","True","$0 to $1 Trillion but COLORS Decide my what i use in grow a gardenRoblox Username - Woozerbloxyt Join our Community's Discord ! https://discord.gg/M9JcsdhfMxJOIN The Official Group!https://www.roblox.com/communities/35247183/Woozers-Crew#!/about#growagarden    #roblox"
"Iiku347pMIU","BIOME BUILD BATTLE IN BLOXBURG","2025-08-04T18:00:14Z","UC-xlbELlElmSuioJ3hK7EqA","Alaska Violet","20","25.05.08","[none]","127367","0","0","1846","https://i.ytimg.com/vi/Iiku347pMIU/default.jpg","False","True","4 TEAM 4 DIFFERENT BIOMES WHO DO YOU THINK WILL WIN?Become A Channel Member by pressing the 'JOIN' button next to subscribe to gain extra perks!:https://www.youtube.com/channel/UC-xlbELlElmSuioJ3hK7EqA/join ⇣ You Can Also Find Me Here ⇣SECOND CHANNEL ⬇https://www.youtube.com/channel/UCLNHGfTZgteXodzb_iEtipgPERSONAL CHANNEL⬇https://www.youtube.com/channel/UCbpScw4pdbic2cEz8SBbfVADISCORD ⬇https://discord.gg/Az8WUZwQy7ROBLOX GROUP⬇ https://www.roblox.com/groups/15672029/ALASKIANS#!/aboutFOLLOW ME ON ROBLOX ⬇ https://www.roblox.com/users/447951668/profileTIKTOK ⬇https://www.tiktok.com/@alaskaviolettINSTAGRAM ⬇ https://www.instagram.com/alaskaviolett/ #roblox"
"NLbt7UbREqY","BLOWING ourselves up! - Schedule 1 (#18)","2025-08-04T15:00:40Z","UC_dslIyEBtgR-di_dnZ4Nog","Neebs Magic Dumpster","20","25.05.08","neebs gaming|neebs|appsro|thick44|doraleous|simon|gaming|gameplay|funny videos|funny|funny video|comedy|comedy video|fun squad|fun team","60554","0","0","621","https://i.ytimg.com/vi/NLbt7UbREqY/default.jpg","False","True","🟠 Want a server that supports Neebs Gaming? Grab it here! https://nitra.do/NeebsGaming🔴Live on Twitch every Thursday at 8pm ET! https://www.twitch.tv/NeebsGaming 🟡 Check out our main channel - youtube.com/neebsgaming🔵 Merch baby! http://neebs-gaming.myspreadshop.com🟤 Neebs Gaming Coffee! https://bit.ly/neebscoffee (Use Code NEEBS10 at checkout for a 10% discount!)"
