video_id,title,publishedAt,channelId,channelTitle,categoryId,trending_date,tags,view_count,likes,dislikes,comment_count,thumbnail_link,comments_disabled,ratings_disabled,description
"7rUEclo9yGs","J’ai Amélioré le Jardin de mes Abonnés pendant 24h ! (Grow a Garden)","2025-08-04T15:55:26Z","UCiFyJ_EBmF2XJuR9buWE_3A","Unchained_Off","20","25.05.08","unchained|unchained_off|unchained fortnite|fortnite|jeu vidéo|squeezie|gameplay|drole|gratuit|unchained gaming|fortnite battle royale|vbucks|mise à jour|chapitre|maj|fortnite maj|fortnite chapitre|skin gratuit|boutique|VBucks|fortnite clip|défi top 1|top 1|xp gratuit|glitch|fortnite xp|map xp|exp|unchained map|hack|nouveau|short|chanceux|roblox|unchained roblox|robux|secret|roblox brainrot|grow a garden|roblox garden|garden|mythes|unchained mythes|jardin","210403","0","0","2220","https://i.ytimg.com/vi/7rUEclo9yGs/default.jpg","False","True","J'ai transformé le jardin éclaté au sol d'un abonné en un paradis avec des fruits et des pets ultra rares sur Grow a Garden ! Pour ça comme d'habitude, j'ai dépenser des robux sans compter...🟪Code MAP Octo Game 3 : 7473-0134-7600 (publicité)🟦Code MAP 1V1V1 RELOAD : 0785-7672-3215 (publicité)🟥Code MAP Lama Wars : 4660-4454-3176 (publicité)🟨Code MAP Super Pit : 8068-9359-0183 (publicité)Code MAP SUPER MAMMOTH : 1699-5054-8430 (publicité)Code MAP Red vs Blue :  8970-6014-8339 (publicité)🎁Abonne-toi à ma chaine IRL ► https://bit.ly/Subscribe2Unchained💖MON INSTA : https://www.instagram.com/unchained_off✅Code : unchained sur Fortnite ! (publicité)🔴MON TWITCH : https://www.twitch.tv/unchainedsurtwitch💜Discord : https://discord.gg/unchained🖤Mon Tik Tok : unchained_off#epicpartner #unchained #roblox"
"woLfAvD5iXI","Chappell Roan - The Subway (Official Music Video)","2025-08-01T14:00:09Z","UCBoNpX06hjs3_ASFftQEmww","ChappellRoanVEVO","10","25.05.08","Chappell Roan|Chappell Roan PS/ Island|Pop","5112893","0","0","15984","https://i.ytimg.com/vi/woLfAvD5iXI/default.jpg","False","True","Listen to The Subway out now: https://chappellroan.lnk.to/TheSubway Subscribe for more official content from Chappell Roan: https://ChappellRoan.lnk.to/SubscribeID Connect with Chappell Roan:http://iamchappellroan.comhttps://facebook.com/chappellroanhttps://instagram.com/chappellroanhttps://twitter.com/chappellroanhttps://soundcloud.com/chappellroanhttps://www.tiktok.com/@chappellroanhttps://laylo.com/chappellroan Director - Amber Grace Johnson Production Company - Object & AnimalEP - Alex BrinkmanProducer - Myriam SchroeterCreative Producer - Zara Saraon Director of Photography - Norm LiProduction Designer - Griffin Stoddard  Wardrobe Stylist - Genesis WebbArtist Makeup - Andrew DahlingArtist Hair - Lacy RedwayHair Designer / Hair Costumes and Hair Set Design - Charlie le MinduCLM Creative Assistant - Studio Manager - Nirina Metz  Background Wardrobe Stylist - Dominick BarcelonaCasting Director - Damian Bao Choreographer - Danielle PolancoChoreographer Assistant - Mishay Petronelli Production Supervisor - Raven JensenAddtl. Production Supervisor       - Justine NewmanAssistant Production Supervisor - Daniel OrderProduction Consultant - Matthew Dipple Editor - Mah Ferraz @ ChurchColor - Dante Pasquinelli @ Ethos VFX Company - Corduroy CG Artist - Loni PaoneVFX Artist - Cooper VacheronOn-Set VFX Supervisor - Greg Joblove Island Records - Natasha Kilibarda, Liv KookerFoundations Management - Drew Simmons, Lauren McKinney, Kyle Goold Commissioner - Steven Gottlieb LYRICSI saw your green hairBeauty mark next to your mouthThere on the subwayI nearly had a breakdown A few weeks laterSomebody wore your perfumeIt almost killed meI had to leave the room It's just another dayAnd it's not over till it's overIt's never overIt's just another dayAnd it's not over till it's overIt's never over Til I don't look for you on the staircaseOr wish you thought that we were still soulmatesBut I'm still counting down all of the daysTil you're just another girl on the subway Made you the villainEvil for just moving onI see your shadowI see it even with the lights offI made a promise, if in four months this feeling ain't goneWell, fuck this city! I'm movin' to Saskatchewan It's just another dayAnd it's not over till it's overOh til its overIt's just another dayAnd it's not over till it's overIt's never over Til I can break routine during foreplayAnd trust myself that I won’t say your nameBut I'm still counting down all of the daysTil you're just another girl on the subway She's got, she's got a wayShe's got a way, she's got a way She got, she got awayShe got away, she got away She's got, she's got a wayShe's got a way, she's got a way She got, she got awayShe got away, she got away She's got, she's got a wayShe's got a way, she's got a way She got, she got awayShe got away, she got away She’s got, she’s got a way She’s got a way, she’s got a way She got, she got away She got away, she got away #ChappellRoan #TheSubwayMusic video by Chappell Roan performing The Subway.© 2025 KRA International Inc., under exclusive license to Island Records, a division of UMG Recordings, Inc."
"geG62_Ykzkg","Gurram Paapi Reddy Movie Teaser | Naresh Agastya, Faria A, Yogi B | Krishna Saurabh | Murali Manohar","2025-08-04T10:30:22Z","UCnJjcn5FrgrOEp5_N45ZLEQ","T-Series Telugu","10","25.05.08","Telugu New Teaser|Telugu Teaser|Telugu Video Teaser|Telugu Hit Teaser|telugu hit Teaser|telugu super hit Teaser|latest video|Latest Telugu Teaser 2025|latest telugu Teaser|telugu Horror Comedy Teaser|Gurram Paapi Reddy Movie Teaser|Gurram Paapi Reddy Teaser|Gurram Paapi Reddy Latest Teaser|Gurram Paapi Reddy Naresh Agastya Teaser|Gurram Paapi Reddy Faria Abdullah Teaser|Yogi Babu Gurram Paapi Reddy Teaser|Gurram Paapi Reddy Hasya Brahma Brahmanandam Teaser","499946","0","0","194","https://i.ytimg.com/vi/geG62_Ykzkg/default.jpg","False","True","Here's the Ultimate Fun-packed Official Teaser of #GurramPaapiReddy A thrilling fusion of comedy, action, and entertainment, featuring a spectacular ensemble & supporting crew.#GurramPaapiReddy #LatestTeluguTeaser ------------------------------------------ Connect with T-Series Telugu: 👉 http://bit.ly/SubscribeToTseriesTelugu------------------------------------------🎬 Movie Slate 🎬Cast: Naresh Agastya, Faria Abdullah, Yogi Babu, Hasya Brahma Brahmanandam Garu, Rajkumar Kasireddy, Vamshidhar Kosgi, Jeevan Kumar, John Vijay and Motta Rajendran Crew:Director: Murali ManoharMusic: Krishna SaurabhDOP: Arjun RajaEditor: Karthika SrinivasStory: Poorna PrajnaProducers: Venu Saddi, Amar Bura, Jayakanth (Bobby)Presented by MJM Motion Pictures & Bura and Saddi Creative ArtsPro : Suresh - SrinuDigital : Housefull Digital Music Label: T-Series---------------------------Enjoy & stay connected with us!!👉Subscribe to T-Series Telugu: http://bit.ly/SubscribeToTseriesTelugu👉Like us on Facebook: http://www.facebook.com/Tseriestelugu👉Follow us on Instagram: http://bit.ly/InstagramT-SeriesSouthOffical👉Follow us on Twitter: http://bit.ly/TwitterT-SeriesSouthOffical👉Follow us on Whatsapp: https://bit.ly/4cGF0YV👉Follow us on SnapChat: https://bit.ly/4jpOwCC Thanks Everyone for Watching Our Latest Telugu Song 2025. If you like the song than Please SUBSCRIBE Our Channel With Bell Icon to get notification of all of our newest releases. Will Make Sure to provide best Telugu songs of all time."
"UN-vAF7sFm0","Playing BANNED Roblox dev's games","2025-08-04T02:31:19Z","UCm-X6o81nRsXQTmqpyArkBQ","Flamingo","20","25.05.08","roblox|flamingo|roblox meme|roblox ban|roblox funny","1209811","0","0","5297","https://i.ytimg.com/vi/UN-vAF7sFm0/default.jpg","False","True","Today I go over some of the most famous BANNED Roblox developers and play their gamesplay the game I used here: https://www.roblox.com/games/139116419950695"
"24VTkFOsheM","KOKA GAANI (Official Video) | Ranjit Bawa | Bunty Bains | Desi Crew | New Punjabi Song 2025","2025-08-04T12:30:06Z","UCRleogeV1JmbIfpfiFLDEuA","Bunty Bains","22","25.05.08","New punjabi songs|new songs|Proud jawani ep|Proud jawani songs|Bunty bains new song|Desi crew new song|Trending songs|Trending punjabi songs|Latest songs 2025|Latest songs|New hit songs|Punjabi hit songs|Punjabi bhangra songs|Dj songs|Romantic songs|New music|New punjabi song|New songs punjabi|Karan aujla songs|Karan aujla latest song|Ranjit bawa|Desi crew|Bunty bains|Bawa new song trending|New songs|New songs trending|ranjit bawa new songs","48232","0","0","12","https://i.ytimg.com/vi/24VTkFOsheM/default.jpg","False","True","Punjabi Folk Pop Song#PunjabiFolkPopCulture Folk PopProduced By - Amanpreet Kaur BainsSinger - Ranjit BawaLyricist & Composer - Bunty BainsMusic Composer – Desi CrewEP - Proud JawaniMusic Arranged And Programmed By – Desi CrewMix & Master – DenseFeaturing - Kulmeet BhargavEditor & Colorist  : Jagjit SIngh DhanoaVideo - Sudh SinghMusic Distribution - Coin DigitalPublicity Design - Raman LohatDOP - Mani Art Choreographer - Sumit KumarArt - SonuProduction - V Sign Ad - Karan MatharuCostume - Rajat ManchandaMakeup - Prabh MakeoverHair - Sony AlkiaMusic Distribution - Coin DigitalTeam - Brand BShivam Sharma, Varinder Singh Mehngu, Chamkaur Singh, Kala Grewal, Gagan Bharti, Jashan Gill, Anjani Kumar"
"aWEeLM2qYbw","Punjabi Aa Gaye Oye - Teaser | Prince Kanwaljit Singh | Singga | Adityas Group | In Cinemas 29 Aug","2025-08-03T03:30:07Z","UCwUGlK3mSJtUhJLrzSN7pzg","Adityas Group","24","25.05.08","Punjabi Aa Gaye Oye|punjabi aa gaye oye|prince kawaljit singh|singaa|prince kawaljit singh new movie|singga new movie trailer|prince kanwaljit singh movie|punjabi aa gaye oye movie trailer|new punjabi movie 2025|punjabi movie 2025|punjabi aa gaye oye teaser|punjabi aa gaye oye trailer|adityas group|pamma full movie|pamma full movie warning|punjabi aa gaye oye new movie|latest punjabi movie 2025|punjabi movie trailer|punjabi movie teaser","676001","0","0","695","https://i.ytimg.com/vi/aWEeLM2qYbw/default.jpg","False","True","Punjabi Aa Gaye Oye is an upcoming Punjabi film starring Prince Kanwaljit Singh, Singga, and Twinkle Arora in lead roles. Directed by Aditya Sood, this emotionally charged drama promises action, heart, and entertainment, releasing worldwide on 29th August 2025.Presented by: Banner Adityas Group of Industries Written & Directed by: Aditya SoodProducer: Harmandeep SoodCreative Director: Ojayit SoodCast: Prince Kanwaljit Singh, Singga, Twinkle Arora, Gurtej Ghuman (Gurri), Danishk Sood, Gurman Singh, Saraansh Sharma,Ajay Jethi, Gurinder Makhna, Jatinter jittu, bhuraDirector of Photography (DOP): Ashpaq ShaikhEditor: Rohit DhimanAssociate Director: Mukesh VohraMusic Directors: Gurmeet Singh, Kevin Roy George, Crowny, Nikzzy, Luvv Pran MehetaLyricists: Prince Kanwaljit Singh, Daljit Chitti, Kayth, Kang Sadiq, Sukhi Kang background score : Kevin Roy GeorgeExecutive Producer: Shubham ChandrachurLine Producer: Ajay SoodChief Assistant Director: Hardeep Mander1st Unit Associate Director: Sukhbir SinghChief Assistant Camera (AC): Tarique KhanArt & Props: Harjit (Bagga Arts)Costume Designer: Rajat ManchandaChoreographer: JohnAction Director: Monu KambojStills & Making: K Raj (Famous Films)Poster Still: Daas StudioMotion Designer: Junaid AnsariVFX: Rubab StudioDI & Sound Post: Afterplay Studios (Maddy)DI Colorist: Prakash JosephSound Design & Mixer: Deepak PoojariInstagram: @afterplaystudios, @maddy.afterplayPublicity Design: Balbir Rehal (Impressive Design Studio)Worldwide Distribution: WeReleaseDistribution Partner: The Next Film Studio (Parmood Thakur)Promotional Partners: Vishal Promotion, Hashtag Studio (Pratham Verma)PR Agency: PR Knock MediaCreative Marketing: Yogesh Verma (Punjabi Front)Music Distribution: Coin DigitalSpl thanks: Sandeep Bansal ji, Vivek ohri ji, Deepak Gupta ji, Sonu nigam #PunjabiAaGayeOye #PrinceKanwaljitSingh #Singga #29august #punjabimovies2025Get ready for an unforgettable ride with Punjabi Aa Gaye Oye — releasing 29th August 2025. Mark your calendars and feel the vibe of true Punjabi emotion and entertainment!"
"8BsedZjXI1c","This Is What Makes One Slot Better Than Another","2025-08-04T18:45:01Z","UCbCQBD9gKSEnNtIqmKY1R3Q","Vegas Matt","24","25.05.08","Las Vegas|Vegas|gamble|handpay|slot machine|winning|losing|slots|gambling|slot|vegas matt|casino|vegasmatt|vegas matt slots|jackpot|slot machine handpay|casinos|baccarat|blackjack|roulette|get even or even worse|sando","289278","0","0","3669","https://i.ytimg.com/vi/8BsedZjXI1c/default.jpg","False","True","Vegas Matt Merch👉https://vegasmatt.shop/Watch our livestreams 👉https://youtube.com/@VegasMattAndFriends2025 Stats 📉Results prior to this episode: -$396,626$2960 LOSS last episode 😉-$399,586 YTDYTD Side bet totals:Vegas Matt $15,133EJ $4886WBG -$18,872W2Jesus -$1102Lucky Rob -$200Kevin $1,355Poofesure $200Coach Z -$800Big Mike -$300Annie L -$300See our complete 2025 stats on our Discord 👉https://discord.gg/vegasmatt"
"lyogHC6UwlI","Skillibeng - DADA (Official Video)","2025-08-04T16:00:06Z","UCULhn0Qgbett6rjWH2vkhEA","SkillibengVEVO","10","25.05.08","DADA|Hip Hop|Skillibeng|skillibeng dada|new skillibeng|dancehall|shenseea|tip remix|skillibeng tip|skillibeng jump|tyla|shake it to di max|shake it to the max|silent addy|ayetian|big strap|skillibeng strap|MOLIY|JADA KINGDOM|konshens|skillibeng missbnasty|skillibeng badman|badman she love|crocodile teeth","64196","0","0","370","https://i.ytimg.com/vi/lyogHC6UwlI/default.jpg","False","True","Skillibeng - DADA Stream here // https://skillibeng.lnk.to/DADAFollow Skillibeng:Instagram: https://www.instagram.com/skillibengTwitter: https://twitter.com/skillibengFacebook: https://www.facebook.com/skillibengDirector/Cinematographer/Editor: Fernando Hevia @fernandofheviaAssistant director: Samo @Samokush_iStylist: Tamo Ennis @thetamoennisProduction company: Filmaica @filmaica  Camera assistant: Jade Brown @neriah_stainGaffer: Kai Bennet @kaithekreator_Grip: Jordon Newman @j.o.r.d.n_PA: Shari Marie @sharsharrzz Lemar Grant @aristocratzzz_xtmDancers: Dancehall Twinz @tandatwinz Chyna @1chyna.doll#Skillibeng #DADA #Dancehall"
"Wg_4SXMFSTM","The RIFT | Trailer | Denzel Washington, Jason Statham, Gal Gadot | 2025 Movies Trailers","2025-08-02T12:50:00Z","UCfz4KiPmlUUlqB8kSfKO3qA","Countdown Studio","22","25.05.08","john wick 5|fast and furious 11|extraction 3 trailer|trailers 2025|equalizer 4|trailer|fast and furious 11 trailer|john wick 5 trailer|movie trailers 2025|extraction 3|movie trailers|fast x 2 trailer|fast x part 2|john wick|new movie trailers 2025|trailers|fast and furious|the equalizer 4|night has fallen trailer|trailer 2025|the mechanic 3|fast 11|jason statham movies|2025 movie trailers official|movies|fast 11 trailer|james bond","1022189","0","0","280","https://i.ytimg.com/vi/Wg_4SXMFSTM/default.jpg","False","True","🎥 Attention viewers! (ITS FAN MADE)Please note that this video is a concept trailer created solely for artistic and entertainment purposes. I have meticulously incorporated various effects, sound design, AI technologies, movie analytics, and other elements to bring my vision to life. Its purpose is purely artistic, aiming to entertain and engage with the YouTube community. My goal is to showcase my creativity and storytelling skills through this trailer. Thank you for your support, and let's dive into the world of imagination! 🍿#fastandfurious11  #missionimpossible  #johnwick The RIFT | Trailer | Denzel Washington, Jason Statham, Gal Gadot | 2025 Movies Trailer | Concept"
"G2qgxatXOHE","The Most BROKEN Furnace Evolution Deck in Clash Royale","2025-08-04T14:25:52Z","UCAw2ZHAIP177ryD3WF9iXmw","Ryley - Clash Royale","20","25.05.08","clash royale","307262","0","0","443","https://i.ytimg.com/vi/G2qgxatXOHE/default.jpg","False","True","Subscribe to me: https://youtube.com/@ryleycr1?si=Bpd2rfnihTk5SWhS?sub_confirmation=1Business Enquiry - collab@thirdrailavenue.comBecome a member of this channel to get access to perks:https://www.youtube.com/channel/UCAw2ZHAIP177ryD3WF9iXmw/join Best Clash Royale Deck 2024Best Deck in Clash Royale 2024Best Logbait DeckClash Royale Best Deck#clashroyale #bestclashroyaledeck #ryley"
"FbXOsVByKmk","They Call Him OG - Firestorm Lyric Video | Pawan Kalyan | Sujeeth | Thaman S | DVV Danayya","2025-08-02T08:53:07Z","UCn4rEMqKtwBQ6-oEwbd4PcA","Sony Music South","10","25.05.08","Sony Music South|Sony Music|Latest Song|Telugu Songs 2023|Songs in Telugu|Telugu Movie Songs|Video Songs Telugu|new Telugu Songs|HungryCheetah|TheyCallHimOG|Pawan Kalyan|Priyanka Arul Mohan|Sujeeth|FIRESTORM IS COMING|first storm|og first single|og pawan|pawan kalyan songs|thaman s|thaman songs telugu|telugu songs|telugu songs new|pawan kalyan og|thaman songs|pawan kalyan og teaser|pawan kalyan og trailer|telugu trending songs|og movie","9227312","0","0","35352","https://i.ytimg.com/vi/FbXOsVByKmk/default.jpg","False","True","The most awaited #FireStorm lyrical video is here to blast your speakers and take you on a wild ride 🔥Enjoy the madness that you won’t be able to get over anytime soon.#OG storms into cinemas worldwide on September 25th, 2025.THEY CALL HIM OG - FIRESTORM CREDITS LIST:Song Title : FIRE STORM Album / Movie : They Call Him OGWritten & Directed by Sujeeth Music by Thaman SProduction: DVV EntertainmentPresented by: Smt D.ParvathiProduced by DVV Danayya, Kalyan DasariDI : Annapurna StudiosAudio on: Sony MusicMusic credits :Programmed & Arranged by - Thaman S Male Singers:  Thaman S , Nazeeruddin & Bharathraj R , Silambarasan TR ( Simbu ) , Deepak BlueFemale Verses: Raja kumari Telugu Lyrics: Vishwa, Srinivasa MouliEnglish Lyrics: Raja kumariJapanese Lyrics : Adviteeya VojjalaEDM Works - Beyond Sound (T) & The Gongura Sound ( Band ) Hukaido Taiko & War Drums - A Sivamani Additional Nagado & Hirado drums - THAMANIA ( T ) Additional Programming - Shashank Alamuru Japanese koto & Guzhen - Subhani Cellos Viola & Electric violin - Sandilya Electric Guitars - Subhani , Subashree & SunnyMale Harmony: Deepak Blue, Aravind Srinivas, Abhijith Rao, Akash Ravikumar, Vikram Pity, Sai Vignesh, Sai charan, Aravind Annest, Shridhar Ramesh, Balaji Sri, Vignesh Narayanan, Sudharsan Ram, Bharath Raj, Nazeeruddin.Dialogue Vocals By Arjun DasRecorded at AM Studios, Vibe by - Hari S R & V studios - by Osho VVocal Supervision - Adviteeya Mixed & Mastered By - Shadab Rayeen @ New Edge ( Mumbai ) & New Edge ( CaL ) New Edge Team – Anup, Prasad , Sohamm, Rupam , KundanAssisted by - Anoop Musicians Co Ordinator - Manikandan KStudio Manager - Seenu & SridharStudio Assistance - Raju , Kannan, Lingam & PawanCrew Details:Movie Name: They Call Him OGCinematographers : Ravi K Chandran (ISC), Manoj Paramahamsa (ISC)Production Designer : AS PrakashEditor: Navin NooliCostume Designers: Darshan Jalan & Neelanchal Kumar GhoshAction Masters : A Vijay, Peter Hein, Dhilip Subbarayan, Kevin kumar, Stunt Silva, Sunil Rodrigues, Kecha Khampakdee, Juji, Supreme Sundar, Jashwa, ParvezCo-director: Somaraju PVVCreative Producer : Harish PaiExecutive Producer: Sathyanarayana GuggillaProduction Controller: Manikanta RongalaVFX Supervisor : Raghav TammareddyCreative Director : Ashwin ManiMarketing: Walls and TrendsPRO: VenugopalVideo Song credits : Song Cinematographer : GK VishnuSong Art Director : K Udaya kumar Choreographer : SandySong Costume Designer : Pallavi SinghSong Editor : Nikhil NadellaAssociate Song Editor : Prashanth TejaSong poster designer : Suryah.Psd, Aesthetic KunjammaLyrical Video Concept : Sainadh Alla, I.Chaitanya Sravanth, Kedar Pashikanti, Sabari Ramiro ( Instinct Designs )Lyrical Video By : Sabari Ramiro ( Instinct Designs ) Music Label - Sony Music India Pvt. Ltd.© 2025 Sony Music Entertainment India Pvt. Ltd.Subscribe Now: http://bit.ly/SonyMusicSouthVevoSubscribe Now: http://bit.ly/SonyMusicSouthYTFollow us: https://www.instagram.com/sonymusic_south/Follow us: Twitter: https://twitter.com/SonyMusicSouthLike us: Facebook: https://www.facebook.com/SonyMusicSouthJoin our WhatsApp broadcast channel https://whatsapp.com/channel/0029VaAThD53GJOwZNFUJZ3BJoin Our Instagram broadcast channel https://ig.me/j/Abal-auA3Y5L6OtV/"
"qFKs3XEtiHA","COOLIE Trailer Reaction! | Rajinikanth | Nagarjuna Akkineni | Aamir Khan","2025-08-04T12:02:12Z","UCwV_A5L1hhEVfld6Wbxn3jg","CineDesi","23","25.05.08","trailer|reaction","160074","0","0","652","https://i.ytimg.com/vi/qFKs3XEtiHA/default.jpg","False","True","Jaby & Achara react to the explosive trailer for Coolie, marking the fiery return of Rajinikanth in a mass-loaded, emotional action drama.Directed by Lokesh Kanagaraj (Leo, Vikram), Coolie brings back Rajinikanth (Jailer, Kaala) in a powerful new avatar—mixing grit, style, and legacy. With Anirudh Ravichander’s pulse-pounding score and stunning visuals, the film promises high-octane action and deep-rooted emotion.Jaby & Achara break down the intensity, vintage Rajini swag, and Lokesh’s signature world-building. Coolie looks like a full-blown cinematic celebration of one of India’s biggest icons.____________________Thank you to our Jamazing Patron: Krishna Venkataraman!Be a patron for CineDesi and support more videos like this!https://cinejump.com___________________________________________________Original Upload Link: https://www.youtube.com/watch?v=qeVfT2iLiu0___________________________________________________SOCIAL MEDIA:~CINEDESI~YouTube: @CineDesiTwitter: https://twitter.com/TheCineDesiInstagram: https://instagram.com/TheCineDesi~ACHARA KIRK~Instagram: @AcharaKirk ~A.U. ARJUN~Logo Character Designer: https://instagram.com/auarjun~MOOSA RAZA~Moosa Raza created additional background animation.Instagram: @syedraza7Twitter: @MoosaRaza27___________________________________________________SHORT FILMS PLAYLIST:https://www.youtube.com/playlist?list=PL34B19BA788E18384Thanks for watching!!!__________________________________________________"
"C5D_dD3Hf_A","$0 to $1 Trillion Using One TACO FERN Seed!","2025-08-04T19:30:04Z","UCsA57c8OT0JfnX_yL3Ev1ZQ","Koopekool","20","25.05.08","koopekool|roblox|anime|grow a garden|meenyu|bachablox|foltynplays","277298","0","0","718","https://i.ytimg.com/vi/C5D_dD3Hf_A/default.jpg","False","True","$0 to $1 Trillion Using One TACO FERN Seed!SUBSCRIBE FOR MORE: ➡️ https://www.youtube.com/channel/UCsA57c8OT0JfnX_yL3Ev1ZQ ⬅️More Koopekul:Main: https://www.youtube.com/c/KoopekulGame: grow a gardenFollow all of these if you are cool:🟣 Twitch: https://www.twitch.tv/koopekool✍️ Twitter: https://twitter.com/koopekul🎮 Discord: https://discord.gg/koopekoolContact me for Business: koopekoolbusiness@gmail.comEditor: https://twitter.com/mo3dits"
"PAmadqlMS2E","The Script - Hall Of Fame (Lyrics)","2025-07-28T19:01:56Z","UCUAKnbzmEngBSRT6OOWfaGA","DrillPulse","10","25.05.08","[none]","298480","0","0","10","https://i.ytimg.com/vi/PAmadqlMS2E/default.jpg","False","True","The Script - Hall Of Fame Top Songs playlist: https://drillpulse.short.gy/topsongsSubscribe to DrillPulse on YouTube: https://drillpulse.short.gy/subscribeCheck out our playlists: https://drillpulse.short.gy/playlistsLyrics: The Script - Hall Of Fame Yeah, you can be the greatest, you can be the bestYou can be the King Kong bangin' on your chestYou can beat the world, you can win the warYou can talk to God, go banging on his doorYou can throw your hands up, you can beat the clockYou can move a mountain, you can break rocksSome will call that practice, some will call that luckBut either way you're going to the history booksStanding in the Hall of FameAnd the world's gonna know your name'Cause you burn with the brightest flameAnd the world's gonna know your nameAnd you'll be on the walls of the Hall of FameYou can go the distance, you can run a mileYou can walk straight through hell with a smileYou can be a hero, you can get the goldBreaking all the records they thought would never be brokeYeah, do it for your people, do it for your prideAre you ever gonna know if you never even try?Do it for your country, do it for your name'Cause there's gonna be a day when you'reStanding in the Hall of FameAnd the world's gonna know your name'Cause you burn with the brightest flameAnd the world's gonna know your nameAnd you'll be on the walls of the Hall of FameYou'll be on the walls of the Hall of FameBe students, be teachersBe politicians, be preachers, yeah (yeah)Be believers, be leadersBe astronauts, be championsBe truth seekersBe students, be teachersBe politicians, be preachers, yeah (yeah)Be believers, be leadersBe astronauts, be championsStanding in the Hall of FameAnd the world's gonna know your name'Cause you burn with the brightest flame (oh-oh)And the world's gonna know your nameAnd you'll be on the walls of the Hall of FameYeah, you can be the greatest, you can be the bestYou can be the King Kong bangin' on your chestYou can beat the world, you can win the warYou can talk to God, go bangin' on his doorYou can throw your hands up, you can beat the clockYou can move a mountain, you can break rocksSome will call it practice, some will call that luckBut either way you're going to the history booksStanding in the Hall of Fame"
