video_id,title,publishedAt,channelId,channelTitle,categoryId,trending_date,tags,view_count,likes,dislikes,comment_count,thumbnail_link,comments_disabled,ratings_disabled,description
"LOh2wiBYJJg","Manu Chao - Me Gustas Tu (Letra/Lyrics)","2025-07-31T13:00:38Z","UCAKAf5d5-O5t58gEjXhF3mg","Creative Chaos","10","25.05.08","manu chao me gustas tu|manu chao me gustas tu letra|manu chao me gustas tu lyrics|me gustas tu manu chao|me gustas tu manu chao letra|me gustas tu manu chao lyrics|me gustas tu letra manu chao|me gustas tu lyrics manu chao|manu chao|me gustas tu|me gustas tu letra|me gustas tu lyrics|me gustas tu tiktok|manu chao letra me gustas tu|manu chao me gustas tu tiktok|me gustas tu manu chao tiktok|manu chao - me gustas tu|me gustas tu - manu chao|manu chao lyrics","151195","0","0","16","https://i.ytimg.com/vi/LOh2wiBYJJg/default.jpg","False","True","🎵 Best TikTok Viral Music: https://youtube.com/playlist?list=PLBbWAaEu3aidb5XY-CVhuOVK-53HyNPlV😈 Viral Phonk Music:https://open.spotify.com/playlist/1nWMLiZltxgqoOVjxGvfhnCheck out my Spotify playlist: https://spoti.fi/2Jba0lx⏬ Download / Stream: https://manuchao.lnk.to/VivaTuAlbum⚡️ Manu Chao:https://www.manuchao.nethttps://www.instagram.com/manuchaoofficialhttps://www.facebook.com/manuchaohttps://www.facebook.com/manuchao⚡️ Creative Chaos:https://soundcloud.com/creativchaoshttps://open.spotify.com/user/creativchaoshttps://www.tiktok.com/@creative.chaos_https://www.facebook.com/creatvchaoshttps://x.com/crevtivechaoshttps://www.instagram.com/creativ.chaosLyrics:[Intro]¿Qué horas son, mi corazón?Te lo dije bien claritoPermanece a la escuchaPermanece a la escuchaDoce de la noche en La Habana, CubaOnce de la noche en San Salvador, El SalvadorOnce de la noche en Managua, Nicaragua[Verso 1]Me gustan los aviones, me gustas túMe gusta viajar, me gustas túMe gusta la mañana, me gustas túMe gusta el viento, me gustas túMe gusta soñar, me gustas túMe gusta la mar, me gustas tú[Estribillo]¿Qué voy a hacer? Je ne sais pas¿Qué voy a hacer? Je ne sais plus¿Qué voy a hacer? Je suis perdu¿Qué horas son, mi corazón?[Verso 2]Me gusta la moto, me gustas túMe gusta correr, me gustas túMe gusta la lluvia, me gustas túMe gusta volver, me gustas túMe gusta marihuana, me gustas túMe gusta colombiana, me gustas túMe gusta la montaña, me gustas túMe gusta la noche (Me gustas tú)[Estribillo]¿Qué voy a hacer? Je ne sais pas¿Qué voy a hacer? Je ne sais plus¿Qué voy a hacer? Je suis perdu¿Qué horas son, mi corazón?[Verso 3]Doce, un minutoMe gusta la cena, me gustas túMe gusta la vecina, me gustas túRadio Reloj, una de la mañanaMe gusta su cocina, me gustas túMe gusta camelar, me gustas túMe gusta la guitarra, me gustas túMe gusta el reggae, me gustas tú[Estribillo]¿Qué voy a hacer? Je ne sais pas¿Qué voy a hacer? Je ne sais plus¿Qué voy a hacer? Je suis perdu¿Qué horas son, mi corazón?[Verso 4]Me gusta la canela, me gustas túMe gusta el fuego, me gustas túMe gusta menear, me gustas túMe gusta La Coruña, me gustas túMe gusta Malasaña, me gustas túMe gusta la castaña, me gustas túMe gusta Guatemala (Me gustas tú)[Estribillo]¿Qué voy a hacer? Je ne sais pas¿Qué voy a hacer? Je ne sais plus¿Qué voy a hacer? Je suis perdu¿Qué horas son, mi corazón?[Outro]¿Qué voy a hacer? Je ne sais pas¿Qué voy a hacer? Je ne sais plus¿Qué voy a hacer? Je suis perdu¿Qué horas son, mi corazón?¿Qué voy a hacer? Je ne sais pas¿Qué voy a hacer? Je ne sais plus¿Qué voy a hacer? Je suis perdu¿Qué horas son, mi corazón?¿Qué horas son, mi corazón?(¿Qué horas son, mi corazón?)¿Qué horas son, mi corazón?¿Qué horas son, mi corazón?¿Qué horas son, mi corazón?Cuatro de la mañanaA la bin, a la ban, a la bin, bon, banA la bin, a la ban, a la bin, bon, banObladí, obladá, obladí, da, daA la bin, a la ban, a la bin, bon, banRadio Reloj, cinco de la mañanaNo todo lo que es oro brillaRemedio chino e infalible📷 Photo:https://unsplash.com🚫 If you want to use this music in your video you will need permission from the artist or label.#ManuChao #MeGustasTu #CreativeChaos #Latin #LatinMusic #LatinPop #Pop #PopMusic #Music #Vocals #Lyrics #LyricVideo #TopHits #Hits"
"ZpCZLNswQZQ","Je suis devenu le Joueur le Plus RICHE de Steal A Brainrot !","2025-08-04T15:31:00Z","UCU7F-LN8Y2dcoQp1kwBlIzg","Shado V2","20","25.05.08","Multicort|ninjaxx|Triche Minecraft|triche construction|mode de construction auto|piscine minecraft|toboggan aquatique piégé|celui qui construit minecraft|monde minuscule|monde minuscule minecraft|furious jumper|furious jumper roblox|Roblox francais|Robux gratuit|Robux Map Roblox|j'ai acheté des Robux|talcado roblox|gemi roblox|poppy playtime chapitre 3|poppy playtime|muscle roblox|fangirl|robux gratuit|brookhaven rp|adopter roblox|catnap","71483","0","0","785","https://i.ytimg.com/vi/ZpCZLNswQZQ/default.jpg","False","True","Je suis devenu le Joueur le Plus RICHE de Steal A Brainrot !Autre vidéos :J'ai TROUVÉ le DRAGON CANNELLONI SECRET avec CHANCE INFINIE sur Steal a Brainrot !J'ai une Base INVISIBLE sur Steal a Brainrot Roblox !J’ai Volé les Nouveaux BRAINROT sur Roblox !j'ai Triché en INVISIBLE pour VOLER TOUT les Brainrots sur Roblox !J'ai Améliorer le Compte Steal a Brainrot d'un Enfant de 8 ANS !Nous avons débloqué la MACHINE À VIES INFINIES dans 99 nuits dans la forêt !Je me fais passer pour un Brainrot GLITCH Hack sur Steal a Brainrot Roblox !Je ne Dois pas me faire CACA Dessus à l'École sur Roblox !J'ai fait semblant d'être un NOUVEAU BRAINROT LEAK dans Roblox Steal a Brainrot !J'ai fait semblant d'être un NOUVEAU BRAINROT LEAK dans Roblox Steal a BrainrotJE VIS EN CACHETTE dans la BASE de MES AMIS jusqu'à ce qu'ils ME TROUVES...Devenir un CHIEN au HUG or PASS sur Roblox !J'ai fait semblant d'être un DARK BRAINROT dans Roblox Steal a Brainrot !Échappez à CHUCK E CHEESE des BACKROOMS sur Roblox avec mes FANGIRLSJ'ai VOLÉ le MEILLEUR VÉLO pour devenir RICHE sur Steal a BIKE Roblox !J'ai ouvert une BOUTIQUE Gratuite dans Steal a Brainrot !NOURRIR le BRAINROTS jusqu'au NIVEAU MAX sur Roblox Catch and Feed a Brainrot !J'ai fait semblant d'être un BRAINROT SECRET pour troller mon AMI !Utiliser le Nouveau Pouvoir DARK INTERDIT sur Basketball ZERO !Trouver des CACHETTES IMPOSSIBLES pour Cacher Un Corps Roblox !Nous Avons PLONGÉ 9999 MÈTRES dans L'OCÉAN jusqu'à CE QUE NOUS ATTEIGNIONS la FIN...Mon PROF Harceleur veut ma MORT à cause de Roblox !Je suis devenu un Chien pour demander des BRAINROTS SECRETS à mes DEVENIR PLUS RAPIDE POUR S'ÉVADER DE PRISON !! +1 Vitesse par Seconde Prison Escape !Niveau 1 à Niveau 99 SQUID GAME sur Roblox !Le DERNIER à Quitter la BOÎTE avec 100 AMIS sur Roblox !J'ai créé la MEILLEURE équipe de Football avec mes FANGIRLS sur Rematch !La DANSE DU RAT sur ROBLOX....?On Peut MAINTENANT REGARDER des FILMS sur ROBLOX !Faire du Vélo ENCHAINÉ avec mes AMIS sur Roblox !Ne CHOISISSEZ pas le MAUVAIS TROU avec ma FAN GIRL !Échappez de la Prison de TUNG TUNG SAHUR sur Roblox !Niveau 1 vs Niveau 999 ABEILLE le plus FORT sur Roblox !TUNG TUNG TUNG SAHUR sur Roblox ! (Obby Tower)J'ai dépensé 1,725,879$ pour OFFRIR à mes FANGIRLS le meilleur Avion de luxe de Roblox !J'ai trouvé un DONJON Secret sur Solo Leveling Roblox !ALLEZ à l'École avec mes AMIS sur Roblox !NOOB Niveau 1 vs HACKER Niveau 999 MUSCLE GYM Simulator RobloxÉchappez de la PRISON contre la POLICE sur Roblox avec mes AMIS !Devenir le plus GROS SLIME pour Manger mes AMIS sur Roblox !PRISONNIER SPEEDRUNNER vs SWATCHASSEUR sur DRIVING EMPIRE !GARÇONS vs FILLES dans un DUEL DE COURSE sur BIKE OBBY ROBLOX !J'ai ESSAYÉ de DEVENIR le PLUS MUSCLÉ de la VILLE sur ROBLOX !ROBLOX TRANSFORMATION USINE INFINI...EXTRÊME PARKOUR avec mes AMIS dans un jeu RÉALISTE !J'ai Utilisé GOKU de DRAGON BALL sur BLUE LOCK RIVALS !Niveau 1 Noob vs Niveau 999 Hacker SUPER HERO le plus FORT sur Roblox !J'ai TUÉ tout mes AMIS sur Buckshot Roulette !J'ai CREUSÉ toute la TERRE de MON JARDIN sur Roblox !DRAGUER 50 FILLES en PILOTE de COURSE Formule 1 sur DRIVING EMPIRE !Faire un Caca NIVEAU MAX !J'ai IMPRESSIONÉ mes FANGIRLS sur Roblox CARRY Simulator !Murder Paperface avec mes FANGIRLS folles sur Roblox !CHOISIR la bonne COULEUR dans Color Block avec mes AMIS sur Roblox !Dépenser 10.000 ROBUX sur Color.io pour être le plus COLORÉ sur RobloxFAITES LE BON CHOIX SINON...Avoir le FAMILLE la plus RICHE de Driving Empire Roblox !On a PÊCHER le plus GROS POISSON du Monde sur ROBLOX !Devenir IRON MAN dans Roblox Construire un Bateau ! (Build a Boat)J'ai PERDU Mon PÈRE donc j'ai Creusé 9,572,999 Mètres..Échappez à SHREK BACKROOMS sur Roblox avec mes FANGIRLS..ENFERMER dans la PRISON de la POUPÉE SQUID GAME !C'est la FIN de notre AMITIÉ...Jouer à ROBLOX avec notre VRAI VISAGE de la VRAIE VIE !Dépensé 25.000 ROBUX pour le MEILLEUR RADEAU sur Roblox !Avoir le FAMILLE la plus RICHE de Driving Empire Roblox !Roblox Obby MAIS Tu TE FAIS TROLLER !Vendre 7.134.785 Bouteilles D'EAU sur Roblox !Roblox mais ma Fan Girl me promène !On a BOUCHÉ LES TOILETTES !Mail Pro : shadobassmc@drizztagency.frCa vous dirait une vidéo sur Skibidi Toilet ? un peu comme Furious Jumper ?C'est une de mes premières vidéos Roblox depuis très longtemps donc soyez gentils dans les commentaires ahaDu très très lourd arrive ne vous inquiètez pasConcept réalisé par Furious Jumper, GEMI ROBLOX et Talcado Roblox !"
"u3u39gneyxk","Royalty X Shameless","2025-07-30T10:01:38Z","UCQBVKrL1Qv7Zbde2TBVqmYQ","Jasmyn Eclipse - Topic","10","25.05.08","Jasmyn Eclipse|Camila Cabello|Caitlin Powell|Marcin Roszkowski|Sidney Powell|Ali Tamposi|Andrew Wotman|Jonathan Bellion|Jordan Johnson|Stefan Johnson|Imaginary Hearts|Royalty X Shameless","590049","0","0","0","https://i.ytimg.com/vi/u3u39gneyxk/default.jpg","False","True","Provided to YouTube by RoutenoteRoyalty X Shameless · Jasmyn Eclipse · Camila Cabello · Caitlin Powell · Marcin Roszkowski · Sidney Powell · Ali Tamposi · Andrew Wotman · Jonathan Bellion · Jordan Johnson · Stefan Johnson · Camila Cabello · Caitlin Powell · Marcin Roszkowski · Sidney Powell · Ali Tamposi · Andrew Wotman · Jonathan Bellion · Jordan Johnson · Stefan JohnsonImaginary Hearts℗ Jasmyn EclipseReleased on: 2025-07-31Auto-generated by YouTube."
"DPkjQUdlWR0","Le mystère impossible à résoudre du village d’Hinamizawa","2025-08-04T17:02:40Z","UCqHmOglzbxLcrzYYbHcwjmw","RebeuDeter 2.0","24","25.05.08","[none]","22258","0","0","177","https://i.ytimg.com/vi/DPkjQUdlWR0/default.jpg","False","True","La famille ! Je suis heureux de vous sortir la 1ère redif de Higurashi When They Cry, Le sanglot des cigales ! C'est un visual novel composé de 4 tomes question et 4 tomes réponse. Les voix sont doublées par moi et 5 autres viewer pris au hasard sur Discord ! Merci d'avoir vu la vidéo et n'oubliez pas de commenter, liker et partager ! Merci la famille ! Mes réseaux ⬇️Insta: https://www.instagram.com/rebeudeterTwitter: https://x.com/rebeudeterTwitch: https://www.twitch.tv/rebeudeterTiktok: https://www.tiktok.com/@rebeudeter.clipsMa chaîne principale: https://www.youtube.com/@RebeuDeterMa chaîne best of: https://www.youtube.com/@RebeuDeter2.0Ma chaîne de rediff Twitch: https://youtube.com/@RebeuDeterLive0:00 intro on parle11:35 Higurashi When They Cry"
"Zklw7JHs6-4","Yacou B OG - Allahu Akbar (Clip Officiel)","2025-08-01T18:50:16Z","UChR7zK0VlpSrfgZLPtm49MA","YACOU B OG","10","25.05.08","YACOU B|KEYZIT|KEYZIT MALI|KEYZIT AFRICA|MALI|ARTISTE|MALIEN|MUSIQUE|CULTURE|HIP HOP","847753","0","0","4364","https://i.ytimg.com/vi/Zklw7JHs6-4/default.jpg","False","True","Clip réalisé par Nelly Prince !Auteur : Yacou B OGCompositeur : Dina OneDistributeur : Keyzit DistributionLabel : Empire GanGBooking : +223 83 83 85 80 / booking@yacoubog.comAbonnes-toi à ma Chaine YouTube : http://bit.ly/2ESSjXXRetrouvez-moi sur :Facebook : https://www.facebook.com/yacoubogoffInstagram : https://www.instagram.com/yacou_b_og_off/TikTok : https://www.tiktok.com/@yacoubog01Website : https://yacoubog.com/"
"Ne7I8JHXHNM","🔴 DAEGU - BARCELONE LIVE / 🚨LE BARCA EN PREPARATION ! RASHFORD, YAMAL, DRO.. 🔥🔥  / 🏆 MATCH AMICAL","2025-08-04T13:25:03Z","UCzSSwnU5MohO6vQqmMjKUyw","L' immigré parisien","17","25.05.08","foot|football|streaming|direct|match|sowdred|barcelone|barcelona|barca|daegu|daegu fc|barcelone daegu|barcelone vs daegu|barcelona daegu|barcelona vs daegu|barca daegu|barca vs daegu|fc barcelone daegu|fc barcelone vs daegu|fc barcelona daegu|daegu barca|daegu vs barca|match en direct|matche en direct|match en direct aujourd-hui|barcelone daegu live|daegu barcelone live|barca daegu live|barça|barcelone live|barcelone match|yamal|rashford|daegu barcelone","258495","0","0","30","https://i.ytimg.com/vi/Ne7I8JHXHNM/default.jpg","False","True","Vivez en direct le match amical entre Daegu et le FC Barcelone.#DAEBAR #DaeguBarça #BARCELONE💲 TU VEUX DEVENIR SPONSOR et avoir des avantages ? 👇clique sur le lien https://www.youtube.com/channel/UCzSSwnU5MohO6vQqmMjKUyw/join🔹 Mes réseaux sociaux : ✔ Mail Pro : yanisyt59@gmail.com ✔ Twitch : https://www.twitch.tv/limmigreparisien ✔ Twitter : https://twitter.com/ImmigreParisien ✔ Insta : https://www.instagram.com/immigreparisien/?hl=frmatch en direct,en direct,match live,match en direct aujourd-hui,match barcelone en direct,match en direct barcelone,match en direct barcelone aujourd'hui,match barcelone en direct aujourd'hui,match en direct aujourd'hui,matche en direct aujourd'hui,match en direct barca aujourd'hui,match barca en direct aujourd'hui,match barca en direct,match en direct barca,barcelone live,barcelone match,barcelone live match,barcelone en direct,barcelone direct,barcelone live match,barcelone match en direct,barcelona live,barcelona match,barcelona en direct,barcelona direct,barcelona live match,barcelona match en direct,barca live,barca match,barca en direct,barca direct,barca live match,barca match en direct,live barcelone,match en direct barcelone,live match barcelone,direct barcelone,match barcelone,match barcelone en direct,match en direct barcelone aujourd'hui,live barcelona,live match barcelona,match barcelona,direct barcelona,match barcelona en direct,en direct barcelona,match barcelona en direct aujourd'hui,daegu live,daegu match,daegu direct,daegu en direct,live daegu,direct daegu,en direct daegu,match daegu,match en direct daegu,daegu fc live,daegu fc direct,daegu fc en direct,daegu fc match,daegu fc match en direct,live daegu fc,direct daegu fc,en direct daegu fc,match daegu fc,match en direct daegu fc,live match barcelone daegu,barcelone daegu live,barcelone daegu direct,barcelone daegu en direct,barcelone daegu match,barcelone daegu match en direct,live barcelone daegu,direct barcelone daegu,match barcelone daegu,en direct barcelone daegu,match en direct barcelone daegu,barcelona daegu live,barcelona daegu direct,barcelona daegu en direct,barcelona daegu match,barcelona daegu live match,barcelona daegu match en direct,live match barcelona daegu,live barcelona daegu,direct barcelona daegu,en direct barcelona daegu,match barcelona daegu,match en direct barcelona daegu,barca daegu live,barca daegu match,barca daegu direct,barca daegu en direct,barca daegu match en direct,live barca daegu,direct barca daegu,en direct barca daegu,match barca daegu,match en direct aujourd'hui,barcelone vs daegu live,barcelone vs daegu direct,barcelone vs daegu en direct,barcelone vs daegu match,barcelone vs daegu match en direct,live barcelone vs daegu,direct barcelone vs daegu,match barcelone vs daegu,direct barcelone vs daegu,en direct barcelone vs daegu,match barcelone vs daegu,match en direct barcelone vs daegu,barcelona vs daegu live,barcelona vs daegu direct,barcelona vs daegu en direct,barcelona vs daegu match,barcelona vs daegu match en direct,live barcelona vs daegu,direct barcelona vs daegu,en direct barcelona vs daegu,match barcelona vs daegu,live match barcelona vs daegu,match en direct barcelona vs daegu,match barcelone aujourd'hui youtube,barca vs daegu live,barca vs daegu direct,barca vs daegu en direct,barca vs daegu match,barca vs daegu match en direct,live barca vs daegu,direct barca vs daegu,en direct barca vs daegu,match barca vs seoul,live match barca vs daegu,fc barcelone daegu,fc barcelone vs daegu,fc barcelona daegu,fc barcelona vs daegu,fc barcelone daegu fc,fc barcelone vs daegu fc,fc barcelone daegu fc,fc barcelone vs daegu fc,daegu barcelone,daegu vs barcelone,daegu barcelona,daegu vs barcelona,daegu barca,daegu vs barca,daegu fc barcelone,daegu vs fc barcelone,daegu fc barcelona,daegu vs fc barcelona,daegu fc barcelone,daegu fc vs barcelone,daegu fc barcelona,daegu fc vs barcelona,daegu fc barca,daegu fc vs barca,daegu fc fc barcelone,daegu fc vs fc barcelone,daegu fc fc barcelona,daegu fc vs fc barcelona,barça,immigré parisien,l'immigré parisien,immigré-parisien,streaming foot,barcelone streaming,barça live,barça live match,barça daegu,barça vs daegu,barcelona en vivo,barcelona daegu en vivo,barcelone daegu en vivo,barca daegu en vivo,barca tv+,barca tv,live barca tv,barca tv live,barcelone daegu fc live,barcelone daegu fc direct,barcelone daegu fc en direct,barcelone daegu fc match,barcelone daegu fc match en direct,live barcelone daegu fc,direct barcelone daegu fc,en direct barcelone daegu fc,match barcelone daegu fc,match en direct barcelone daegu fc,barcelona daegu fc live,daegu fc barcelone live,daegu fc barcelone direct,daegu fc barcelone en direct,daegu fc barcelone match,daegu fc barcelone match en direct,live daegu fc barcelone,direct daegu fc barcelone,en direct daegu fc barcelone,match daegu fc barcelone,match en direct daegu fc barcelone,daegu barcelone live,barcelone daegu youtube,barcelone youtube live,barca daegu fc live,"
"GF3am3FUqcQ","BOVSKI - Low Again","2025-08-01T11:51:49Z","UCeAz42njbPLwWr0agwynNTw","BOVSKI","22","25.05.08","[none]","79917","0","0","82","https://i.ytimg.com/vi/GF3am3FUqcQ/default.jpg","False","True","Oh I´m feeling low agaaaainOUT NOW: https://sndo.ffm.to/qezobm2🎥:https://www.tiktok.com/@alenamlrhttps://www.instagram.com/peppermint.dehttps://www.tiktok.com/@adelina.fvhttps://iconaclub.com/Find me here:https://linktr.ee/djbovski#lowagain #bovski #ukgarage #tiktok #viral #song #ukg #boilerroom #tomorrowland #spedup #viraltiktok #techno #housemusic #trance"
"31uoFp4FbDk","J’ai Volé TOUS les BRAINROT FUSIONNÉ du Jeu sur Roblox ! (steal a brainrot)","2025-08-04T11:02:43Z","UCxLYtnFK7OLV6XK3eC-xAlw","Yoananas & Cie","20","25.05.08","minecraft|talcado|Awariz|Ne choisissez pas|TheCheeseNaan|Talcado roblox|anna minecraft|talcado yoananas|noob vs pro|talcado noob vs pro|J’ai Volé TOUS les Nouveaux BRAINROT FUSION du Jeu sur Roblox !","67614","0","0","103","https://i.ytimg.com/vi/31uoFp4FbDk/default.jpg","False","True","J’ai Volé TOUS les Nouveaux BRAINROT FUSION du Jeu sur Roblox !#yoananas #stealabrainrot #talcado Yo ! Aujourd'hui nouvelle vidéo sur #Minecraft ! 🛒Boutique: https://awariztalcado.fr/N’oublie pas de t’abonner ✅ Et d’activer la cloche de notification🔔🐥Twitter : https://bit.ly/2rt93xV🔴MailPro: talcadopro@gmail.comABONNE TOI ✅"
"bTwCoclcuMU","Lewis Capaldi - Someone You Loved (Lyrics)","2025-07-31T11:16:46Z","UC90XKCg37vA7mmXm3LdwC3A","British Pop Bangers","10","25.05.08","someone you loved|someone you loved lyrics|lyrics someone you loved|lewis capaldi|lyrics|lewis capaldi someone you loved|someone you loved lewis capaldi|lewis capaldi someone you loved lyrics|lyrics lewis capaldi someone you loved|lewis capaldi lyrics|lyrics lewis capaldi|lewis capaldi lyrics someone you loved|someone you loved lyrics lewis capaldi|lyrics someone you loved lewis capaldi|someone you loved lewis capaldi lyrics|lewis capaldi - someone you loved|pop","70098","0","0","6","https://i.ytimg.com/vi/bTwCoclcuMU/default.jpg","False","True","🎧 Lewis Capaldi - Someone You Loved (Lyrics)🔔 Turn on notifications to stay updated with new uploads!⏬ Download / Stream: https://open.spotify.com/track/7qEHsqek33rTcFNT9PFqLfLewis Capaldi:https://www.instagram.com/lewiscapaldi/https://www.facebook.com/lewiscapaldi/Lyrics:I'm going under and this time I fear there's no one to save meThis all or nothing really got a way of driving me crazyI need somebody to healSomebody to knowSomebody to haveSomebody to holdIt's easy to sayBut it's never the sameI guess I kinda liked the way you numbed all the painNow the day bleedsInto nightfallAnd you're not hereTo get me through it allI let my guard downAnd then you pulled the rugI was getting kinda used to being someone you lovedI'm going under and this time I fear there's no one to turn toThis all or nothing way of loving got me sleeping without youNow, I need somebody to knowSomebody to healSomebody to haveJust to know how it feelsIt's easy to sayBut it's never the sameI guess I kinda liked the way you helped me escapeNow the day bleedsInto nightfallAnd you're not hereTo get me through it allI let my guard downAnd then you pulled the rugI was getting kinda used to being someone you lovedAnd I tend to close my eyes when it hurts sometimesI fall into your armsI'll be safe in your sound til I come back aroundFor now the day bleedsInto nightfallAnd you're not hereTo get me through it allI let my guard downAnd then you pulled the rugI was getting kinda used to being someone you lovedBut now the day bleedsInto nightfallAnd you're not hereTo get me through it allI let my guard downAnd then you pulled the rugI was getting kinda used to being someone you lovedI let my guard downAnd then you pulled the rugI was getting kinda used to being someone you loved#someoneyouloved #lewiscapaldi #lyrics"
"iqNRCmmRY3Y","Je découvre la nouvelle fournaise et son évolution !","2025-08-04T17:33:34Z","UCvcVcuOdDtu0UCV-YcfUgHA","Ouah Leouff","20","25.05.08","ruusskov|ruskov|ruuskov|russkov|ruru|clash|royal|clashe royale|cr fr|clash royale|clashe royal|clash royal|no skill deck|deck trop fort|trop fort clash royale|deck no skill|ouah|ouahleouf|ouahleouff|lemon tea|light pollux|viiper|ashtax","32469","0","0","481","https://i.ytimg.com/vi/iqNRCmmRY3Y/default.jpg","False","True","Anciennement joueur professionnel pour la structure Vitality sur Clash Royale, je suis désormais streamer, caster & partenaire Supercell. Supercell store : https://store.supercell.com/fr?boost=ouahChaîne secondaire @OuahMG——————————————————————————————✅ Code créateur : OUAH ✅🍇 Twitch : https://www.twitch.tv/0uahleouff📱 TikTok : https://www.tiktok.com/@ouahleouff88🐦 Twitter/X : https://www.twitter.com/Ouahleouff_Just🎃 Discord: https://www.discord.gg/ouahleouff 📸 Instagram : https://www.instagram.com/ouah88/ Soutien avec le code Ouah en commandant tes boissons saines sur HOLY : https://fr.weareholy.com/?ref=OUAHLEOUFF——————————————————————————————👔 Contact pro : jeremycdy2608@outlook.fr"
"5-v2BvJkrOk","GIGA CHAD TUNG TUNG SAHUR x Sigma Girl | Ballerina Cappuccina Love Story [Sigma Boy Remix]","2025-07-27T10:25:21Z","UCFLTGVQQZSx6Xirj2DyklDQ","Tung Tung Capuccina","10","25.05.08","sigma girl|sigma boy|ballerina cappucina|brainrot|brainrot animals|tung tung tung sahur|brainrot rap|giga chad|tung tung sahur","1276561","0","0","32","https://i.ytimg.com/vi/5-v2BvJkrOk/default.jpg","False","True","GIGA CHAD TUNG TUNG SAHUR x Sigma Girl | Tung Tung Sahur x Ballerina Cappuccina Love Story [Sigma Boy Remix] #brainrotrap #PartyTunes #Capybanana #BrrBrrPatapim #TralaleroTralala #LiriliLarila #CapuccinoAssassino #OrcaleroOrcala #CappucinaBallerina #EspressonaSignora #ChimpanziniBananini #BombombiniGusini #TrippiTroppi #BurbaloniLulilolli #TungTungTungSahur #TaTaTaSahur #UDinDinDinDinDunMaDinDinDinDun #AIAnimation #AIVideo #OfficialVideo #ViralTikTok #AnimatedRap"
"U7E9TYvvI64","Karmine Corp vs GiantX - LEC 2025 Summer - Group Stage","2025-08-03T21:43:28Z","UCApmTE4So9oX7sPkDGgSpFQ","Karmine Corp Replay","20","25.05.08","karmine corp|kcorp|karmine|rediff|replay","49798","0","0","69","https://i.ytimg.com/vi/U7E9TYvvI64/default.jpg","False","True","Nouveau merch disponible ici : https://karminecorp.fr/shop→  Nos réseaux sociaux► Twitter Karmine Corp : https://twitter.com/KarmineCorp► Instagram Karmine Corp : https://www.instagram.com/karmineCorp► Tik Tok Karmine Corp : https://www.tiktok.com/@karmine_corp► Site internet : karminecorp.frLogitech Gaming : Karmine Corp x Logitech G : https://urlr.me/Nj2Xr ▼Découvre le matériel Logitech que les joueurs KC utilisent:🎧🆕 Logitech G PRO X 2 LIGHTSPEED (https://urlr.me/KmHhM) 🖱️ Logitech G PRO X 2 SUPERLIGHT (https://urlr.me/TpgLr)  ⌨️ Logitech G PRO X TKL (https://vu.fr/xyHT )  Tapis Logitech G G840 XL (https://vu.fr/DWnhy)🎤Micro Yeti GX (https://vu.fr/OYRuY)Tapis Logitech G640 KARMINE CORP (https://cutt.ly/cwLbCyb6)💺 Nouveau siège Karmine x Quersus disponible ici : http://q.uers.us/KarmineCorpYT✉️ Mail : contact@karminecorp.fr"
