video_id,title,publishedAt,channelId,channelTitle,categoryId,trending_date,tags,view_count,likes,dislikes,comment_count,thumbnail_link,comments_disabled,ratings_disabled,description
"woLfAvD5iXI","Chappell Roan - The Subway (Official Music Video)","2025-08-01T14:00:09Z","UCBoNpX06hjs3_ASFftQEmww","ChappellRoanVEVO","10","25.05.08","Chappell Roan|Chappell Roan PS/ Island|Pop","5112893","0","0","15984","https://i.ytimg.com/vi/woLfAvD5iXI/default.jpg","False","True","Listen to The Subway out now: https://chappellroan.lnk.to/TheSubway Subscribe for more official content from Chappell Roan: https://ChappellRoan.lnk.to/SubscribeID Connect with Chappell Roan:http://iamchappellroan.comhttps://facebook.com/chappellroanhttps://instagram.com/chappellroanhttps://twitter.com/chappellroanhttps://soundcloud.com/chappellroanhttps://www.tiktok.com/@chappellroanhttps://laylo.com/chappellroan Director - Amber Grace Johnson Production Company - Object & AnimalEP - Alex BrinkmanProducer - Myriam SchroeterCreative Producer - Zara Saraon Director of Photography - Norm LiProduction Designer - Griffin Stoddard  Wardrobe Stylist - Genesis WebbArtist Makeup - Andrew DahlingArtist Hair - Lacy RedwayHair Designer / Hair Costumes and Hair Set Design - Charlie le MinduCLM Creative Assistant - Studio Manager - Nirina Metz  Background Wardrobe Stylist - Dominick BarcelonaCasting Director - Damian Bao Choreographer - Danielle PolancoChoreographer Assistant - Mishay Petronelli Production Supervisor - Raven JensenAddtl. Production Supervisor       - Justine NewmanAssistant Production Supervisor - Daniel OrderProduction Consultant - Matthew Dipple Editor - Mah Ferraz @ ChurchColor - Dante Pasquinelli @ Ethos VFX Company - Corduroy CG Artist - Loni PaoneVFX Artist - Cooper VacheronOn-Set VFX Supervisor - Greg Joblove Island Records - Natasha Kilibarda, Liv KookerFoundations Management - Drew Simmons, Lauren McKinney, Kyle Goold Commissioner - Steven Gottlieb LYRICSI saw your green hairBeauty mark next to your mouthThere on the subwayI nearly had a breakdown A few weeks laterSomebody wore your perfumeIt almost killed meI had to leave the room It's just another dayAnd it's not over till it's overIt's never overIt's just another dayAnd it's not over till it's overIt's never over Til I don't look for you on the staircaseOr wish you thought that we were still soulmatesBut I'm still counting down all of the daysTil you're just another girl on the subway Made you the villainEvil for just moving onI see your shadowI see it even with the lights offI made a promise, if in four months this feeling ain't goneWell, fuck this city! I'm movin' to Saskatchewan It's just another dayAnd it's not over till it's overOh til its overIt's just another dayAnd it's not over till it's overIt's never over Til I can break routine during foreplayAnd trust myself that I won’t say your nameBut I'm still counting down all of the daysTil you're just another girl on the subway She's got, she's got a wayShe's got a way, she's got a way She got, she got awayShe got away, she got away She's got, she's got a wayShe's got a way, she's got a way She got, she got awayShe got away, she got away She's got, she's got a wayShe's got a way, she's got a way She got, she got awayShe got away, she got away She’s got, she’s got a way She’s got a way, she’s got a way She got, she got away She got away, she got away #ChappellRoan #TheSubwayMusic video by Chappell Roan performing The Subway.© 2025 KRA International Inc., under exclusive license to Island Records, a division of UMG Recordings, Inc."
"hrPtK5D5yn4","Race Highlights | 2025 Hungarian Grand Prix","2025-08-03T15:16:09Z","UCB_qr75-ydFVKSF9Dmo6izg","FORMULA 1","17","25.05.08","F1|Formula One|Formula 1|Sports|Sport|Action|GP|Grand Prix|Auto Racing|Motor Racing|f1 highlights|hungaroring|hungarian grand prix|lando norris|charles leclerc","5087927","0","0","4577","https://i.ytimg.com/vi/hrPtK5D5yn4/default.jpg","False","True","Catch up on the most intense and dramatic moments from the final race before summer break, as the drivers' championship fight is shaken up once more.For more F1® videos, visit: https://www.Formula1.comVisit our store: https://f1store.formula1.com/Follow F1®:https://www.instagram.com/F1https://www.facebook.com/Formula1/https://www.twitter.com/F1https://www.twitch.tv/formula1https://www.tiktok.com/@f1#F1 #HungarianGP"
"8r9J7kHMKuk","Shakira - Waka Waka (This Time For Africa) (Lyrics)","2025-07-29T21:00:09Z","UCiHpZF5v3cRdol8jPmoIEoQ","Musixa","10","25.05.08","waka waka|waka waka shakira|this time for africa|shakira waka waka lyrics|waka waka lyrics|shakira|shakira waka waka this time for africa|lyrics shakira this time for africa|shakira lyrics this time for africa|lyrics this time for africa shakira|waka waka this time for africa|shakira this time for africa|this time for africa lyrics|this time for africa shakira|lyrics this time for africa|You're a good soldier|choosing your battles|get back in the saddle","239798","0","0","7","https://i.ytimg.com/vi/8r9J7kHMKuk/default.jpg","False","True","♫ Shakira - Waka Waka (This Time For Africa) (Lyrics)⭐ Stream: 👉 Shakira:https://Shakira.lnk.to/followFIhttps://Shakira.lnk.to/followIIhttps://Shakira.lnk.to/followTI🎤 Lyrics: Shakira - Waka Waka (This Time For Africa) [Intro]Oooeeeeeeeeeeeeeeeehh!Viva Africa (Otra, otra)Viva Africa (Otra, otra)Viva Africa (Otra, otra)Viva Africa (Otra, otra)[Verse 1: Shakira]You're a good soldier, choosing your battlesPick yourself up and dust yourself off, get back in the saddleYou're on the front line, everyone's watchingYou know it's serious, we're getting closer, this isn't over[Pre-Chorus 1: Shakira]The pressure's on, you feel itBut you got it all, believe itWhen you fall get up, oh, ohIf you fall get up, eh, ehTsamina mina zangalewa'Cause this is Africa[Chorus: Shakira]Tsamina mina, eh, ehWaka waka, eh, ehTsamina mina zangalewaThis time for Africa[Verse 2: Shakira]Listen to your God, this is our mottoYour time to shine, don't wait in line, y vamos por todoPeople are raising their expectationsGo on and feed them, this is your moment, no hesitations[Pre-Chorus 2: Shakira]Today's your day, I feel itYou paved the way, believe itIf you get down get up, oh, ohWhen you get down get up, eh, ehTsamina mina zangalewaThis time for Africa[Chorus: Shakira]Tsamina mina, eh, ehWaka waka, eh, ehTsamina mina zangalewaAnawa-a-aTsamina mina, eh, ehWaka waka, eh, ehTsamina mina zangalewaThis time for Africa[Verse 3: Zolani]Awabuye lamajoni, ipikipiki mama wa A to ZBathi susa lamajoni, ipikipiki mama from East to WestBathi waka waka ma, eh, ehWaka waka ma, eh, ehZonk' izizwe mazibuye 'cause this is Africa[Bridge]Tsamina mina, Anawa-a-aTsamina minaTsamina mina, Anawa-a-a[Chorus: Shakira]Tsamina mina, eh, ehWaka waka, eh, ehTsamina mina zangalewaAnawa-a-aTsamina mina, eh, ehWaka waka, eh, ehTsamina mina zangalewaThis time for Africa[Outro: Shakira]Django, eh, ehDjango, eh, ehTsamina mina zangalewaAnawa-a-aDjango, eh, ehDjango, eh, ehTsamina mina zangalewaAnawa-a-aThis time for AfricaThis time for AfricaWe're all AfricaWe're all Africa#shakira #wakawaka #lyrics #thistimeforafrica Tags:waka waka,waka waka shakira,this time for africa,shakira waka waka lyrics,waka waka lyrics,shakira,shakira waka waka this time for africa,shakira this time for africa lyrics,lyrics shakira this time for africa,shakira lyrics this time for africa,lyrics this time for africa shakira,waka waka this time for africa,shakira this time for africa,this time for africa lyrics"
"t5_XhFkpf2w","Je Smurf tellement le 9 Points Gagnants ! (ça faisait longtemps)","2025-08-04T16:15:16Z","UCABf02qOye7XYapcK1M45LQ","Etoiles","24","25.05.08","Etoiles|Etoile|culture|quiz|nuit de la culture|question pour un champion|samuel etienne|react","23677","0","0","32","https://i.ytimg.com/vi/t5_XhFkpf2w/default.jpg","False","True","Ça faisait longtemps qu'on avait pas regardé une émission !---------------------------------------------------------------------------------------------------------Pour ne rater aucun de mes lives : https://www.twitch.tv/etoiles---------------------------------------------------------------------------------------------------------Suis-moi sur mes réseaux : - Twitter : https://twitter.com/AREtoiles- Discord : https://www.discord.gg/etoiles- Instagram : https://www.instagram.com/etoilaisse- Ma boutique : https://eda-shop.fr/- Chaine secondaire : https://www.youtube.com/channel/UCRzz3qQ4Q-vPU0iQWyCqoHw----------------------------------------------------------------------------------------------------------Monteur : https://twitter.com/Allender__Miniaturiste : https://twitter.com/_SaraaJane_----------------------------------------------------------------------------------------------------------Intro : Casserole - The Original OrchestraOutro : Siberian Summer - Sunny Fruit"
"Z2Ei66xKrBM","J’ai FUSIONNÉ 100 SECRETS et DÉBLOQUÉ ÇA… (Steal a Brainrot)","2025-08-04T14:45:07Z","UCiRd_9DUd9T1XHoc17H4KjQ","GEMI ROBLOX","20","25.05.08","gemi|gemi roblox|roblox|J’ai FUSIONNÉ 100 SECRETS et DÉBLOQUÉ ÇA… (Steal a Brainrot)","31345","0","0","40","https://i.ytimg.com/vi/Z2Ei66xKrBM/default.jpg","False","True","Bienvenue sur GEMI Roblox ! Aujourd’hui, J’ai FUSIONNÉ 100 SECRETS et DÉBLOQUÉ ÇA… (Steal a Brainrot)Attend toi à des fails épiques et une bonne dose de fun !Lâchez un like, abonnez-vous et activez la cloche pour ne rien rater. Objectif : 1000 likes pour débloquer le prochain défi encore plus dingue !Rejoins-nous sur Discord : https://discord.gg/PhttWX5nQUMail pro : gemioffi@gmail.com"
"knSE43QkHns","Prison de RICHE vs Prison de PAUVRE sur Minecraft !","2025-08-05T08:30:32Z","UCHThbKHh7k3YH94o76f2Gow","GEMI","20","25.05.08","GEMI|GEMI MC|GEMIII|Minecraft|Shado|ColorCity|Prison de RICHE vs Prison de PAUVRE sur Minecraft !","7198","0","0","18","https://i.ytimg.com/vi/knSE43QkHns/default.jpg","False","True","Bienvenue sur GEMI ! Aujourd’hui, Prison de RICHE vs Prison de PAUVRE sur Minecraft !Attend toi à des fails épiques et une bonne dose de fun !Lâchez un like, abonnez-vous et activez la cloche pour ne rien rater. Objectif : 1000 likes pour débloquer le prochain défi encore plus dingue !Rejoins-nous sur Discord : https://discord.gg/PhttWX5nQUMail pro : gemioffi@gmail.com"
"lHNyJ6_Yc8E","🔴AFTER LOL | LEC SUMMER | Avec GLOPO & Drako | Débrief week 1","2025-08-04T19:20:49Z","UCEquEvZ49gZrpCoQFapYOxQ","Zaboutine","20","25.05.08","League of Legends","10459","0","0","30","https://i.ytimg.com/vi/lHNyJ6_Yc8E/default.jpg","False","True","Tous mes réseaux icihttps://linktr.ee/zaboutine"
"J-B7O9KpsCc","Voyage à LOS ANGELES pour BATTLEFIELD 6 ✈️🌴🔥","2025-08-04T11:00:27Z","UCOM3hIIJ3ZcpWQEKProj5Ig","CHOWH1","20","25.05.08","battlefield 6|bf6|battlefield|chowh1|skyrroz","27860","0","0","63","https://i.ytimg.com/vi/J-B7O9KpsCc/default.jpg","False","True","✈ Le meilleur VPN : https://nordvpn.com/chow🎥 Twitch : http://www.twitch.tv/chowh1🐦 Twitter :  https://twitter.com/CHOWH1_📷 Instagram : https://www.instagram.com/chowh1📱 Tiktok : https://www.tiktok.com/@chowh1🖥 Mon Matériel : - 🪑 Secretlab TITAN Evo : https://bit.ly/ChowH1XTITANevo - 💻 Bureau Secretlab MAGNUS Pro : https://bit.ly/ChowH1XMAGNUSpro1️⃣ Chaine Principale : https://www.youtube.com/@ChowH12️⃣ Chaine Secondaire : https://www.youtube.com/channel/UC2MkGUdvE1XERzDfsUdIZzg⏪ Chaine Replay : https://www.youtube.com/channel/UC8NE3dkV7ec_ydbyhArHe4A🎨 Montage & Miniature par : 10dier - https://twitter.com/10dier_ 📧 Contact pro : contactchowcorp@gmail.com"
"FYeYTSEMr8c","ROCKET VOLTIC 100% KILLS","2025-08-05T05:21:33Z","UCyMy3i-BaVOmOwTZskm52Ew","LaSalle","20","25.05.08","Lasalle|gta 5 lasalle|gta 5 gameplay|gta lasalle|Lasalle Youtube|lasallemqs youtube|youtube gta 5|gta|gta 5|gta 5 online","8522","0","0","29","https://i.ytimg.com/vi/FYeYTSEMr8c/default.jpg","False","True",""
"hUyVfreszOE","CUPIDON PROTECTEUR (LG UHC)","2025-08-03T12:01:15Z","UCk5fFxZePtpX1QLM7edDsNA","TheGuill84","20","25.05.08","theguill84|guill|theguill|minecraft fr|minecraft uhc|LG UHC|LG|Loup-Garou UHC|Loup-Garou|Loup Garou|minecraft|Loup Garou UHC|LG UHC guill|loup-garou uhc|loup-garou minecraft|loup garou minecraft|minecraft pvp|loup-garou uhc guill|minecraft multi|minecraft uhc fr|LG UHC S10|LG UHC Cupidon|LG UHC Couple","90546","0","0","126","https://i.ytimg.com/vi/hUyVfreszOE/default.jpg","False","True","Nouveau LG UHC avec l'un des rôles les plus fascinants du jeu : le CUPIDON ! Un rôle lié au couple qui est sans doute l'une des mécaniques les plus stratégiques...💻 Découvrez le PC Portable Katana 17 HX B14WGK de chez MSI : https://msi.gm/theguillkatanaJe vous rappelle que je suis en SUBATHON tout le mois d'Août, en live 24H sur 24 ! Et ça se passe ici en live sur mon Twitch : https://www.twitch.tv/theguill84📷 Instagram: https://www.instagram.com/guillcstl🐦 Twitter : https://twitter.com/TheGuill84🎵 TikTok: https://www.tiktok.com/@theguill84💬 Discord: https://discord.gg/guill📧 MAIL : guillcontact1@gmail.comUHC World, mon serveur Minecraft : https://discord.gg/uhcworldIP du serveur (1.8 à 1.21) : mc.uhcworld.fr🎬 Ma chaîne secondaire: https://www.youtube.com/@theguill84replay  👉 Code créateur EpicGames: GUILLL'idée originale du jeu LG UHC vient de Setrox, développé à la base par Lapin.Miniature : https://twitter.com/xintech_Montage : https://www.youtube.com/@FritosLaFrite#lguhc #uhc #minecraft #theguill84"
"jrJskz4anmc","Je deviens un mage de feu ! (Grounded 2 #7)","2025-08-04T14:01:08Z","UCo_Nm4TBp1rF0DRsWr377Ww","Dr_Horse","20","25.05.08","fr|francais|horse|dr_horse|gameplay|let's play|Grounded|grounded 2","15680","0","0","112","https://i.ytimg.com/vi/jrJskz4anmc/default.jpg","False","True","Grounded FR - Gameplay / Let's Play🎮 Acheter vos jeux moins cher: https://www.instant-gaming.com/?igr=DrHorse💻 Acheter un serveur de jeu GPortal: https://www.g-portal.com/?ref=Dr_Horse🎧 Discord communautaire: https://discord.gg/cyb0rg🐦 Twitter: https://twitter.com/Dr_HorseYT🎵 TikTok: https://www.tiktok.com/@dr_horse_yt"
"kLJiDhOAkJQ","Je joue UNIQUEMENT AU PISTOLET sur Warzone (c’est n’importe quoi…)","2025-08-04T18:01:57Z","UCoq_quBChFaV5znD5sw8urQ","Proze Live","20","25.05.08","FaZe Proze|Proze|Proze Gaming|FR|QC|FaZe","16339","0","0","50","https://i.ytimg.com/vi/kLJiDhOAkJQ/default.jpg","False","True","Je suis en live ICI: http://twitch.tv/prozeAbonne-toi à la CHAINE PRINCIPALE: https://www.youtube.com/@Proze Follow pour PLUS DE CONTENU:📸Instagram: http://instagram.com/proze🐤Twitter: http://twitter.com/simplyproze🚀TikTok: https://www.tiktok.com/@prozee"
"OI_N6301pN0","Est ce que le Lancement du 13ème Clashiversaire est un Flop ?","2025-08-04T14:30:20Z","UC0oW9e0W6ACnHY48ZKw6c7g","Elchiki - Clash Of Clans","20","25.05.08","elchiki|elchiki coc|clash of clans|coc fr|clash of clans fr|challenge|3 étoiles|nouveau|mise à jour|idée|concept|trophée légendaire|mises à jour|minerai|13 ème clashiversaire|flop|prix","27929","0","0","158","https://i.ytimg.com/vi/OI_N6301pN0/default.jpg","False","True","Est ce le Lancement du 13ème Clashiversaire est un Flop ?Le teaser : https://www.youtube.com/watch?v=0fvagxe8vgQ🪙 Le Supercell Store : https://store.supercell.com/en?boost=elchiki👕 Pour soutenir la chaîne et acheter un t-shirt : https://elchiki.store/Activer mon code créateur : https://link.clashofclans.com/fr?action=SupportCreator&id=elchikiInsta : Elchiki_ytTiktok : https://www.tiktok.com/@elchiki_cocTwitter : https://twitter.com/elchiki_cocTwitch : https://www.twitch.tv/elchiki_cocDiscord : https://discord.gg/RfXFaB2Contact : contact.elchiki@gmail.comDevenir membre : https://www.youtube.com/channel/UC0oW9e0W6ACnHY48ZKw6c7g/joinMa chaîne YouTube Elchiki est consacrée au jeu mobile Clash of Clans. Vous y retrouverez du contenue divertissant et beaucoup de conseils pour progresser sur Clash Of Clans. Il y a des tutoriels pour faire 3 étoiles, des conseils pour farm, pour attaquer et des aventures à suivre !"
"zJzM8Hhir0s","Monday MOTIVATION leaves viewers ENERGIZED and MAXIMIZED to conquer the week","2025-08-05T07:17:44Z","UC1K86xhR5OHR-s04jWYW2RA","Spartakus","20","25.05.08","call of duty|bo6|black ops 6|warzone|warzone 4|warzone new|cod|warzone funny|cod funny clips|call of duty funny moments|warzone funny moments|Meta smg|meta AR|meta sniper|challenge|easter egg|bo6 zombies|multiplayer|bo6 multiplayer|ranked play|top 250|one shot sniper|hackers|cheaters|glitch|wall hacks|best loadout|loadout|gas mask|360 snipe|jgod|spartakus","27544","0","0","0","https://i.ytimg.com/vi/zJzM8Hhir0s/default.jpg","False","True","🔴LIVE here on YouTube DailyBecome a Member: https://www.youtube.com/@SpartakusLIVE/membership🔔  Subscribe and ring the bell to get notified!ALL The Links: https://spartakus.gg/linksSpartakus' Tiger Blood - Use code Spartakus for 10% off!https://advanced.gg/pages/partner-spartakus/?ref=SpartakusDonate here: https://streamlabs.com/spartakuslive2/tipCashapp: $SpartakusFBVenmo: @SpartakusFB"
"O69F7GNpGTk","NINTENDO SWITCH 2 : ENFIN !! ULTRA IMPORTANT 😱 FINI MACRONIX & NOUVELLES CARTOUCHES : EXPLICATIONS !","2025-08-05T04:30:28Z","UCrUjXTkEw9sJUHcip8duOzw","Edouard_EMB","20","25.05.08","Nintendo Switch 2|Switch 2|Unboxing|Switch|Nintendo Switch|Switch Pro|edouard emb|jeux Switch|jeux Switch 2|rumeur|Nintendo Direct|2025|date|prix|Dock|retro compatibilité|joycon|trailer|sortie|SOURIS|TEST|BUG|VRR|RAY TRACING|120FPS|4K|GAME KEY CARD","9956","0","0","68","https://i.ytimg.com/vi/O69F7GNpGTk/default.jpg","False","True","NINTENDO SWITCH 2 : NEWS, CAPSULES & DISCUSSIONS CHAQUE JOUR 🔥 Devenez MEMBRES de la chaine pour accéder aux vidéos en avant-première ►https://www.youtube.com/channel/UCrUjXTkEw9sJUHcip8duOzw/join ❤️ABONNE TOI ► https://goo.gl/TrKCLQ (↓ déroule la description ↓) Site de commande des Joycon Nyxi : https://shln.top/IX1jXzTsCODE PROMO : EMB ( pour -10% )#NintendoSwitch2 #Switch2 #NintendoSwitch🎮 NINTENDO SWITCH 2 🎮_____________________________________________- Nintendo Switch 2 ➡️ https://amzn.to/42UTGAx- Nintendo Switch 2 Pack Mario Kart ➡️ https://amzn.to/3S1YwWj- Carte Micro SD EXPRESS Mario 256Go ➡️ https://amzn.to/3ECf0By- Pochette de transport et protection d’écran Nintendo Switch 2 ➡️ https://amzn.to/447dKAJ- Manette Pro Nintendo Switch 2 ➡️ https://amzn.to/3YNXJMv- Paire de Volants Joycon 2 ➡️ https://amzn.to/3RzcGOK- Paire de Joycon 2 ➡️ https://amzn.to/3Y9XIm0- Caméra Plante Piranha ➡️ https://amzn.to/4cHTvvA- Caméra Nintendo Switch 2 ➡️ https://amzn.to/4jwxYcc- Mario Kart World ➡️ https://amzn.to/3GidTaO- Donkey Kong Bananza ➡️ https://amzn.to/4cS4WRM- Zelda Tears of the Kingdom Switch 2 Edition ➡️ https://amzn.to/3GiH6SL- Zelda Breath of the Wild Switch 2 Edition ➡️ https://amzn.to/44ClZ82- Street Fighter 6 ➡️ https://amzn.to/3S3sSYB- Bravely Défault Switch 2 ➡️ https://amzn.to/4jFauBc- Super Mario Party Jamboree - Nintendo Switch 2 Edition + Jamboree TV ➡️ https://amzn.to/4jJEMm6- Rune Factory Guardian of Azuma ➡️ https://amzn.to/3ECWLMm- Daemon X Machina Titanic Sion ➡️ https://amzn.to/4lIFi5F🎮 MES CONSOLES 🎮_____________________________________________NINTENDO SWITCH OLED ➡️ https://amzn.to/3F7Bwh2PS5 ➡️ https://amzn.to/3goJTJpXbox Series X ➡️ https://amzn.to/2Ss6mxgXbox Series S ➡️ https://amzn.to/3go8X3l📽️ MON MATOS TOURNAGE📽️ _____________________________________________Sony Alpha ZV-E10 ► https://amzn.to/46ldKKNCamLink 4K Elgato ► https://amzn.to/3sIBhI2Micro Logitech Blue Sona ► https://amzn.to/3MPOFAXEcran Asus Ultra Wide ► https://amzn.to/3GbJxTQFond Vert Elgato ► https://amzn.to/47DvimuStreamDeck Elgato ► https://amzn.to/3sIB87sBoitier de Capture Elgato ► https://amzn.to/47GjRur_____________________________________________📸 MES RESEAUX & CHAINES 📸_____________________________________________EMBTV ► https://www.youtube.com/embtvTWITCH ► https://www.twitch.tv/edouard_embINSTAGRAM ► https://www.instagram.com/edouardcuisineTIKTOK  ► https://tiktok.com/@edouard_embTIKTOK CUISINE ► https://tiktok.com/@edouardcuisine CONTACT MAIL ►  embfaitdugaming@hotmail.com____________________________________________📰 SOURCES 📰____________________________________________- https://www.nintendolife.com/news/2025/08/metroid-prime-4-beyond-playable-at-fan-expo-canada-this-month- https://x.com/kiwitalkz/status/1951705042060497286- https://universonintendo.com/cartuchos-do-switch-2-podem-ganhar-novas-opcoes-de-tamanhos-no-futuro-aponta-analise/📰 SOMMAIRE 📰____________________________________________Sommaire : Introduction : 00:00SWITCH 2, Metroid & sortie impactée, explications : 00:41SWITCH 2, NOUVELLES CARTOUCHES : 07:59Les liens Amazon sont proposés dans le cadre d'une collaboration commerciale traduite par des liens d'affiliation ;Par ailleurs, certaines miniatures de la chaine sont réalisées avec l'IA ; Merci de votre attention !"
"5AoYolDMmMs","Retour sur Call of Duty : Warzone et DÉJÀ un CHEATER ! (Vivement BATTLEFIELD 6)","2025-08-04T10:01:08Z","UC9z2GEML8BiTbIOGtF0bZ7A","SkyrrozLive","20","25.05.08","battlefield|battlefield 6|skyrroz|chowh1|bf|battlefield 6 gameplay|battlefield 2025|exclu|découverte|warzone|warzone gameplay|call of duty|cod","28502","0","0","105","https://i.ytimg.com/vi/5AoYolDMmMs/default.jpg","False","True","Gameplay sur Call of Duty : Warzone ! Vivement Battlefield 6👉 Chaîne Twitch pour suivre les live : https://www.twitch.tv/skyrroztv► Mon TikTok : https://www.tiktok.com/@skyrrozofficiel► Ma casquette et ma boutique sur https://www.skyrroz.fr► Holy pour rester en forme : https://fr.weareholy.com/?ref=skyrroz%2F%3Fref%3Dskyrroz&utm_source=Twitch&utm_medium=creator&utm_campaign=skyrroz((Utilise le code “skyrroz” pour 10% de réduction !)► Ma Manette Scuf Gaming PS4 PS5 / Xbox One et Xbox Series X / S : http://scuf.co/skyrroz(Utilise le code “skyrroz” pour 5% de réduction !)► Mon Casque Turtle Beach : https://roc.gg/TbSkyrroz-10% de reduction avec le Code: Skyrroz !(Applicable sur ROCCAT aussi : https://roc.gg/RocSkyrroz )► INSTAGRAM : https://www.instagram.com/skyrroz/►TWITTER : http://twitter.com/FRSkyRRoZBusiness contact : skyrroz@outlook.es"
"Nmokm8t-mFk","AGENT DE JOUEUR : FIN DE CARRIÈRE EN LÉGENDE ?","2025-08-04T16:00:40Z","UCNL-PktThtkU9V9mUSA6_xw","Arthur Ray","20","25.05.08","beta|arthur|ray|ry|artur|carriere|test|arthurray|zero|héros|let's|play|ket|let|pla|fm|football manager|fm24|football|soccer|manager","11133","0","0","54","https://i.ytimg.com/vi/Nmokm8t-mFk/default.jpg","False","True","AGENT DE JOUEUR : VERS LE BALLON D'OR ? 💜  Twitch : https://www.twitch.tv/arthurray📸  Instagram : https://www.instagram.com/xarthurray💙  Twitter : https://twitter.com/rayurart💜 Discord : https://discord.gg/FBHmpQv📧 Adresse mail Pro : Arthurray@20ty.gg🎁 Devenir SOCIO et soutenir la  chaine pour 5 euros par mois : https://www.youtube.com/channel/UCNL-PktThtkU9V9mUSA6_xw/joinAGENT DE JOUEUR : FIN DE CARRIÈRE EN LÉGENDE ?A propos : Je suis Arthur Ray, créateur de contenu sur Football Manager et autre jeux de management, que ce soit des carrieres, let's play, expériences ou bien encore des tutos, on vit ensemble tous les soirs à 18h une aventure. En ce moment sur FM24 on cherche les pépites pour nous amener à gagner la ligue des champions dans le Zéro à Héros ! #footballmanager  #agent #fm24"
"jDJViDWoSQ4","🔴LIVE - WARZONE CHALLENGES WITH @DrDisRespect & @BobbyPoff","2025-08-05T05:01:23Z","UCsq8fAShuq3wvTxJbNehaEA","Rallied","20","25.05.08","rallied|rallied warzone|warzone|rallied stream|warzone stream|warzone live stream|warzone live|warzone rallied|warzone bobbypoff|live warzone|stream warzone|warzone livestream|drdisrespect|drdisrespect warzone|dr disrespect|live stream warzone|bobbypoff|bobbypoffgaming|bobbypoff warzone|bobbypoffgaming warzone|battlefield 6|battlefield|battlefield reveal","66360","0","0","0","https://i.ytimg.com/vi/jDJViDWoSQ4/default.jpg","True","True","LIKE THE LIVE & SUBSCRIBEWarzone Live w/ RalWarzone Live Stream w/ RalliedTIP / DONATE HERE: https://streamelements.com/rallied/tipBusiness - ral.partnerships@Gmail.com#warzone  #Verdansk #CallOfDuty"
"kfxqmAv7vs4","🔴 RANKED RELOAD UNREAL  + Parties Perso avec la Commu ! 😎","2025-08-04T21:42:30Z","UCwmVY1-tpN0aMuOsBUjGx5g","SnokzyTheV8","20","25.05.08","[none]","58915","0","0","3","https://i.ytimg.com/vi/kfxqmAv7vs4/default.jpg","False","True","SNOKZY 1V1  ⚔ : 1775-9837-7406SUB : https://www.youtube.com/channel/UCwmVY1-tpN0aMuOsBUjGx5g/join"
"oMtq2oUvIVY","ENQUÊTE MASTERCLASS... (Blood on the Clocktower)","2025-08-04T15:01:21Z","UCBchCJ5H7vwSXycjw7f1Hlg","Guep 2.0","22","25.05.08","LG|Guep LG|Guep LG UHC|LG UHC|Guep loup garou|Guep loup garou uhc|loup garou uhc|guep minecraft|guep guill|guill lg|theguill84 lg|guep theguill84|lg groupe|guep groupe|LG city world","14733","0","0","79","https://i.ytimg.com/vi/oMtq2oUvIVY/default.jpg","False","True","Nouveau mode de jeu stratégique organisé par FUKANO. Nous allons une nouvelle fois endosser le rôle d'enquêteur dans ce jeu exceptionnel, puisse-t-on démasquer les méchants.Streams tous les soirs ici : https://www.twitch.tv/guepChaîne VOD : https://www.youtube.com/channel/UCSQQN9bJlaAHYe10wujtnlA#Minecraft #LGUHC #Guep Blood on the Clocktower du 26/07/2025Contact pro : contact2@guep.ggChaîne principale : https://www.youtube.com/channel/UCrHP6O8ZiyBOVwU7JzmVgrQTwitter : https://twitter.com/GuepMC"
