video_id,title,publishedAt,channelId,channelTitle,categoryId,trending_date,tags,view_count,likes,dislikes,comment_count,thumbnail_link,comments_disabled,ratings_disabled,description
"wsH181bVnwU","La Belette","2025-08-02T10:01:38Z","UCfgwES7XF5xzFX-MS3upU9A","Kamelon Officiel - Topic","10","25.05.08","Kamelon Officiel|Mikado|Kamelon|La Belette","178996","0","0","0","https://i.ytimg.com/vi/wsH181bVnwU/default.jpg","False","True","Provided to YouTube by The Orchard EnterprisesLa Belette · Kamelon Officiel · Mikado · KamelonLa Belette℗ 2025 NWE WORLDWIDE / Carry Out ProductionReleased on: 2025-08-03Producer: MikadoAuto-generated by YouTube."
"cWNWAtd-dMo","RÉACTION au Trailer d'AVATAR 3","2025-08-03T10:00:55Z","UCcliHNE38fJ4n4gYYB0TCQw","Durendal1","1","25.05.08","Cinéma|Durendal|Film|Vlog|Critique|Avatar|James Cameron|Sam Worthington|Zoe Saldana|Sigourney Weaver|Réaction|Teaser|Trailer|Fire and Ash|De feu et de cendres","75357","0","0","787","https://i.ytimg.com/vi/cWNWAtd-dMo/default.jpg","False","True","Ma réaction au trailer d'Avatar : de Feu et de Cendres, réalisé par James Cameron, prévu pour le 17 Décembre 2025.#Avatar3 #AvatarFireAndAsh #Avatar3Trailer0:00 intro0:51 Avatar et moi2:10 Réaction4:43 Avis à chaud6:16 Analyse d'image6:24 Retour des rochers flottants6:54 3D sous l'océan7:04 Retour des divins spermatozoïdes7:26 Romance Lo'ak/Tsireya8:09 La force des ancêtres8:50 Tribu du vent ?9:08 Coucher de soleil9:18 Rapport d'échelle9:33 Village du feu11:26 3D dans la jungle11:56 Lo'ak mal en point12:10 Les Tulkuns12:55 Le retour de Spider13:14 Le retour des engueulades Lo'ak/Jake13:34 Jake et Neytiri14:58 Quaritch au village du feu15:49 Jake et Spider16:00 Un grand pouvoir...16:42 Rencontre du Troisième Type17:45 3D sur l'océan18:08 La leader du feu18:26 Les zooms documentaires19:15 Fire bending ?19:46 Mise en scène documentaire19:58 Chérie, j'ai ENCORE perdu les gosses20:16 Spider suffoque21:42 Subjectif Spider21:59 Humains et Na'vis22:11 Jake paradé22:43 La raciste pacifiste22:58 Plan pour plan : Payakan23:17 À la bataille !23:35 Fumigènes/feu24:09 Plan pour plan : Neytiri24:32 Un climax magnétique25:05 Spider chute26:09 Caméra épaule26:25 La chialeuse26:36 Jake et Quaritch27:01 Yeux à la Burton27:10 Votre déesse...27:31 Conclusion29:08 L'affiche31:18 Pas de retard supplémentaireDailymotion : http://www.dailymotion.com/Durendal1Tipeee : https://www.tipeee.com/le-cinema-de-durendalFacebook : https://www.facebook.com/LeCinemaDeDurendalTwitter : https://twitter.com/CinemaDurendal"
"sMiHAOUe6ow","New Season: Knights of the Starr Table!","2025-08-05T09:56:51Z","UCooVYzDxdwTtGYAkcPmOgOw","Brawl Stars","20","25.05.08","brawl stars|mobile game|mobile strategy game|mobile rpg|mobile battle royale|battle royale|supercell game|new season|knights of the starr table|bo|doug|belle|amber|brawl pass|jessie|brawl stars animation|quest for quests|quests","630989","0","0","1670","https://i.ytimg.com/vi/sMiHAOUe6ow/default.jpg","False","True","The Knights of the Starr Table Season is almost here! Starting on the 7th of August ⚔️👑 King Starrthur Bo is the Brawl Pass Skin!🏹 King Archer Bo & Knight Bo Chromas + Knight Title in the Brawl Pass Plus📜 Brawl Pass Buff Quests + Daily Quests🪵 Trunk release on the 28th🏆 Trophy Thieves game mode is back!🪖 New Knight Skins and more!Download NOW!! ►► https://supr.cl/2K62CZGSubscribe!! ►► https://supr.cl/subscribe"
"xkx7hbKh6Ec","VJ feat Seydou Che - Fatou Sangaré (Clip Officiel)","2025-08-04T18:00:53Z","UCNiTCM_vGvvr8iJ8EsmtRaw","VJ","10","25.05.08","VJ|mouhamedvj|love|amour|alum|ep|hoside|rnb|rap|hiphop|senegal|daka|dip|dundu|gis|jahman|amira|akhlou|brcik|amadeus|jeeba|nitdof|mbalax|ngaka|sonko|sadio|mane|serie|tv|marodi|event|prod|bete|mia|guisse|waaly|seck|youssou|ndour|iss|814|fatou|sangare|dm|mali|bamako|sidiki|siabate|seydou|che|oumou|Young-Bg Bagama Bandjougou|fassema|baabel|afrobeat|moi|clip","166340","0","0","661","https://i.ytimg.com/vi/xkx7hbKh6Ec/default.jpg","False","True","Production : Hoside & BlZ Co-Directed :Selemane dieye & Tidjane Traoré Exécutive production :Fefsy Prod Assistant & Decoration sadik def Assistant Production : Soubana DOP : Leye Gueye Focus puller : Weuz Ndiaye Lights Fadel Machiniste- Brasmagik Make up: Maimouna keitaStylisme: Bright look (Elzo Booba)Nous remercions nos partenaires : Air Sénégal et Dolima."
"X_q9JoVcImI","Overwatch 2 x NERF | Gameplay Trailer","2025-08-04T16:00:06Z","UClOf1XXinvZsy4wKPAkro2A","PlayOverwatch","20","25.05.08","Overwatch 2|Overwatch","268125","0","0","1299","https://i.ytimg.com/vi/X_q9JoVcImI/default.jpg","False","True","Gear up for the BLAST of a lifetime in Overwatch 2 x NERF!Add some foam-fueled upgrades to your arsenal with a collection of cosmetics themed after iconic NERF gear.Pick your plastic with Genji’s Slingerang + Power Blast Bat, Baptiste’s Loadout Galactic Commander, Hanzo’s Big Bad Bow, Mei’s Super Soaker XP100, Soldier: 76’s N Series Pinpoint, and Cassidy’s Maverick + Vortex Football + his new NERF Legendary Skin.But wait, there’s more! Put your NERF skills to the test in our new limited-time game mode, NERF or Nothin’, where every elimination gives you a fresh NERF blaster to master. You’ll also be able to earn NERF-themed rewards like voice lines, sprays, a weapon charm, and Tracer’s GelFire Pro as you blast through event challenges.Get NERF’d like never before when Overwatch 2 x NERF starts Aug 5!_Follow #Overwatch2 for the latest news:Instagram: https://www.instagram.com/playoverwatchTikTok: https://www.tiktok.com/@overwatchTwitter: http://www.twitter.com/playoverwatch Facebook: http://www.facebook.com/playoverwatch"
"7rUEclo9yGs","J’ai Amélioré le Jardin de mes Abonnés pendant 24h ! (Grow a Garden)","2025-08-04T15:55:26Z","UCiFyJ_EBmF2XJuR9buWE_3A","Unchained_Off","20","25.05.08","unchained|unchained_off|unchained fortnite|fortnite|jeu vidéo|squeezie|gameplay|drole|gratuit|unchained gaming|fortnite battle royale|vbucks|mise à jour|chapitre|maj|fortnite maj|fortnite chapitre|skin gratuit|boutique|VBucks|fortnite clip|défi top 1|top 1|xp gratuit|glitch|fortnite xp|map xp|exp|unchained map|hack|nouveau|short|chanceux|roblox|unchained roblox|robux|secret|roblox brainrot|grow a garden|roblox garden|garden|mythes|unchained mythes|jardin","210403","0","0","2220","https://i.ytimg.com/vi/7rUEclo9yGs/default.jpg","False","True","J'ai transformé le jardin éclaté au sol d'un abonné en un paradis avec des fruits et des pets ultra rares sur Grow a Garden ! Pour ça comme d'habitude, j'ai dépenser des robux sans compter...🟪Code MAP Octo Game 3 : 7473-0134-7600 (publicité)🟦Code MAP 1V1V1 RELOAD : 0785-7672-3215 (publicité)🟥Code MAP Lama Wars : 4660-4454-3176 (publicité)🟨Code MAP Super Pit : 8068-9359-0183 (publicité)Code MAP SUPER MAMMOTH : 1699-5054-8430 (publicité)Code MAP Red vs Blue :  8970-6014-8339 (publicité)🎁Abonne-toi à ma chaine IRL ► https://bit.ly/Subscribe2Unchained💖MON INSTA : https://www.instagram.com/unchained_off✅Code : unchained sur Fortnite ! (publicité)🔴MON TWITCH : https://www.twitch.tv/unchainedsurtwitch💜Discord : https://discord.gg/unchained🖤Mon Tik Tok : unchained_off#epicpartner #unchained #roblox"
"CQIYbytAyVQ","Tyla x Wizkid - DYNAMITE (Official Music Video)","2025-08-04T19:30:06Z","UCr2xjaS7CIx1OY7hYwrXb8A","TylaVEVO","10","25.05.08","tyla|new artist|getting late|tyla to last|to last tyla|to last|last|kooldrink|epic|epic records|new music|fax records|electronic|electronic music|dance music|dj lag|overdue|tyla been thinking|been thinking tyla|been thinking|ayra starr|ayra starr tyla|tyla ayra starr girl next door|girl next door|tyla girl next door|ayra starr girl next door|girl next door tyla ayra starr|water|tyla water|water tyla|tyla bliss|DYNAMITE|Tyla Wizkid","590160","0","0","5046","https://i.ytimg.com/vi/CQIYbytAyVQ/default.jpg","False","True","Tyla x Wizkid - DYNAMITE (Official Music Video)DYNAMITE available at: https://tyla.lnk.to/WWPFollow Tyla:https://instagram.com/tylahttps://www.tiktok.com/@tyla_https://twitter.com/Tyllaaaaaaa(C) 2025 FAX Records, under exclusive license to Epic Records, a division of Sony Music Entertainment#Tyla #Wizkid #DYNAMITE"
"wuuqf7GK78M","ELLA MCCAY Bande Annonce VF (2026) Emma Mackey, Woody Harrelson","2025-08-04T16:28:16Z","UC_i8X3p8oZNaik8X513Zn1Q","FilmsActu","1","25.05.08","cinema|filmsactu|Bande Annonce|Film|2025|Français|VF|Ella McCay|Ella McCay Bande Annonce VF|Woody Harrelson|Jamie Lee Curtis|Emma Mackey","14190","0","0","29","https://i.ytimg.com/vi/wuuqf7GK78M/default.jpg","False","True","✩ Les Films à VOIR ?  Ils sont ICI ► https://www.youtube.com/playlist?list=PL843D2ED8D80FA673ELLA MCCAY Bande Annonce VF (2026) Emma Mackey, Woody Harrelson, Jamie Lee Curtis© 2025 - 20th Century Studios"
"poD4z4aIkDU","ÇA Y EST, JE SUIS BON AU JEU (Counter-Strike 2)","2025-08-04T16:01:30Z","UCY-_QmcW09PHAImgVnKxU2g","SQUEEZIE GAMING","20","25.05.08","squeezie best of|squeezie moments marrants|squeezie compilation","178519","0","0","149","https://i.ytimg.com/vi/poD4z4aIkDU/default.jpg","False","True","💚 Mon équipe Esport, les Gentle Mates : https://gentlemates.com💜 Follow mon Twitch pour ne pas rater mon prochain live : https://twitch.tv/squeezie🔔 ABONNE-TOI : https://bit.ly/2NLgbSC (au moins 2 best of chaque semaine)🎮 Retrouve toutes les rediffusions sur ma chaîne Replay : https://bit.ly/3vASgeb🔥 Télécharge l'extension Squeezie pour ne rater aucun live : https://extensionsqueezie.fr―――⁍ Twitch : https://twitch.tv/squeezie⁍ Twitter : https://twitter.com/xSqueeZie⁍ Twitter² : https://twitter.com/SqueezieTV⁍ Discord : https://discord.gg/Squeezie⁍ Reddit : https://reddit.com/r/Squeezie―――⭐ Chaînes des Participants :@L0ckl34r @CodJordan23 @wankilfr ―――Montage vidéo : @SK0RR0R"
"HvOzuF9V6m8","Dika ft. @NapsOfficiel  - Vida Loca (Clip Officiel)","2025-08-05T10:00:06Z","UC_nXgjOQR07QTebE0gAf2Kw","Dika Officiel","10","25.05.08","Rap|Rap français|Rap français 2025|Rap Marseille|Rap Marseille 2025|Rap été|Rap été Marseille|Dika|Naps|Naps rap|Planète rap naps|Planète rap Dika|Planète rap Marseille|La code rap Marseille|Musique été|Musique tik tok 2025|Musique été 2025|Rap plage|Musique plage|Clip rap|Clip naps|Clip Dika|Clip rap Marseille|Clip nouveauté Marseille","2928","0","0","88","https://i.ytimg.com/vi/HvOzuF9V6m8/default.jpg","False","True","NOUVEAU TITRE Vida Loca avec ​⁠Naps disponible sur toutes les plateformes de streaming : Dika.lnk.to/VidaLoca                   YOULEUH RECORDS           Directed by : MassimoProd : TOTOBEATS_____________________________________________Contact DIKA : Mail : Dikaofficiel13@gmail.com Instagram : https://www.instagram.com/dikaofficie...Snap : https://www.snapchat.com/add/dika-off...Tiktok : https://www.tiktok.com/@dikaofff?_t=Z... Contact Management : https://www.instagram.com/youleuhreco..._____________________________________________Lyrics : Un bonbon qui prend le volantLamborghini plaqué PologneJe fume la beuh de la HollandeJte fais fumer, je suis galantY'a le jacuzzi, y'a le saunaElle aime la cité, la zoneDernière tenue de la RomaElle dit : « Ma vie, c'est les hommes »Quand tu parles, mets pas les mainsJ'agis, je parle pas tropJ'ai pas les motsGucci, Fendi, BalmainAquarium de frappes dans le quatre anneauxQuand tu parles, mets pas les mainsPour t'éteindre, tu connais, il faut t'allumerTes problèmes, c'est pas les miensJe suis serein, je rallume le calumetJ'avais plus de nouvellesDes fois, je suis tout seulDans le compresseurJe fume la beuh qui fait tousserOn est fait pour çaMets l'instru dans le BluetoothFais le boussaDiscret, j'allonge le dossierJe raconte la street dans ma zik, la vida locaElle me connaît pas à la base, elle dit que je suis un lossaEnsemble, tout jdid, et tu rodes en TestarossaTu baisses la vitre, tu la branches et elle te fait sa locaJe raconte la street dans ma zik, la vida loca(La vida loca, la vida loca)Je l'ai croisée par hasardOn devait se capterOn devait se revoirOn devait se rappelerJ'ai compris que j'avais percéQuand j'ai bercéMon fils dans la MaseratiOn est dans le topLes codes, c'est hotLe block, c'est calienteIl y a le poto qui m'appelleIl me dit : « Ce soir on sort »Ou on se cale devant l'alimOn écrit un single d'orJe voulais pas lui faire de la peineMais entre nous deux, c'est mortDes fois, je lui dis : « Je t'aime »Des fois, je lui insulte tous ses mortsJ'avais plus de nouvellesDes fois, je suis tout seulDans le compresseurJe fume la beuh qui fait tousserOn est fait pour çaMets l'instru dans le BluetoothFais le boussaDiscret, j'allonge le dossierJe raconte la street dans ma zik, la vida locaElle me connaît pas à la base, elle dit que je suis un lossaEnsemble, tout jdid, et tu rodes en TestarossaTu baisses la vitre, tu la branches et elle te fait sa locaJe raconte la street dans ma zik, la vida loca(La vida loca, la vida loca)Je raconte la street dans ma zik, la vida loca(La vida loca, la vida loca)#rap #marseille #Dika"
"dSQ5g4d2DEk","[Official Trailer] REVAMP THE UNDEAD STORY","2025-08-05T08:00:46Z","UC8BzJM6_VbZTdiNLD4R1jxQ","GMMTV OFFICIAL​​","24","25.05.08","GMMTV|จีเอ็มเอ็ม ทีวี|GMM Grammy","89772","0","0","1396","https://i.ytimg.com/vi/dSQ5g4d2DEk/default.jpg","False","True","ปัณณ์ (เปรม-วรุศ) ชายหนุ่มเจ้าของร้านขายวัตถุโบราณได้รับการว่าจ้างจากเพื่อนสนิทให้ไปซ่อมภาพวาด แต่ปัณณ์กลับถูกเศษกระจกบาดจนเลือดไปเปื้อนกับภาพเขียนเข้าโดยไม่ตั้งใจ ทำให้ รามิล (บุ๋น-นพณัฐ) ทายาทคนสุดท้ายของตระกูลแวมไพร์ที่ถูกผนึกไว้ในภาพวาดมากกว่าร้อยปีฟื้นขึ้นมา ทว่ารามิลกลับไร้พลังและกำลังถูกกลุ่ม “ฮันเตอร์” นักล่าแวมไพร์ตามล่า ปัณณ์จึงจำเป็นต้องช่วยเหลือรามิลให้พลังของเขาฟื้นคืน ด้วยการออกตามหาบริวารตนอื่นๆ จนทำให้ความสัมพันธ์ของทั้งคู่ค่อยๆ พัฒนาขึ้น การเดินทางของปัณณ์ รามิล และกลุ่มฮันเตอร์ที่กำลังตามล่าครั้งนี้จะเป็นยังไง และความสัมพันธ์ระหว่างมนุษย์กับแวมไพร์จะสามารถรักกันได้ไหม ติดตามได้ใน “REVAMP THE UNDEAD STORY” ทุกวันเสาร์ เวลา 20:30 น. ทางช่อง GMM25 และดูออนไลน์ เวลา 21:30 น. บนแอป iQIYI และเว็บ iQ.com ที่เดียวเท่านั้น เริ่มตอนแรก 23 สิงหาคมนี้กำกับซีรีส์ : ศิวัจน์ สวัสดิ์มณีกุลรายชื่อนักแสดงบุ๋น นพณัฐ กันทะชัย   รับบท  รามิลเปรม วรุศ ชวลิตรุจิวงษ์   รับบท  ปัณณ์มาร์ค จิรันธนิน ตรัยรัตนยนต์  รับบท  เมธัสบาร์โค้ด ตฤณสิษฐ์ อิสระพงศ์พร  รับบท  คีอาร์อั๋น ณภัทร​ พัชรชวลิต   รับบท  เมฆิณเค เลิศสิทธิชัย            รับบท  เจตต์กระปุก พลอยนิรา หิรัญทวีศิลป์       รับบท  เอลีส์เอเจ ชยพล จุฑามาศ    รับบท  พอลเจเจ ชยกร จุฑามาศ    รับบท  แคสเตอร์แสตมป์ พนัชษ์กรณ์ ฤกษ์ศิริอารี รับบท  ปกป้อง#RevampSeriesติดตามทุกความเคลื่อนไหวของ GMMTV ได้ที่Facebook | https://www.facebook.com/GMMTVOFFICIALYouTube | https://www.youtube.com/GMMTVYouTube | https://www.youtube.com/GMMTVRECORDSInstagram | https://www.instagram.com/GMMTVX | https://twitter.com/GMMTVTikTok | https://www.tiktok.com/@gmmtvofficialWeibo | https://www.weibo.com/u/6146914790Threads | https://www.threads.net/@gmmtvWebsite | https://www.gmm-tv.com ติดต่อโฆษณา คุณชนิดา วงศ์ธนาภักดี โทร 02-669-8330 chanida.won@gmm-tv.com#GMMTV"
"cBY_AhQ10RU","100 Noobs essayent de piller ma Base (ultra sécurisée)","2025-08-04T17:35:04Z","UCBIVKUsOGwCg8RNpucEGp_g","Fiouze","20","25.05.08","[none]","127119","0","0","488","https://i.ytimg.com/vi/cBY_AhQ10RU/default.jpg","False","True","Aujourd’hui je construis une base claim pour tester les nouveaux Wither !👕Acheter les peluches Didier: http://fuzeshop.fr📚 Ma BD Fuze et Didier: https://amzn.to/38CqIvRMonteur : DofMineVenez jouer avec moi sur Paladium: https://paladium-pvp.fr/?ref=fuzeVenez jouer avec moi sur Modded: http://modded.fr/Envie de travailler avec moi ? https://jobs.fuzeiii.fr/🎬 Ma chaîne secondaire: https://www.youtube.com/channel/UCzTTYntJHARp5YCxakwUepA📷 Mon Instagram: http://instagram.com/fuzeIII_hd🐦 Mon twitter : http://twitter.com/FuzeIII🔴 Ma chaîne Twitch : http://twitch.tv/FuzeIII🎵 Mon TikTok: https://www.tiktok.com/@fuzeiii_yt💬 Mon Discord: http://discord.gg/fuzeiii👉 Code créateur EpicGames: FuzeLeVrai⬆️ Mon subbredit pour les memes: https://www.reddit.com/r/FuzeLeVrai/"
"_zc1DTmAuQM","Malakey - Elephuck (Clip Officiel)","2025-08-03T17:07:25Z","UCG96THEyEqWmcZJGxM0-MFQ","Malakey","10","25.05.08","[none]","234880","0","0","1214","https://i.ytimg.com/vi/_zc1DTmAuQM/default.jpg","False","True","Realisé par NellyprinceAbonne-toi à mon compte YouTube pour découvrir tous mes nouveaux projets  : 😊😊😊😊😊😊😊😊😊😊😊😊😊Facebook : https://www.facebook.com/MalakeyFBInstagram : https://www.instagram.com/malakeymarlonTwitter : https://twitter.com/MalakeyOfficiel------------------------#Malakey #Elephuck 2025"
"IR4gPH8S5SA","BATTLEFIELD 6 - Trailer de la bêta ouverte | PS5","2025-08-04T15:30:18Z","UC6X0-dNIk9_t8gFnavqN12g","PlayStation France","20","25.05.08","battlefield 6|battlefield 6 gameplay|battlefield 6 trailer|battlefield 6 multiplayer|battlefield 6 trailer reaction|battlefield 6 reaction|battlefield 6 fr|battlefield 6 gameplay fr|bf6|bf 6|bf6 trailer|bf6 multiplayer|nouveau battlefield|gameplay battlefield 6|battlefield 6 review|PlayStation|PlayStation France|PS5|PlayStation 5|PS5 pro|jeux ps5|ps5 games|trailer|video games|bf6 beta|bf6 open beta|battlefield 6 beta|battlefield 6 open beta","4152","0","0","21","https://i.ytimg.com/vi/IR4gPH8S5SA/default.jpg","False","True","BATTLEFIELD 6 sera disponible le 10 octobre sur PS5.Préchargez la bêta ouverte sur le PlayStation Store : https://store.playstation.com/fr-fr/product/UP0006-PPSA28176_00-BETABETA00000000Précommandez le jeu sur le PlayStation Store : https://store.playstation.com/fr-fr/product/UP0006-PPSA19534_00-SANTIAGOSTANDARDAbonnez-vous à notre chaîne pour ne louper aucune vidéo : https://youtube.com/playstationfranceLa bêta ouverte de Battlefield 6 commence ce week-end.Faites partie des premiers à rejoindre la PLUS GRANDE bêta de Battlefield. Rejoignez votre escouade, jouez sur des cartes et à des modes inédits et découvrez une guerre totale intense à l'aide de graphismes époustouflants et d'un gameplay nouvelle génération.Préparez-vous à vous battre, à gagner et à laisser votre marque dans la bêta ouverte de Battlefield 6 !Week-end 1 : 9 au 10 aoûtWeek-end 2 : 14 au 17 aoûtL'accès anticipé commence le 7 août.Suivez PlayStation France sur les réseaux sociaux :• 𝕏 (anciennement Twitter) : https://twitter.com/PlayStationFR• Instagram : https://instagram.com/PlayStationFR• Facebook : https://facebook.com/PlayStationFrance• YouTube : https://youtube.com/user/playstationfrance• Twitch : https://twitch.tv/PlayStationFRSite : https://www.playstation.comL'avis des joueurs entre en jeu, donnez le vôtre sur We Are PlayStation : https://www.weareplaystation.fr/#BATTLEFIELD6 #BATTLEFIELD #PS5 #PlayStation5 #PlayStation #PlayStationFrance"
"Pec22Lws0gc","J’ai Construit La BASE DE CHÂTEAU DE GLACE la plus SÉCURISÉE 99 NUITS DANS LA PIRE FORÊT","2025-08-05T07:03:00Z","UCLMKLU-ZuDQIsbjMvR3bbog","Furious Jumper","20","25.05.08","minecraft|drole|FURIOUS JUMPER|furious|fufu|humour|vidèos|chaine|multigaming|Roblox|Fortnite|Shorts|TikTok|J’ai Construit La BASE DE CHÂTEAU DE GLACE la plus SÉCURISÉE 99 NUITS DANS LA PIRE FORÊT|99 nuits dans la forêt 🔦 [ ❄️SNEOW BIOME]|99 Nights in the Forest SNOW BIOME|#Roblox|#FuriousJumper|#99NightsintheForest|la map la plus bizarre de fortnite|danse|noob train dans roblox|evolution de l'avatar|evolution de l'avatar roblox|defile de mode|secure base|base minecraft","47805","0","0","162","https://i.ytimg.com/vi/Pec22Lws0gc/default.jpg","False","True","99 nuits dans la forêt 🔦 [ ❄️SNEOW BIOME]99 Nights in the Forest SNOW BIOME▶️ Le Jeu : https://www.roblox.com/fr/games/79546208627805/99-Nights-in-the-Forest-CRAFTING✅Code : FURIOUS sur Roblox ! 🎁Abonne-toi à ma chaine Secondaire ► https://www.youtube.com/c/FuFuJumperChaîne de Clem : https://www.youtube.com/channel/UCaETNSWkInzoOQGu73jSUvg📸 Mon Insta : https://www.instagram.com/furiousjumperofficiel/🎵 Mon TikTok : https://www.tiktok.com/@furiousjumperofficiel💙 Mon Twitter : https://twitter.com/FuriousJumper👾 Mon Discord :  https://discord.gg/nJqMQ6JmQt👕 Ma Boutique de vêtements : https://furiousjumpershop.com📧 Adresse mail pro : contact@furious.yt#Roblox #FuriousJumper #99NightsintheForest"
"cNyjfjXV40k","Alphaville - Forever Young (Lyrics)","2025-08-01T16:01:11Z","UCnD0OseWT-jVB3xX1TAo1jg","GOD LYRICS","10","25.05.08","alphaville forever young|forever young|forever young alphaville|alphaville forever young lyrics|forever young lyrics|forever young alphaville lyrics|tiktok|tiktok song|tiktok remix|lyrics on screen","177558","0","0","13","https://i.ytimg.com/vi/cNyjfjXV40k/default.jpg","False","True","Alphaville - Forever YoungAlphaville - Forever Young (Lyrics)✅ Follow Alphavillehttps://youtu.be/YHRvDo8rUoQ?si=uHddGdD7ZnVsq9A4✅ Follow God Lyricshttps://x.com/god_lyrics_110?t=el3IoMlGSaRYKTsDzkYMGQ&s=09https://open.spotify.com/playlist/26Ax7mFwsdp6lxuLZhBKDk?si=pWHCDUH6RPCLGmIQ5ys1AAhttps://www.instagram.com/godlyricsmusic?igsh=MTg2NTZ6d3Vtb2poMg==Lyrics[Verse 1]Let's dance in style, let's dance for a whileHeaven can wait, we're only watching the skiesHoping for the best but expecting the worstAre you gonna drop the bomb or not?[Verse 2]Let us die young or let us live foreverWe don't have the power but we never say neverSitting in a sandpit, life is a short tripThe music's for the sad men[Verse 3]Can you imagine when this race is wonTurn our golden faces into the sunPraising our leaders, we're getting in tuneThe music's played by the, the mad man[Chorus]Forever young, I want to be forever youngDo you really want to live forever?Forever, and everForever young, I want to be forever youngDo you really want to live forever?Forever young[Verse 4]Some are like water, some are like the heatSome are a melody and some are the beatSooner or later, they all will be goneWhy don't they stay young?[Verse 5]It's so hard to get old without a causeI don't want to perish like a fading horseYouth's like diamonds in the sunAnd diamonds are forever[Verse 6]So many adventures couldn't happen todaySo many songs we forgot to playSo many dreams swinging out of the blueWe let them come true[Chorus]Forever young, I want to be forever youngDo you really want to live forever?Forever, and everForever young, I want to be forever youngDo you really want to live forever?Forever, and ever[Outro]Forever young, I wanna be forever youngDo you really want to live forever? (Forever)Tags#Alphaville #ForeverYoung #Lyricsalphaville forever young, forever young, forever young alphaville, alphaville forever young lyrics, forever young lyrics, forever young alphaville lyrics, tiktok, tiktok song, tiktok remix, lyrics on screen,"
